SUPERIOR SUCCESSION IMPORT & EXPORT COMPANY LIMITED,False,12/19/2005 12:00:00 AM +00:00
"Pang Mu Co.,Ltd.",False,3/15/2010 12:00:00 AM +00:00
SEIN SABAL PHOO & HTOO DISTRIBUTION COMPANY LIMITED,False,6/15/2017 12:00:00 AM +00:00
KYAUK SEINN WIN JADE GEMS & JEWELLERY COMPANY LIMITED,False,4/4/2012 12:00:00 AM +00:00
ORANITH TIP COMPANY LIMITED,False,6/16/2020 6:47:20 AM +06:30
GREEN PARTNER ENVIRONMENT (MYANMAR) (GPEM) COMPANY LIMITED,False,9/9/2016 12:00:00 AM +00:00
MYANMAR GEO BANNER MINING COMPANY LIMITED,False,11/22/2007 12:00:00 AM +00:00
SAN THABAR TRADING COMPANY LIMITED,False,11/22/2005 12:00:00 AM +00:00
POLE STAR MARINE COMPANY LIMITED,False,8/27/2018 3:24:41 PM +06:30
VIGOROUS VICTOR TRADING COMPANY LIMITED,False,10/10/2011 12:00:00 AM +00:00
MJ RELATIONS COMPANY LIMITED,False,3/16/2015 12:00:00 AM +00:00
HAN YADANAR FAMILY COMPANY LIMITED,False,10/24/2019 5:10:25 PM +06:30
SOE OPEN COMPANY LIMITED,False,7/23/2020 2:04:46 PM +06:30
SBB INTERFREIGHT COMPANY LIMITED,False,2/23/2017 12:00:00 AM +00:00
SHWE WAR  SAN  COMPANY LIMITED,False,10/9/2020 2:27:34 PM +06:30
"Better Jade & Gems Co.,Ltd.",False,5/7/2010 12:00:00 AM +00:00
"Lucky Mark Co.,Ltd",False,11/3/2006 12:00:00 AM +00:00
ACME TRAVELLING WAVE INDUSTRY COMPANY LIMITED,False,5/26/2017 12:00:00 AM +00:00
YANGON SCHOOL SOCIAL ENTERPRISE COMPANY LIMITED,True,9/29/2016 12:00:00 AM +00:00
ZALAT NI CONSTRUCTION COMPANY LIMITED,False,6/21/2019 2:33:05 PM +06:30
SHWE DAUNG MIN COMPANY LIMITED,False,7/13/2016 12:00:00 AM +00:00
PACIFIC BOLD PARAGON GROUP COMPANY LIMITED,False,3/1/2012 12:00:00 AM +00:00
LIN SHWE PYI STAR COMPANY LIMITED,False,10/16/2020 3:41:55 PM +06:30
KNACK  ENGINEERING AND TRADING COMPANY LIMITED,False,8/9/2013 12:00:00 AM +00:00
AFFINITY QUALITY TEST SERVICES COMPANAY LIMITED,True,10/7/2016 12:00:00 AM +06:30
DIAMOND KYAW COMPANY LIMITED,False,8/2/2019 12:00:00 AM +00:00
SHWE MYAING TAUNG TAN COMPANY LIMITED,False,12/4/2013 12:00:00 AM +00:00
AUNG HTET MYINT COMPANY LIMITED,False,11/11/2016 12:00:00 AM +00:00
"Sun Dream Export & Import Co., Ltd.",False,6/7/2010 12:00:00 AM +00:00
LU HTU GROUP COMPANY LIMITED,False,6/18/2019 4:29:05 PM +06:30
Straight Mining Resources Company Limited.,False,7/30/2012 12:00:00 AM +00:00
HEIN NAING AUNG COMPANY  LIMITED,False,9/29/2015 12:00:00 AM +06:30
KAREN LIGHT COMPANY LIMITED,False,10/7/2019 12:00:00 AM +06:30
ELYSIAN COMPANY LIMITED,False,4/5/2019 12:00:00 AM +00:00
"Zayyadana Finished Wood And Furniture Industry Co., LTd.",False,7/20/2001 12:00:00 AM +00:00
UNITED SKILLS ENGINEERING & CONSTRUCTION COMPANY LIMITED,False,9/23/2015 12:00:00 AM +06:30
IDEA (INNOVATIVE DEVELOPMENT BY ENVIRONMENTAL ACCOUNTABILITY) COMPANY LIMITED,False,8/29/2020 7:29:13 AM +06:30
DMSS COMPANY LIMITED,False,10/24/2019 10:39:30 AM +06:30
KAUNG HTET PHYO COMPANY LIMITED.,False,6/14/2016 12:00:00 AM +00:00
TARA AUNG COMPANY LIMITED,False,10/28/2014 12:00:00 AM +00:00
KADAY HEIN COMPANY LIMITED,False,11/6/2019 12:00:00 AM +06:30
"Sai Than Trading Co., Ltd.",False,9/7/1992 12:00:00 AM +00:00
MYSQUAR LIMITED,True,3/13/2015 12:00:00 AM +00:00
NEO TECH MYANMAR COMPANY LIMITED,False,12/11/2013 12:00:00 AM +00:00
BEST PARTNER OF RADIOLOGY GROUP COMPANY LIMITED,False,5/18/2018 12:00:00 AM +00:00
HEIN MIN AYE COMPANY LIMITED,False,8/21/2019 4:53:03 PM +06:30
DANU THUKHA COMPANY LIMITED,False,3/12/2019 8:27:40 PM +06:30
"Refine Tech Industry Co., Ltd.",False,1/7/2011 12:00:00 AM +00:00
"May Mann Co.,Ltd.",False,6/10/1996 12:00:00 AM +00:00
EMPIRE TREASURE COMPANY LIMITED,False,1/31/2018 12:00:00 AM +00:00
ROYAL PATH TRAVEL & TOUR COMPANY LIMITED,False,11/15/2017 12:00:00 AM +00:00
"Yadanar De Yay Hlaing Gems. Co.,Ltd.",False,8/19/2005 12:00:00 AM +00:00
"Myanmar UT 3 Co.,Ltd.",False,5/5/1997 12:00:00 AM +00:00
SUPER WAVE GENERAL SERVICES COMPANY LIMITED,False,9/6/2016 12:00:00 AM +00:00
G7 TOWER GROUP COMPANY LIMITED,False,2/19/2016 12:00:00 AM +00:00
ETHNIC ENGINEERING COMPANY LIMITED.,False,2/5/2016 12:00:00 AM +00:00
ROYAL NINE MYANMAR TRADING COMPANY LIMITED,False,4/25/2014 12:00:00 AM +00:00
ES ELECTRICAL ENGINEERING COMPANY LIMITED,False,4/23/2015 12:00:00 AM +00:00
I M POSSIBLE COMPANY LIMITED,False,9/20/2013 12:00:00 AM +00:00
"Sin Nyi Naung Co.,Ltd.",False,12/7/2011 12:00:00 AM +00:00
"Lucky Fish Trading Co.,Ltd",False,7/5/2005 12:00:00 AM +00:00
DCO COMPANY LIMITED,False,9/10/2019 11:03:35 PM +06:30
CIVIL GOLDEN LAND CONSTRUCTION COMPANY LIMITED,False,12/27/2013 12:00:00 AM +00:00
GLOBAL DEAL COMPANY LIMITED,False,3/10/2016 12:00:00 AM +00:00
OPERATION BRIDGE LIMITED,True,8/27/2014 12:00:00 AM +00:00
YE  MAUM  HONE  SECURITY  SERVICE  COMPANY  LIMITED,False,3/9/2019 2:35:08 PM +06:30
SOE SOE TUN COMPANY LIMITED,False,9/30/2018 5:05:09 PM +06:30
"THI LAR MYAY CONSTRUCTION CO.,LTD.",False,9/23/2009 12:00:00 AM +00:00
THE EXPORT IMPORT BANK OF KOREA ,False,12/18/2013 12:00:00 AM +00:00
ZPG ZAY PHARMACITICAL GROUP COMPANY LIMITED,False,1/31/2013 12:00:00 AM +00:00
PYAE WA KYAW COMPANY LIMITED,False,11/28/2019 3:37:25 PM +06:30
TAW WIN MALIWAM COMPANY LIMITED,False,10/29/2015 12:00:00 AM +00:00
BRIGHTINO COMPANY LIMITED,False,8/18/2014 12:00:00 AM +00:00
GRAND ARCADIA COMPANY LIMITED,False,5/17/2017 12:00:00 AM +00:00
MYANMAR GOLDEN BURANCHI TRAVELS & TOURS COMPANY LIMITED,False,1/30/2015 12:00:00 AM +00:00
NILAR SHWESIN TRADING COMPANY LIMITED,False,9/9/2010 12:00:00 AM +00:00
ZAR NI AUNG AND SONS TRADING COMPANY LIMITED,False,9/20/2010 12:00:00 AM +00:00
TUN TAUK FAMILY (TTF) COMPANY LIMITED,False,9/20/2018 12:00:00 AM +06:30
J.K.A MYANMAR LIMITED,False,9/11/2014 12:00:00 AM +00:00
AUNG MYO SATT COMPANY LIMITED,False,10/3/2019 12:42:10 PM +06:30
TIANJIN GOLDEN MOUNTAIN TRADE (MYANMAR) COMPANY LIMITED,True,3/22/2019 4:56:15 PM +06:30
TET THIT GARMENT COMPANY LIMITED,False,5/24/2019 2:47:57 PM +06:30
KSA CONSULTING LTD,True,10/2/2019 11:38:42 AM +06:30
"Shwe Pin Shwe Thee Co., Ltd.",False,8/23/2002 12:00:00 AM +00:00
SOLO TRAVEL & TOUR COMPANY LIMITED,False,5/21/2019 4:45:32 PM +06:30
BUILT MORE CONSTRUCTION COMPANY LIMITED,False,3/16/2019 8:31:18 AM +06:30
ETERNAL WHITE FLOWER WAY COMPANY LIMITED,False,8/19/2014 12:00:00 AM +00:00
"UNITED PHARMACEUTICAL DISTRIBUTORS GROUP Co.,Ltd.",False,1/2/2009 12:00:00 AM +00:00
KAWLIN STAR GROUP COMPANY  LIMITED .......,False,5/25/2016 12:00:00 AM +00:00
LICO FOODSTUFF COMPANY LIMITED,False,4/9/1997 12:00:00 AM +00:00
"The Great Sun & Moon Co., Ltd.",False,6/1/1999 12:00:00 AM +00:00
CHAN AYE THAR ZAN GEMS & JWEWLLERY COMPANY LIMITED,False,3/15/2012 12:00:00 AM +00:00
MACQUARIE COMPANY LIMITED,False,9/21/2020 4:28:13 PM +06:30
NATIVE MYANMAR CONSTRUCTION COMPANY LIMITED,False,11/15/2012 12:00:00 AM +00:00
MOE MYAT MAHAR CONSTRUCTION COMPANY LIMITED,False,5/20/2014 12:00:00 AM +00:00
UNITED PRETTY HOME TRADING COMPANY LIMITED,False,3/21/2011 12:00:00 AM +00:00
"GOLDEN WILLOW CO.,LTD.",False,8/26/2008 12:00:00 AM +00:00
PEB STEEL MYANMAR LIMITED,True,11/25/2015 12:00:00 AM +00:00
SHWE NYI HAL MINING COMPNY LIMITED,False,1/21/2010 12:00:00 AM +00:00
MANDALAY ELECTRIC SERVICE COMPANY LIMITED,False,3/6/2014 12:00:00 AM +00:00
 CDC CAREER DEVELOPMENT CONSULTANCY COMPANY LIMITED,False,1/31/2019 12:00:00 AM +00:00
MAHAR YANGON COMPANY LIMITED,False,1/1/2016 12:00:00 AM +00:00
MARINA HERB MYANMAR COMPANY LIMITED,False,3/4/2019 6:40:21 PM +06:30
YANGON AUTO PARTS COMAPNY LIMITED,False,2/3/1998 12:00:00 AM +00:00
BRILLIANT POWER COMPANY LIMITED,False,3/4/2016 12:00:00 AM +00:00
TUN WINT HTAL MARKETING COMPANY LIMITED,False,12/8/2014 12:00:00 AM +00:00
HTET BHONE DANA COMPANY LIMITED,False,6/12/2018 12:00:00 AM +00:00
YU LINN MYAT COMPANY LIMITED,False,10/30/2017 12:00:00 AM +06:30
WIN THU KHA COMPANY LIMITED,False,2/7/2012 12:00:00 AM +00:00
ZWE ZAW ZAW COMPANY LIMITED,False,10/2/2019 5:53:22 PM +06:30
HTUN SHWE MYANMAR COMPANY LIMITED,False,1/29/2019 12:00:00 AM +00:00
CHAN PAING THU COMPANY LIMITED,False,4/24/2015 12:00:00 AM +00:00
NOBLE OASIS HEALTH CARE COMPANY LIMITED,False,3/4/2020 12:02:42 PM +06:30
AUNG HTUT TIN CONSTRUCTION COMPANY LIMITED,False,5/30/2019 12:15:53 PM +06:30
NGWE KAUNG COMPANY LIMITED,False,3/8/2018 12:00:00 AM +00:00
SOE THIHA COMPANY LIMITED,False,3/10/2020 5:15:10 PM +06:30
J-HRS COMPANY LIMITED,False,3/3/2020 11:42:09 AM +06:30
AYE MYAT MOE COMPANY LIMITED,False,7/16/2020 1:49:37 PM +06:30
M.Y.T INTERNATIONAL COMPANY LIMITED.,False,2/4/2016 12:00:00 AM +00:00
THET HNIN THIN ZAR COMPANY LIMITED,False,5/18/2001 12:00:00 AM +00:00
MOE SAN BEAUTY COMPANY LIMITED,False,6/7/2016 12:00:00 AM +00:00
FAST BOOKING CENTER COMPANY LIMITED,False,7/3/2018 12:00:00 AM +00:00
GOLDEN TRI STAR TONE COMPANY LIMITED,True,2/13/2014 12:00:00 AM +00:00
MIRACLE TRIUMPH COMPANY LIMITED,False,8/7/2020 3:55:01 PM +06:30
MYANMAR ROCKY MINING COMPANY LIMITED,False,8/13/2008 12:00:00 AM +00:00
FOCUS MINERALS COMPANY LIMITED,False,12/3/2020 10:07:12 PM +06:30
Memon International Limited,False,1/16/2004 12:00:00 AM +00:00
PYAE HTET AUNG COMPANY LIMITED,False,7/13/2020 2:22:58 PM +06:30
MOON DRAGON COMPANY LIMITED,False,8/17/2018 12:00:00 AM +00:00
CHUN HUA TRADING COMPANY LIMITED,False,8/2/1996 12:00:00 AM +00:00
ANLS COMPANY LIMITED,False,10/20/2017 12:00:00 AM +00:00
PYAE SONE THIT LWIN (P S T L) COMPANY LIMITED,False,2/6/2018 12:00:00 AM +00:00
TRUSTFUL QUALITY TRADING COMPANY LIMITED,False,3/1/2010 12:00:00 AM +00:00
"Myanmar Green Valley Trading Co.,Ltd.",False,6/11/2010 12:00:00 AM +00:00
QUINTESSENCE COMPANY LIMITED,False,9/8/2018 12:00:00 AM +00:00
"M. J. MYANMAR CO., LTD.",True,10/18/2013 12:00:00 AM +00:00
SAMADI SERVICES COMPANY LIMITED,False,12/19/2007 12:00:00 AM +00:00
KYAW KHAING KHANT COMPANY LIMITED,False,5/4/2017 12:00:00 AM +00:00
NAING PYAE COMPANY LIMITED,False,9/21/2018 5:29:02 AM +06:30
JINGHPAW STAR TRAVELS & TOURS COMPANY LIMITED,False,1/31/2018 12:00:00 AM +00:00
MYANMAR OKAHASHI COMPANY LIMITED,False,12/6/2012 12:00:00 AM +00:00
"Ngwe Tayar Trading Co., Ltd.",False,4/22/1991 12:00:00 AM +00:00
EVEREST MYINTMO COMPANY LIMITED,False,8/9/2019 11:48:16 AM +06:30
"Fifth United Co.,Ltd.",False,3/24/1998 12:00:00 AM +00:00
WIN MARLAR AUNG TRADING COMPANY LIMITED,False,11/10/1992 12:00:00 AM +06:30
B.S.G COMPANY LIMITED,False,2/16/2017 12:00:00 AM +00:00
ZAY FAMILY (YANGON) COMPANY LIMITED,False,7/21/2020 4:40:19 PM +06:30
MYANMAR GOLD ONE COMPANY LIMITED,False,11/20/2018 12:00:00 AM +06:30
TEDIM COFFEE AGRICULTURE AND REAL QUALITY PRODUCTION COMPANY LIMITED,False,7/18/2019 12:00:00 AM +00:00
HTUN ZABU SHWE COMPANY LIMITED,False,9/21/2018 12:00:00 AM +00:00
SAGE TECHNOLOGY COMPANY  LIMITED,False,9/26/2018 12:21:27 PM +06:30
PYAE THET HTUN SERVICES COMPANY LIMITED.,False,9/17/2015 12:00:00 AM +00:00
CHAI SHAR COMPANY LIMITED,False,12/20/2020 7:31:56 AM +06:30
"Chan Myayt Moe Naing Construction Co., Ltd.",False,8/4/2011 12:00:00 AM +00:00
GOLD AYA MOTORS INTERNATIONAL GROUP  COMPANY LIMITED,True,6/28/2017 12:00:00 AM +00:00
KERNELLIX COMPANY LIMITED,False,6/25/2014 12:00:00 AM +00:00
"Tun Kyaw Kyar Co., Ltd ",False,2/18/2011 12:00:00 AM +00:00
ASIA SHWE MANDALAY VICTORY COMPANY LIMITED,False,6/22/2017 12:00:00 AM +00:00
BAOGE FOOD COMPANY LIMITED,True,4/7/2020 6:55:54 AM +06:30
MYANMAR PARADISE MODERN FURNITURE COMPANY LIMITED,False,5/23/2016 12:00:00 AM +00:00
BABY GEMS COMPANY LIMITED,False,1/10/2019 3:26:16 PM +06:30
MOE YAN THIT COMPANY LIMITED,False,5/21/2014 12:00:00 AM +00:00
"Dynamic Arrow Gems Co., Ltd.",False,10/21/2011 12:00:00 AM +00:00
GREEN HILL (MTP) COMPANY LIMITED,False,9/26/2019 4:11:08 PM +06:30
GOLDEN CAPITOL COMPANY LIMITED,False,9/6/2019 12:00:00 AM +06:30
PAW SANN AGRO COMPANY LIMITED,False,3/11/2016 12:00:00 AM +00:00
TUN SOE SAN COMPANY LIMITED,False,6/3/2019 3:49:38 PM +06:30
ASIAN TRAILS TOUR LIMITED,True,11/10/1999 12:00:00 AM +00:00
MIN KHANT LIN COMPANY LIMITED,False,12/14/2018 5:26:08 PM +06:30
"SINGLE NINE TRADING CO., LTD",False,11/24/2020 8:54:01 PM +06:30
SHWE NGWE HTAY COMPANY LIMITED,False,9/12/2014 12:00:00 AM +06:30
ZIYARDEN MYANMAR COMPANY LIMITED,True,12/22/2017 12:00:00 AM +00:00
"Rising Victor Co., Ltd.",False,6/8/2001 12:00:00 AM +00:00
NAWNGTUNG COMPANY LIMITED,False,7/18/2000 12:00:00 AM +00:00
Tip Top Engineering Products Private Ltd.,False,5/8/1998 12:00:00 AM +00:00
BEIKTHANOE DELIVERY & LOGISTICS SOLUTIONS COMPANY LIMITED,False,11/17/2017 12:00:00 AM +00:00
MINGALARPAR SHWE LI COMPANY LIMITED,False,9/10/2018 5:48:58 PM +06:30
"Yangon Science Strong Mining Co., Ltd.",False,11/20/2003 12:00:00 AM +00:00
"S.V. Construction Co., Ltd.",False,6/12/1996 12:00:00 AM +00:00
"ORIENTAL INTERNATIONALCO., LTD.",True,12/27/2018 12:00:00 AM +00:00
SU KADAY AUNG COMPANY LIMITED,False,9/3/2014 12:00:00 AM +00:00
"Nyunt Myanmar Gems Co,.Ltd.",False,7/25/2011 12:00:00 AM +00:00
"WINALL HI-TECH SEED MYANMAR CO., LTD",True,12/8/2018 12:00:00 AM +06:30
KS & BROTHERS COMPANY LIMITED,False,12/20/2018 12:00:00 AM +00:00
"Zin Yaw Import & Export and General Trading Co., Ltd.",False,5/6/1998 12:00:00 AM +00:00
ROYAL KING LAND MANUFACTURING & DISTRIBUTION COMPANY LIMITED,False,10/26/2009 12:00:00 AM +00:00
LUCIFER (GROUP) COMPANY LIMITED,False,9/12/2019 12:00:00 AM +06:30
MFUNCTIONS MYANMAR COMPANY LIMITED,True,8/22/2019 8:05:33 PM +06:30
AA5 COMPANY LIMITED,False,1/30/2019 8:22:14 PM +06:30
N CREATIVE CO. LTD,False,10/26/2019 12:26:14 PM +06:30
CAMEL INTERNATIONAL AUTOMOBILE & SERVICES  COMPANY LIMITED,False,9/10/2013 12:00:00 AM +00:00
ROYAL CBI GROUP COMPANY LIMITED,False,4/30/2018 12:00:00 AM +00:00
"AK CLIMAX CO., LTD",False,2/21/2020 10:46:30 AM +06:30
"K Thiri Trading Co., Ltd.",False,8/30/2012 12:00:00 AM +00:00
THEINT WIN HTET MANUFACTURING COMPANY LIMITED,False,1/12/2010 12:00:00 AM +06:30
GOLDEN POST CONSTRUCTION COMPANY LIMITED ,False,10/9/2014 12:00:00 AM +00:00
"BOTEEN (MYANMAR) TECHNICAL SERVICES CO., LTD",True,1/19/2019 5:26:08 PM +06:30
CASA MODA MYANMAR COMPANY LIMITED,False,5/15/2018 12:00:00 AM +00:00
UP-1 CONSTRUCTION COMPANY LIMITED,False,2/24/2016 12:00:00 AM +00:00
TET PHYO WAI SERVICES COMPANY LIMITED,False,10/15/2009 12:00:00 AM +00:00
BEAUTY WAVES COMPANY LIMITED,True,11/9/2012 12:00:00 AM +06:30
"Good Hands International Co., Ltd.",False,12/9/2002 12:00:00 AM +00:00
PHAUNG PHAUNG LOGISTICS & TECHNOLOGIES COMPANY LIMITED,False,1/20/2016 12:00:00 AM +00:00
EMPIRE BUILDER ENTERPRENEUR GROUP COMPANY LIMITED,False,10/25/2016 12:00:00 AM +00:00
"LILAC International Trading Co.,Ltd.",False,7/2/1999 12:00:00 AM +00:00
GOLDEN TANINTHARRYI INDUSTRIAL COMPANY LIMITED,False,11/7/2012 12:00:00 AM +00:00
"Myanmar Grace Attoin International Co.,Ltd",False,5/6/1998 12:00:00 AM +00:00
"Lucky Banner Construction Co,.Ltd.",False,11/4/2010 12:00:00 AM +00:00
"HENGTONG (MYANMAR) CONSTRUCTION ENGINEERING CO., LTD",False,5/12/2020 8:37:57 AM +06:30
KHAING MANDALAR COMPANY LIMITED,False,12/8/2016 12:00:00 AM +00:00
MOE SAN COMPANY LIMITED,False,10/2/2019 12:00:00 AM +06:30
YOMA AUNG  COMPANY LIMITED,False,9/3/2018 3:08:52 PM +06:30
MECTRONIC COMPANY LIMITED,False,8/4/2017 12:00:00 AM +00:00
"Irifune  Co.,  Ltd.",False,12/5/1995 12:00:00 AM +00:00
SHWE BAW TUN COMPANY LIMITED,False,2/14/2018 12:00:00 AM +00:00
CHINDWIN LIGHT COMPANY LIMITED,False,10/13/2020 7:40:45 PM +06:30
"THEIN LINN MYAING MANUFACTURING CO.,LTD.",False,11/29/2011 12:00:00 AM +00:00
"DAKOTA MYANMAR CO., LTD",True,10/28/2020 10:10:42 AM +06:30
"OPTIX CO., LTD",False,9/17/2020 8:00:28 PM +06:30
CROWNONE ENTERPRISE COMPANY LIMITED,False,12/11/2013 12:00:00 AM +00:00
OFFICE FOR COSMOPOLITAN  ARCHITECTURE COMPANY LIMITED,False,2/10/2015 12:00:00 AM +00:00
NADI KYAW MYINT AND WAI YAN KYAW MYINT TRADING COMPANY LIMITED,False,11/24/2017 12:00:00 AM +06:30
 SUPER KING TRADERS PRIVATE LIMITED,False,2/13/2017 12:00:00 AM +00:00
BSMART TELEMATICS (MYANMAR) COMPANY LIMITED,True,2/5/2014 12:00:00 AM +00:00
HEIN HLAING  FOOTWEAR  TRADING COMPANY LIMITED,False,3/28/2011 12:00:00 AM +00:00
Z N C TRADING COMPANY LIMITED,False,11/30/2016 12:00:00 AM +00:00
ROYAL SMILE GOLDEN FAMILY LIMITED,False,9/12/2018 12:00:00 AM +00:00
ZAW SITT HEIN CONSTRUCTION COMPANY LIMITED,False,10/23/2015 12:00:00 AM +00:00
MAHAR THIKE MAHAR NWE COMPANY LIMITED,False,10/21/2020 2:51:46 AM +06:30
"STRAND ADVISORY (MYANMAR) CO., LTD.",True,11/11/2019 12:00:00 AM +06:30
HTUN  NAY  WUNN  CONSTRUCTION  COMPANY  LIMITED,False,1/9/2021 8:27:00 PM +06:30
SHWE LAN BO COMPANY LIMITED,False,12/27/2020 6:19:11 PM +06:30
CYPRESS COMPANY LIMITED,False,2/11/2010 12:00:00 AM +00:00
MOGOK TEA LIMITED,False,9/2/2019 4:59:08 PM +06:30
MARTY COMPANY LIMITED,False,10/9/2020 3:35:51 PM +06:30
MAHA NADI INTERNATIONAL COMPANY LIMITED,False,10/18/2004 12:00:00 AM +00:00
"Mani Yazar Gems Co., Ltd.",False,12/23/2004 12:00:00 AM +00:00
"Wa Lu Co., Ltd.",False,10/25/1994 12:00:00 AM +00:00
125 SERVICES COMPANY LIMITED,False,5/2/2017 12:00:00 AM +00:00
THARSI THAR EXPORT & IMPORT COMPANY LIMITED,False,9/6/2018 12:00:00 AM +06:30
CHAMPION CROWN COMPANY LIMITED,False,10/17/2018 9:54:40 PM +06:30
YPO ASSOCIATION INCORPORATED,False,5/5/2017 12:00:00 AM +00:00
GREAT MOTHER COMPANY LIMITED,False,6/20/2018 12:00:00 AM +00:00
MEIKTILA PHYO THIHA KYAW COMPANY LIMITED,False,6/20/2017 12:00:00 AM +00:00
ROYAL JASMINE GENERAL TRADING COMPANY LIMITED,False,4/5/2000 12:00:00 AM +00:00
TRAVEL FRIENDLIST COMPANY LIMITED,False,12/15/2016 12:00:00 AM +00:00
"Taw Win Dana Co., Ltd.",False,10/25/2006 12:00:00 AM +00:00
MYA MYAT KAUNG COMPANY LIMITED,False,5/7/2018 12:00:00 AM +00:00
"FIPLUS MYANMAR CO., LTD",False,9/4/2018 12:00:00 AM +06:30
"THIRI MULTI TRADING CO.,LTD.",False,8/19/2010 12:00:00 AM +00:00
BUILT ENVIRONMENT SOLUTIONS (MYANMAR) LIMITED,True,3/4/2014 12:00:00 AM +00:00
GORGEOUS RAINBOW COMPANY LIMITED,False,1/3/2021 8:15:30 AM +06:30
TRI BEST COMPANY LIMITED,False,10/20/2018 3:04:17 PM +06:30
KYAW HTET WAI COMPANY LIMITED,False,7/18/2018 12:00:00 AM +00:00
GOLDEN HEART COMPANY LIMITED,False,1/24/2013 12:00:00 AM +00:00
MYA SHWE SEIN COMPANY LIMITED,False,5/29/2020 4:46:38 PM +06:30
K K T COMPANY LIMITED,False,10/6/2016 12:00:00 AM +00:00
AMARAPURA PALACE BUSINESS MANAGEMENT COMPANY LIMITED,False,4/4/2018 12:00:00 AM +00:00
THAR TUN COMPANY LIMITED,False,9/30/2016 12:00:00 AM +00:00
AVA JOUEL (MYANMAR) INTERNATIONAL COMPANY LIMITED,False,12/12/2012 12:00:00 AM +00:00
BAJAJ COMPANY LIMITED,False,2/14/2018 12:00:00 AM +00:00
PETROL STAR  COMPANY LIMITED,False,5/13/2015 12:00:00 AM +00:00
"Than Htike San Gems & Jewellery Co., Ltd.",False,8/27/2003 12:00:00 AM +00:00
GANDAMAR SHWE  PYI COMPANY LIMITED,False,2/25/2013 12:00:00 AM +00:00
"SOLUTION CAREER CONSULTANCY CO., LTD.",False,7/5/2010 12:00:00 AM +00:00
VISITIGO COMPANY LTD,False,10/23/2017 12:00:00 AM +00:00
SHWE MYO MYINT COMPANY LIMITED,False,7/9/2015 12:00:00 AM +00:00
KOREA STAR  COMPANY LIMITED,True,12/2/2018 12:00:00 AM +00:00
Hibiscus Industries Limited.,False,9/2/1999 12:00:00 AM +00:00
MYANMAR THIHA COMPANY LIMITED,False,3/22/2002 12:00:00 AM +00:00
"Pwint Thit Yadanar Co., Ltd.",False,9/30/1998 12:00:00 AM +00:00
P & Z HOLDINGS LIMITED,False,10/1/2018 12:00:00 AM +06:30
IDA COMPANY LIMITED,False,10/19/2018 12:00:00 AM +00:00
DRESDNER INFORMATION SERVICES COMPANY LIMITED,False,1/1/2016 12:00:00 AM +00:00
MYA KYAW THEIN COMPANY LIMITED,False,6/14/2020 4:25:26 PM +06:30
"Aung Chan Thar (Kawthaung) Trading Co., Ltd.",False,2/18/1998 12:00:00 AM +00:00
ZIN HTET PAING COMPANY LIMITED,False,7/11/2016 12:00:00 AM +00:00
"Uni White Moon Co.,Ltd",False,1/30/2006 12:00:00 AM +00:00
CHIN VALLEY COMPANY LIMITED,False,5/3/2019 12:00:00 AM +00:00
NAING WAI YAN AUNG COMPANY LIMITED,False,4/29/2014 12:00:00 AM +00:00
"Aung Myint Myat Trading Co., Ltd.",False,9/17/2003 12:00:00 AM +00:00
MYINT PAING ZIN GROUP CONSTRUCTION COMPANY LIMITED,False,10/14/2016 12:00:00 AM +06:30
LIGHT & SALT TRADING COMPANY LIMITED,False,9/27/2012 12:00:00 AM +00:00
A PLUS GROUP COMPANY LIMITED,False,8/6/2018 12:00:00 AM +00:00
"Mya Yeik Mon Services Co., Ltd.",False,6/25/2003 12:00:00 AM +00:00
ZAY YAR NAING COMPANY LIMITED,False,3/13/2018 12:00:00 AM +00:00
PYONE PYONE CHO COMPANY LIMITED,False,10/24/1997 12:00:00 AM +00:00
"White Peacock Co.,Ltd.",False,5/24/2011 12:00:00 AM +00:00
ROYAL THET PAING OO TRADING COMPANY LIMITED,False,5/4/2017 12:00:00 AM +00:00
THIHA TUN (DAWEI) CONSTRUCTION COMPANY LIMITED,False,6/8/2020 12:58:29 PM +06:30
HINTHA BUSINESS LTD,True,4/24/2013 12:00:00 AM +00:00
DOCTOR A CONSTRUCTION DESIGN SERVICESING COMPANY LIMITED,False,8/18/2015 12:00:00 AM +00:00
LIAN NGIN COMPANY LIMITED.,False,10/5/2016 12:00:00 AM +00:00
IRIE MIYAKE ARCHITECTS & ENGINEERS YANGON OFFICE LIMITED,True,3/11/2013 12:00:00 AM +00:00
N & B ENGINEERING COMPANY LIMITED,True,6/9/2020 9:46:56 AM +06:30
"MYANMAR DIXINDA GARMENT CO., LTD",True,9/18/2020 12:07:09 PM +06:30
YES ASIA COMPANY LIMITED,False,10/8/2018 9:51:39 PM +06:30
MYANMAR YONG TAI ELECTRIC COMPANY LIMITED,False,7/11/2019 10:55:01 AM +06:30
"Mudon Travels & Tours Co., Ltd.",False,8/30/2004 12:00:00 AM +00:00
THILA  HUNG  HIEP  (MYANMAR) COMPANY LIMITED,False,1/8/2014 12:00:00 AM +00:00
SEKA TRADING LTD,False,6/26/2020 12:23:33 PM +06:30
GOLDEN BRIGHT CONVENIENCE COMPANY LIMITED,False,10/4/2013 12:00:00 AM +00:00
"S&Z INTERNATIONAL CO., LTD.",False,1/29/2020 8:38:29 AM +06:30
GOLDEN MILESTONES COMPANY LIMITED,False,8/3/2016 12:00:00 AM +00:00
GLOBAL SMART HOME CONSTRUCTION COMPANY LIMITED,False,10/25/2016 12:00:00 AM +00:00
GREAT MOUNT SILVER TRADING COMPANY LIMITED,False,1/29/2016 12:00:00 AM +00:00
GRAND GENESIS GROUP COMPANY LIMITED,False,10/28/2020 4:40:48 PM +06:30
GLOBAL MYINT-TECH COMPANY LIMITED,False,10/7/2016 12:00:00 AM +06:30
LUCKY SHINE COMPANY LIMITED,False,1/17/2013 12:00:00 AM +00:00
"DIAMOND TANGON TRADING CO.,LTD",False,10/10/2007 12:00:00 AM +00:00
HUNAN NO.4 CONSTRUCTION AND ENGINEERING (MYANMAR) COMPANY LIMITED,True,11/17/2014 12:00:00 AM +00:00
MYANMAR COMBIZ DEVELOPMENT COMPANY LIMITED,False,7/15/2016 12:00:00 AM +00:00
HEIN ZAYA MIN  COMPANY LIMITED.,False,7/1/2015 12:00:00 AM +00:00
CROWN CALCIUM CARBONATE COMPANY LIMITED,False,8/26/2008 12:00:00 AM +00:00
TUN LIN SAN COMPANY LIMITED,False,9/26/2018 12:00:00 AM +00:00
GRAIN COMPANY LIMITED,False,12/23/2020 8:44:29 PM +06:30
LAWPAN LAUNG COMPANY LIMITED,False,9/4/2018 12:00:00 AM +00:00
CYBER SPACE COMPANY LIMITED,False,7/27/2016 12:00:00 AM +00:00
M&A ELECTRIC COMPANY LIMITED,False,11/6/2019 12:00:00 AM +06:30
"Yamato  Myanmar  Development  Co.,  Ltd.",False,4/7/1993 12:00:00 AM +00:00
FIVE ONE THREE GROUP COMPANY LIMITED,False,10/7/2015 12:00:00 AM +06:30
"GLOBAL METAL INTERNATIONAL, PTE. LTD.",False,9/5/2020 7:58:19 AM +06:30
NAGAR MAHN COMPANY LIMITED,False,8/21/2013 12:00:00 AM +00:00
SOCIAL STARS COMPANY LIMITED,False,8/14/2019 4:37:45 PM +06:30
CHO KYI THAR LIMITED,False,11/10/2018 12:00:00 AM +00:00
HE YING TECHNOLOGY TRADING COMPANY LIMITED,False,12/18/2019 12:00:00 AM +06:30
 THE BRANDED MYANMAR TRADING COMPANY LIMITED,False,3/11/2019 2:06:55 PM +06:30
BEST BAGAN TRAVELS & TOURS COMPANY LIMITED,False,4/2/2015 12:00:00 AM +00:00
"Great Lion Co., Ltd.",False,5/22/1992 12:00:00 AM +00:00
NANG ZIN MAR COMPANY LIMITED,False,6/21/2010 12:00:00 AM +00:00
KYAW SOE MYINT COMPANY LIMITED,False,7/6/2017 12:00:00 AM +00:00
"Leaders Industrial & Trading Co., Ltd.",False,12/6/1993 12:00:00 AM +00:00
MOE MYA SEIN YAUNG CHEL COMPANY LIMITED,False,12/30/2014 12:00:00 AM +00:00
BRAND PRO COMPANY LIMITED,False,11/8/2017 12:00:00 AM +06:30
MYINGYAN ZABU KYAW LIMITED,False,3/13/2019 12:00:00 AM +00:00
MYANMAR EVER HUGE BEAUTIFUL COMPANY LIMITED,False,1/2/2008 12:00:00 AM +00:00
YANGON FEATHER INDUSTRY COMPANY LIMITED,False,3/15/2010 12:00:00 AM +00:00
AYEYARWADDY ABILITY WIN COMPANY LIMITED,False,11/10/2020 9:22:06 PM +06:30
AEC (2560) Construction Company Limited,False,7/26/2017 12:00:00 AM +00:00
MYO MYANMAR TUN TAUK COMPANY LIMITED,False,1/21/2021 6:54:24 PM +06:30
NGWE KYEI PYAE SON COMPANY LIMITED,False,9/6/2012 12:00:00 AM +00:00
T-ZIN COMPANY LIMITED,False,11/25/2019 12:01:16 PM +06:30
SEIN NILAR MYANMAR COMPANY LIMITED,False,1/25/2021 9:36:48 AM +06:30
IDEA ART COMPANY LTD,False,5/23/2017 12:00:00 AM +00:00
INTERNATIONAL COSMETICS ACADEMY LIMITED,True,6/1/2020 4:29:36 PM +06:30
GOOD STEP COMPANY LIMITED,False,7/1/2016 12:00:00 AM +00:00
"YYQ CULTURE & MEDIA BROKERS  CO., LTD.",False,3/17/2020 12:47:23 PM +06:30
"FAMOUS MYANMAR CO., LTD",False,6/18/2019 1:36:03 PM +06:30
INTACT COMPANY LIMITED,False,9/4/2009 12:00:00 AM +00:00
"GREEN  PLUS  INTERNSTIONAL CO., LTD",False,12/9/2009 12:00:00 AM +00:00
SHWE LARB PWINT OO COMPANY LIMITED,False,8/6/2018 12:00:00 AM +00:00
UNION HOLDING COMPANY LIMITED,False,11/19/2018 2:17:12 PM +06:30
SOLUTION BRIGHT COMPANY LIMITED,False,3/7/2016 12:00:00 AM +00:00
AUNG HTIKE KYAW COMPANY LIMITED,False,5/27/2014 12:00:00 AM +00:00
BUSINESS INFORMATION SYSTEMS LIMITED,False,9/14/2005 12:00:00 AM +00:00
UNSM COMPANY LIMITED,False,5/12/2016 12:00:00 AM +00:00
MOON LIGHT 27 COMPANY LIMITED,False,9/21/2020 12:53:55 PM +06:30
NAGAR MINTHAR GEMS COMPANY LIMITED,False,5/16/2012 12:00:00 AM +00:00
MEI LV BUSINESS COMPANY LIMITED,False,6/11/2018 12:00:00 AM +00:00
HTOO & THOON COMPANY LIMITED,False,6/25/2020 6:06:52 AM +06:30
"Myanmar  Aykarit  Public  Co.,  Ltd",False,8/26/2013 12:00:00 AM +00:00
ZAWE HTIKE HLYAN COMPANY LIMITED,False,8/14/2018 2:52:16 PM +06:30
"Royal Glory Trading Co., Ltd.",False,3/20/2012 12:00:00 AM +00:00
