FORERUNNER BUSINESS GROUP COMPANY LIMITED,False,2/16/2019 6:22:10 PM +06:30
UNI RAYS INTERNATIONAL COMPANY LIMITED,False,6/6/2019 12:00:00 AM +00:00
KAN PYIN COW COMPANY LIMITED,False,8/10/2018 12:00:00 AM +00:00
MONYWA LUCKY STAR COMPANY LIMITED,False,11/20/2019 12:54:31 PM +06:30
HENRY CHANG FAR COMPANY LIMITED,True,5/26/2016 12:00:00 AM +00:00
Juara - Vitagain  (Myanmar)  Ltd.,False,3/21/1994 12:00:00 AM +00:00
MYANMAR BELREDA ELECTRIC COMPANY LIMITED,False,5/14/2018 12:00:00 AM +00:00
MOE MYINT THAW COMPANY LIMITED,False,9/9/2019 12:00:00 AM +06:30
CONFEDERATE ELECTRICAL ENGINEERING & DESIGN  COMPANY LIMITED,False,8/13/2019 3:22:37 PM +06:30
FREE WAY SERVICES COMPANY LIMITED,False,6/6/2008 12:00:00 AM +00:00
A KI RA COMPANY LIMITED,False,6/11/2018 12:00:00 AM +00:00
NAN HWAR COMPANY LIMITED,False,2/13/2019 12:00:00 AM +00:00
ASIA STAR K.M COMPANY LIMITED,False,3/14/2018 12:00:00 AM +00:00
NATURE GREEN HILL COMPANY LIMITED,False,1/22/2018 12:00:00 AM +00:00
EKPAC MYANMAR COMPANY LIMITED,True,5/22/2020 4:05:37 PM +06:30
KINETIC PROPERTY DEVELOPMENT CO LTD,False,8/2/2010 12:00:00 AM +00:00
KAN BO COMPANY LIMITED,False,10/5/2012 12:00:00 AM +00:00
KAUNG MON YADANAR GEMS COMPANY LIMITED,False,5/10/2004 12:00:00 AM +00:00
ROYAL GOLD STAR SERVICES COMPANY LIMITED,False,11/23/2018 12:00:00 AM +00:00
"Kyi Sein & Brothers Industry Co., Ltd.",False,7/26/2004 12:00:00 AM +00:00
PANDAW CRUISES LIMITED,False,5/15/2015 12:00:00 AM +00:00
DIAMOND DREAM COMPANY LIMITED,False,6/21/2017 12:00:00 AM +00:00
THWIN YADANAR COMPANY LIMITED,False,9/26/2018 7:47:54 AM +06:30
GLOBAL GLORY GG COMPANY LIMITED,False,12/9/2016 12:00:00 AM +06:30
KAN PHOO PWINT COMPANY LIMITED,False,2/26/2014 12:00:00 AM +00:00
THAWTAR WAI COMPANY LIMITED,False,11/28/2018 12:00:00 AM +00:00
"Phyoe The Su Garment Industry Co., Ltd.",False,10/28/1999 12:00:00 AM +00:00
HIGH POTENTIAL COMPANY LIMITED,False,9/20/2013 12:00:00 AM +00:00
I GOLDEN MYANMAR REAL ESTATE COMPANY LIMITED,True,6/9/2020 11:23:08 AM +06:30
ELECTRON WORLD ENGINEERING COMPANY LIMITED,False,9/14/2017 12:00:00 AM +06:30
KAN MYINT THAR COMPANY LIMITED,False,5/25/2015 12:00:00 AM +00:00
BIGTREE GREEN TANK COMPANY LIMITED,False,6/25/2015 12:00:00 AM +00:00
FASCINATING MYANMAR TRAVELS & TOURS COMPANY LIMITED,False,7/5/2007 12:00:00 AM +00:00
PROMINENT CHAIR COMPANY LIMITED,False,5/19/2020 4:31:18 PM +06:30
GITAYWAR COMPANY LIMITED,False,3/1/2019 2:44:03 PM +06:30
HAPPY EASY ARCHITECTURE DECORATION DESIGN CO LTD,True,12/24/2019 9:39:10 PM +06:30
PAN TAING BROTHER MINING COMPANY LTD,True,12/11/2018 12:00:00 AM +00:00
"Conflux Travels & Tours Co., Ltd.",False,5/10/2000 12:00:00 AM +00:00
BANMAW SHAN HTOO AUNG COMPANY LIMITED,False,3/19/2020 11:11:02 AM +06:30
OAKKAR SHWE WINE COMPANY LIMITED.,False,6/22/2017 12:00:00 AM +00:00
"PRO ALUMINIUM & GLASS CO., LTD.",False,7/26/2019 10:29:53 PM +06:30
"UNIVERSAL BROTHERS INTERNATIONAL TRADING CO., LTD",False,7/9/2008 12:00:00 AM +00:00
"MYINGYAN NAN TAW WIN CO., LTD.",False,1/15/2020 10:02:08 AM +06:30
UT ZEFAR GENERAL TRADING COMPNAY LIMITED,False,7/14/2017 12:00:00 AM +00:00
THREE HUNDRED COMPANY LIMITED.,False,2/21/2018 12:00:00 AM +00:00
SWETAW TUN CONSTRUCTION COMPANY LIMITED.,False,1/28/2013 12:00:00 AM +00:00
"Myanmar Sun Light Co., Ltd.",False,8/3/2005 12:00:00 AM +00:00
ARJ GROUP COMPANY LIMITED,False,4/24/2018 12:00:00 AM +00:00
ARAGON MYANMAR GROUP COMPANY LIMITED,False,12/24/2013 12:00:00 AM +00:00
DIAMOND  HAP TRADING  COMPANY  LIMITED,False,10/31/2012 12:00:00 AM +00:00
THANDA TRAVEL & TOUR COMPANY LIMITED,False,2/9/2011 12:00:00 AM +00:00
KYAW SEIN GROUP COMPANY LIMITED,False,6/20/2018 12:00:00 AM +00:00
"SEIN SINT STAR CO., LTD",False,1/17/2019 9:16:01 PM +06:30
LWIN KO KO COMPANY LIMITED,False,6/4/2018 12:00:00 AM +00:00
FOOD EXPLORATION COMPANY LIMITED,False,12/12/2020 8:12:20 PM +06:30
RITZ CONTINENT COMPANY LIMITED,False,1/20/2015 12:00:00 AM +00:00
 Z TRADEX COMPANY LIMITED,False,12/23/2014 12:00:00 AM +00:00
PNH RESOURCES PTE LTD ,False,4/8/2019 7:55:06 PM +06:30
CHINA PALETTE GARMENT MYANMAR COMPANY LIMITED,True,1/18/2017 12:00:00 AM +00:00
SHWE HNIN THAR TRADING COMPANY LIMITED,False,2/23/2011 12:00:00 AM +00:00
"Red Rose Trading Co,.Ltd",False,3/21/2012 12:00:00 AM +00:00
"MOE YAN MIN PYAE CO., LTD.",False,11/29/2011 12:00:00 AM +06:30
NAING 777 CATTLE COMPANY LIMITED,False,10/5/2018 12:00:00 AM +06:30
PURE AUDIO INTERNATIONAL COMPANY LIMITED,False,3/26/2018 12:00:00 AM +00:00
"Nyana Trading Co.,Ltd.",False,9/6/2000 12:00:00 AM +00:00
ZWAE NYAN ZAW COMPANY LIMITED,False,5/7/2018 12:00:00 AM +00:00
KAUNG SI AUNG COMPANY LIMITED,False,5/20/2009 12:00:00 AM +00:00
Yankin Venture Trading Ltd.,False,8/23/2000 12:00:00 AM +00:00
ASTRO WORLD CONSTRUCTION COMPANY LIMITED,False,1/1/2013 12:00:00 AM +00:00
NAY NAY MIN ZAW COMPANY LIMITED,False,5/28/2020 12:43:17 PM +06:30
OPENGATE COMPANY LIMITED,False,8/28/2018 12:00:00 AM +00:00
SUN SHINE YANGON COMPANY LIMITED,False,9/21/2015 12:00:00 AM +00:00
KING CITY COMPANY LIMITED,False,7/14/2014 12:00:00 AM +00:00
RUBY WINDOW COMPANY LIMITED,False,7/20/2016 12:00:00 AM +00:00
ALL ACE INDUSTRIAL COMPANY LIMITED,False,5/27/2011 12:00:00 AM +00:00
SHWE EIKSIETAN COMPANY LIMITED,False,8/19/2013 12:00:00 AM +00:00
CHAN MYAE CHO COMPANY LIMITED,False,6/6/2018 12:00:00 AM +00:00
LWIN & NAING FRIENDS COMPANY LIMITED,False,6/13/2013 12:00:00 AM +00:00
"Yi Lin Co., Ltd.",False,12/14/2004 12:00:00 AM +00:00
WIN COM SOLUTIONS COMPANY LIMITED,False,10/9/2015 12:00:00 AM +00:00
"Ngwe Su Pan Co., Ltd.",False,7/11/2007 12:00:00 AM +00:00
"Soe Moe Tun Mining Co., Ltd.",False,11/3/2005 12:00:00 AM +00:00
SHEIN TOE  COMPANY LIMITED,False,12/18/2015 12:00:00 AM +00:00
CARGILL MYANMAR LIMITED,True,4/2/2019 8:32:53 PM +06:30
KYAW SWAN HTET CONSTRUCTION COMPANY LIMITED,False,12/10/2010 12:00:00 AM +00:00
PYAE SONE MYAY MINING COMPANY LIMITED,False,6/8/2012 12:00:00 AM +00:00
"THARAWUN INTERNATIONAL MANUFACTURING CO.,LTD.",False,9/20/2011 12:00:00 AM +00:00
PAYMENT DISTRIBUTOR LIMITED,False,2/20/2015 12:00:00 AM +00:00
ARP CONTRACTING LIMITED,True,6/2/2016 12:00:00 AM +00:00
POWER ORIGIN TRADING COMPANY LIMITED,False,8/13/2018 12:00:00 AM +00:00
SMART GREEN INTERNATIONAL RESOURCES(MYANMAR) LIMITED,False,6/24/2016 12:00:00 AM +00:00
Sunflower Family International Trading Company Limited,False,11/6/2006 12:00:00 AM +00:00
ZAYAR KAUNG HTET PAING COMPANY LIMITED,False,9/18/2018 12:00:00 AM +00:00
Royal Crown Industries Ltd.,False,2/8/2001 12:00:00 AM +00:00
MICRO RAYS TECHNOLOGIES COMPANY LIMITED,False,9/25/2017 12:00:00 AM +00:00
YIN LIVESTOCK INDUSTRY  COMPANY LIMITED,False,2/18/2019 12:00:00 AM +00:00
MCOCO COMPANY  LIMITED,False,6/20/2018 12:00:00 AM +00:00
"Gold River lighting Co,.Ltd",False,5/4/2012 12:00:00 AM +00:00
JE LANGUAGE CONSULTING LTD,True,5/9/2019 3:42:48 PM +06:30
EVER BEST GENERAL TRADING COMPANY LIMITED,False,10/5/2005 12:00:00 AM +06:30
SHWE TRIANGLE STAR MINING COMPANY LIMITED,False,12/10/2010 12:00:00 AM +00:00
MOE THAUK HNIN COMPANY LIMITED,False,3/11/2004 12:00:00 AM +00:00
"Myanma Morality Gems & Jewellery Co.,Ltd",False,10/16/2007 12:00:00 AM +00:00
ADIPADI ALIN COMPANY  LIMITED,False,9/21/2016 12:00:00 AM +00:00
"Light  Road Industrial Co.,Ltd.",False,8/18/1999 12:00:00 AM +00:00
GROUND TRADING COMPANY LIMITED,False,9/22/2011 12:00:00 AM +00:00
MECH GEAR COMPANY LIMITED,False,9/6/2018 12:00:00 AM +00:00
PYI KYAW AUNG HTAY MINING COMPANY LIMITED,False,3/11/2009 12:00:00 AM +00:00
ZAYARSWAM HTET COMPANY LIMITED,False,9/14/2016 12:00:00 AM +00:00
"Lulin Trading Co,.Ltd.",False,5/5/2011 12:00:00 AM +00:00
JINGWEI INTERNET TECHNOLOGY CO LTD,False,6/18/2019 8:03:46 AM +06:30
ADVANCE ECONOMY CONVENIENCE UNITED COMPANY LIMITED,False,9/29/2014 12:00:00 AM +06:30
ATTITUDE & HONESTY COMPANY LIMITED,False,10/6/2011 12:00:00 AM +00:00
"NOVA COMMUNICATION TECHNOLOGY CO.,LTD",False,7/17/2019 12:00:00 AM +00:00
UB UNITED BROTHERS COMPANY LIMITED,False,4/11/2018 12:00:00 AM +00:00
SWAN HTET AUNG MYIN COMPANY LIMITED,False,4/9/2019 11:54:59 AM +06:30
SHWE MYIT SHWE LI (MYITKYINA) TRADING COMPANY LIMITED,False,5/2/2014 12:00:00 AM +00:00
MYINT UNIQUE TRADING COMPANY LIMITED,False,12/11/2017 12:00:00 AM +00:00
GROUND SOLUTION COMPANY LIMITED,False,6/3/2011 12:00:00 AM +00:00
KYEIN YEIK MYAY COMPANY LIMITED,False,6/27/2020 1:37:38 AM +06:30
A.S.TEAM ENGINEERING LIMITED,False,1/16/2019 12:00:00 AM +00:00
SEVEN DIAMOND DRAGON TRADING COMPANY LIMITED,False,7/14/2005 12:00:00 AM +00:00
"EPOXY PAINT MYANMAR CO., LTD.",False,12/3/2019 11:33:33 AM +06:30
MYANMAR TOP LUN TRADING COMPANY LIMITED,False,2/2/2019 6:12:46 AM +06:30
LAND OF NATURE  REAL ESTATE & CONSTRUCTION COMPANY LTD,False,1/15/2020 12:00:00 AM +06:30
ALLIANCE WASTE SERVICE COMPANY LIMITED,False,9/11/2020 5:10:07 PM +06:30
"Kalo Sein Co.,Ltd",False,9/8/1999 12:00:00 AM +00:00
GOLDEN GRAND VILLA RESORT & SPA HOTEL LIMITED,False,6/7/2013 12:00:00 AM +00:00
GOLD STEP COMPANY LIMITED,False,3/19/1996 12:00:00 AM +00:00
PRO TRADE COMPANY LIMITED,False,11/30/2012 12:00:00 AM +00:00
PUN HLAING CAPITAL COMPANY LIMITED,False,6/7/2001 12:00:00 AM +00:00
KYAW BAMAW TRADING COMPANY LIMITED,False,2/21/2018 12:00:00 AM +00:00
FMG COMPANY LIMITED,False,11/26/2013 12:00:00 AM +00:00
HTET MAY PHU COMPANY LIMITED,False,9/24/2014 12:00:00 AM +00:00
WEI CHUN COMPANY LIMITED,False,3/5/2020 10:13:58 AM +06:30
Myanmar Cherry Pan Travels Ltd.,False,6/21/2000 12:00:00 AM +00:00
VICTORIA LOIKAW COMPANY LIMITED,False,5/7/2019 1:26:52 PM +06:30
HEAD STONE COMPANY LIMITED,False,4/24/2014 12:00:00 AM +00:00
PKY COMPANY LIMITED,False,9/30/2016 12:00:00 AM +00:00
"Intertrust Asia Co., Ltd.",False,9/23/2009 12:00:00 AM +00:00
SMILE EMPIRE GAMES  COMPANY LIMITED,False,10/9/2020 7:10:10 PM +06:30
TUN TUN TAUK GOLD AND EMERALD INTERNATIONAL COMPANY LIMITED,False,10/25/2013 12:00:00 AM +00:00
HTUN UNITED ENGINEERING GROUP COMPANY LIMITED,False,11/1/2018 12:00:00 AM +06:30
"Golden Buffalo Mining Co.,Ltd.",False,10/17/2003 12:00:00 AM +00:00
S Y G COMPANY LIMITED,False,1/3/2018 12:00:00 AM +06:30
KYI SIN AYEYAR COMPANY LIMITED,False,5/29/2013 12:00:00 AM +00:00
 AYAR FIVE STARS CONSTRUCTIO COMPANY LTD,False,7/18/2017 12:00:00 AM +00:00
OAKTARA DI THAR COMPANY LIMITED,False,8/6/2013 12:00:00 AM +00:00
ZHONG DA YI JIA COMPANY LIMITED,False,4/2/2018 12:00:00 AM +00:00
MYANMAR CONCH CEMENT (YANGON) COMPANY LIMITED,True,11/7/2016 12:00:00 AM +00:00
CONSUMER GOODS MYANMAR LIMITED,False,1/27/2012 12:00:00 AM +00:00
SOUTHERN INFRASTRUCTURE COMPANY LIMITED,False,11/23/2015 12:00:00 AM +00:00
SILVERBIRD AUTO LOGISTICS LTD,False,3/12/2014 12:00:00 AM +00:00
GLOBAL ASIA MYANMAR TRAVEL & TOURS COMPANY LIMITED,False,12/23/2011 12:00:00 AM +00:00
KM MYANMAR COMPANY LIMITED,False,1/27/2020 9:59:09 AM +06:30
"MYANMAR EMPEROR INTERNATIONAL CONSTRUCTION CO., LTD",False,7/21/1997 12:00:00 AM +00:00
LIN YATI PHONE MYINT TRADING COMPANY LIMITED,False,4/6/2016 12:00:00 AM +00:00
THIT PIN COMPANY LIMITED,False,10/10/2018 12:00:00 AM +06:30
TIN WIN TUN PRODUCTION COMPANY LIMITED,False,10/20/2005 12:00:00 AM +00:00
GOLDEN WELL MANAGEMENT CONSULTANTS COMPANY LIMITED,False,6/10/2015 12:00:00 AM +00:00
"Ko San Oo - Ma Me Naing Co., Ltd.",False,10/6/1999 12:00:00 AM +00:00
"Myanmar First Runner Travels & Tours Co.,Ltd",False,11/1/2010 12:00:00 AM +00:00
GOLDEN TRI STAR COMPANY LIMITED,False,4/26/1995 12:00:00 AM +00:00
"Tun Morning Star Co., Ltd.",False,6/5/1997 12:00:00 AM +00:00
RICH ZONE COMPANY LIMITED,False,7/25/2014 12:00:00 AM +00:00
MOE PWINT YADANAR TRADING COMPANY LIMITED,False,3/13/2017 12:00:00 AM +00:00
CONNECT WAY COMPANY LIMITED,False,2/3/2017 12:00:00 AM +00:00
"ArKar Myint Co., Ltd.",False,7/16/1999 12:00:00 AM +00:00
THANTLANG THAR COMPANY LIMITED,False,4/9/2014 12:00:00 AM +00:00
PYAE HLYAN COMPANY LIMITED,False,5/12/2016 12:00:00 AM +00:00
TAKHON LIN LATT COMPANY LIMITED,False,8/25/2019 12:00:00 AM +00:00
RYOBI MYANMAR DISTRIBUTION SERVICE COMPANY LIMITED,True,5/2/2016 12:00:00 AM +00:00
"GOLDEN PRINCE CO., LTD",False,7/21/2004 12:00:00 AM +00:00
PYAE PYAE PHYO SAN COMPANY LIMITED,False,6/23/2020 9:24:58 PM +06:30
SHWE HTUN AUNG COMPANY LIMITED,False,3/10/2010 12:00:00 AM +00:00
Seinn Htun Tauk Jewellery Trading,False,12/27/1995 12:00:00 AM +00:00
"Khine Myint Myat Co., Ltd.",False,5/24/1999 12:00:00 AM +00:00
ZAWANNA THUKHA COMPANY LIMITED,False,8/8/2014 12:00:00 AM +00:00
SALOM COMPANY LIMITED,False,8/8/2018 12:00:00 AM +00:00
HLA MYAING SSP CONSTRUCTION COMPANY LIMITED,False,10/16/2012 12:00:00 AM +00:00
"VICTORY UNION CO., LTD",False,5/9/2019 12:00:00 AM +00:00
Z  MINING COMPANY LIMITED,False,3/5/2019 11:06:44 AM +06:30
ZZAM ELECTRIC COMPANY LIMITED,False,5/30/2018 12:00:00 AM +00:00
NATIONAL PROSPERITY GOLD GLOBAL COMPANY  LIMITED,True,2/23/2016 12:00:00 AM +00:00
MYINT MO SAN MYANMAR COMPANY LIMITED,False,11/25/2020 2:49:17 PM +06:30
"Shwe Yatanar Moe Co.,Ltd",False,12/1/2005 12:00:00 AM +00:00
MYANMAR SHWE SIN LIN COMPANY LIMITED,False,1/10/2019 12:00:00 AM +00:00
"KYAW NAING TA KAUNG BWAR INTERNATIONAL CO., LTD",False,3/22/2020 8:44:14 AM +06:30
"Green Apple Technology Co.,Ltd.",False,6/1/2009 12:00:00 AM +00:00
Parami Consultant Ltd.,False,9/27/2002 12:00:00 AM +00:00
POLLEN PRINTING SUPPLIES COMPANY LIMITED,False,5/16/2001 12:00:00 AM +00:00
M.Y.K GROUP OF MYANMAR COMPANY LIMITED,False,9/9/2020 5:37:28 AM +06:30
SHAN BROTHERS COMPANY LIMITED,False,4/3/2019 11:50:30 AM +06:30
KAUNG MIN KHANT IMPORT & EXPORT COMPANY LIMITED,False,6/24/2015 12:00:00 AM +00:00
7 WATER ENGINEERING & TRADING COMPANY LIMITED,False,4/6/2018 12:00:00 AM +00:00
SUCCESS WIN & SONS INTERNATIONAL COMPANY  LIMITED,False,9/1/2017 12:00:00 AM +00:00
NGWE KYAL KHIT COMPANY LIMITED,False,12/14/2016 12:00:00 AM +00:00
ALMOND FINANCE INC,False,6/25/2020 3:15:28 PM +06:30
GREAT MYANMAR GEMS JADE COMPANY LIMITED,False,9/26/2018 12:00:00 AM +06:30
GRAND MOUNTAIN COMPANY LIMITED,False,12/9/2013 12:00:00 AM +00:00
Bada Shin Gem & Jewellery  Ltd.,False,11/18/1997 12:00:00 AM +00:00
KA NYI HTUE (SHWE KAYIN) COMPANY LIMITED,False,8/9/2017 12:00:00 AM +00:00
HEIN THIT LWIN COMPANY LIMITED,False,6/16/2020 9:00:33 AM +06:30
AUNG M KHINE TRADING COMPANY LIMITED,False,7/25/2020 5:44:37 PM +06:30
POWER COOL ENGINEERING COMPANY LIMITED,False,2/4/2021 9:09:01 PM +06:30
SHWE DAUNG THEIN CONSTRUCTION COMPANY LIMITED,False,5/2/2016 12:00:00 AM +00:00
"Best Target Services Co., Ltd.",False,11/29/2006 12:00:00 AM +00:00
"Speed Travel & Tours Co., Ltd.",False,12/19/1995 12:00:00 AM +00:00
PATHEIN GOOD FRIENDS COMPNAY LIMITED,False,1/11/2018 12:00:00 AM +00:00
COMMODITY CONNECT PTE LTD.,False,11/4/2014 12:00:00 AM +00:00
AUNG NAN THITSAR  COMPANY  LIMITED,False,11/29/2018 12:00:00 AM +06:30
"Htat Oo Thar Co., Ltd.",False,8/10/2000 12:00:00 AM +00:00
KAN LINN LATT COMPANY LIMITED,False,12/19/2020 5:19:51 PM +06:30
RIH LAKE BLESSING COMPANY LIMITED,False,7/15/2016 12:00:00 AM +00:00
M C B S COMPANY LIMITED,False,12/8/2014 12:00:00 AM +00:00
SHWE YAUNG CHIN COMPANY LIMITED,False,9/1/2020 10:44:42 AM +06:30
KYI WIN YADANAR COMPANY LIMITED,False,12/17/2019 12:00:00 AM +06:30
K-  LEGAL CONSULT COMPANY LIMITED,False,10/7/2019 12:00:00 AM +06:30
GREEN MANDALAY GROUP COMPANY LIMITED,False,12/17/2019 12:00:00 AM +06:30
MYANMAR CONSOLIDATED MEDIA COMPANY LIMITED,False,9/21/2016 12:00:00 AM +06:30
"SEIN CHI LIN MINING CO., LTD.",False,2/29/2012 12:00:00 AM +00:00
ASIA EXCELLENCE COMPANY LIMITED,True,5/4/2018 12:00:00 AM +00:00
LASHIO DIAMOND STAR COMPANY LIMITED,False,4/2/2018 12:00:00 AM +00:00
SHI COMPANY LIMITED,False,5/5/2017 12:00:00 AM +00:00
LONG SHINING COMPANY LIMITED,False,1/3/2021 2:34:38 PM +06:30
GLOBAL LABOUR COMPANY LIMITED,False,1/16/2020 8:29:42 PM +06:30
UNITED CAN FACTORY COMPANY LTD,False,7/10/1998 12:00:00 AM +00:00
GLOBAL SHIPPING MANAGEMENT COMPANY LIMITED.,False,1/18/2013 12:00:00 AM +00:00
SAR YADANAR COMPANY LIMITED,False,3/22/2016 12:00:00 AM +00:00
MIGHTY SWAN TRADING COMPANY LIMITED,False,7/14/2009 12:00:00 AM +00:00
HSU LETT TOE COMPANY LIMITED,False,4/3/2012 12:00:00 AM +00:00
FORTUNE HEAVEN COMPANY LIMITED,False,7/7/2020 9:47:21 PM +06:30
ABAKSU COMPANY LIMITED,False,12/8/2015 12:00:00 AM +00:00
NAY BONE KABAR COMPANY LIMITED,False,10/5/2016 12:00:00 AM +06:30
AUNG WAI HEIN COMPANY LIMITED,False,12/11/2020 10:53:33 PM +06:30
NGWE KYEL SIN HTET COMPANY LIMITED,False,9/22/2018 7:47:35 AM +06:30
KYAUK SEIN TAUNG TAN GEMS COMPANY LTD,False,6/14/2019 8:15:40 PM +06:30
LADY JUSTICE COMPANY LIMITED,False,4/7/2020 4:51:14 PM +06:30
VIETNAM MYANMAR TECHNOLOGY COMPANY LIMITED,False,8/27/2018 12:00:00 AM +00:00
SHINING STONE COMPANY LIMITED,False,8/25/2010 12:00:00 AM +00:00
HAMMERHEAD COMPANY LIMITED,False,10/24/2020 8:24:46 AM +06:30
"Toshin Myanmar Services Co.,Ltd",False,6/18/2012 12:00:00 AM +00:00
DEWANT FINANCIAL LOAN MICROFINANCE COMPANY LIMITED,False,3/8/2019 7:59:15 PM +06:30
UAVX MYANMAR LIMITED,True,10/9/2018 12:00:00 AM +00:00
SHWE SIN AUNG MYAY COMPANY LIMITED,False,9/1/2008 12:00:00 AM +00:00
FOREVER GREEN JADE & GEMS COMPANY LIMITED,False,10/9/2008 12:00:00 AM +00:00
GO RICH COMPANY LIMITED,False,7/9/2015 12:00:00 AM +00:00
H&P EXPRESS COMPANY LTD,False,7/23/2020 1:05:44 PM +06:30
SHWE LU LIN COMPANY LIMITED,False,6/21/2005 12:00:00 AM +00:00
"Mizusaki And Friends Co., Ltd.",False,9/15/1997 12:00:00 AM +00:00
GURKHA COMPANY LIMITED,False,6/3/2014 12:00:00 AM +00:00
ROYAL PRESTIGE COMPANY LIMITED,False,7/7/2016 12:00:00 AM +00:00
Thilawar32,False,7/1/2014 12:00:00 AM +00:00
THAND HLIANG LUNG COMPANY ,False,5/4/2017 12:00:00 AM +00:00
"New Campus Co., Ltd.",False,5/24/2000 12:00:00 AM +00:00
UHA COMPANY  LIMITED,False,5/12/2015 12:00:00 AM +00:00
PERFECT LIFE TRADING COMPANY LIMITED,False,11/1/2012 12:00:00 AM +00:00
POST MANDALAY MEDIA COMPANY LIMITED,False,7/27/2005 12:00:00 AM +00:00
TOUR  BAZAAR  COMPANY  LIMITED,False,8/17/2018 12:00:00 AM +00:00
LIFENG ELECTROMECHANICAL COMPANY LIMITED,True,1/15/2018 12:00:00 AM +00:00
LIN NAY CHI COMPANY LIMITED,False,5/14/2014 12:00:00 AM +00:00
THU RAIN SOE SAN COMPANY LIMITED,False,12/16/2019 12:00:00 AM +06:30
WING WIN WEALTH CONSTRUCTION COMPANY LIMITED,False,8/6/2020 12:09:34 PM +06:30
GLOBAL ABLEST SERVICE COMPANY LIMITED,False,6/12/2020 4:53:29 PM +06:30
LUCKY ASIA INTERNATIONAL COMPANY LIMITED,False,7/13/2000 12:00:00 AM +00:00
Izumi Enterprise Ltd.,False,10/18/1996 12:00:00 AM +00:00
"Far East Mart Co., Ltd.",False,1/28/2011 12:00:00 AM +00:00
MIN THANT MAUNG (MTM) COMPANY LIMITED,False,11/16/2018 3:09:33 PM +06:30
MYANMA PEARL TRAVELS  & TOURS  COMPANY  LIMITED,False,4/6/2004 12:00:00 AM +00:00
GRIT CONSULTANCY GROUP PTE LTD,False,1/9/2021 8:38:54 PM +06:30
NAING LINN STAR CONSTRUCTION COMPANY LIMITED,False,10/19/2019 1:29:17 PM +06:30
PERFECT FIVE COMPANY LIMITED,False,9/15/2017 12:00:00 AM +06:30
ACVIRON ACOUSTICS CONSULTANTS  (MYANMAR) COMPANY LIMITED,False,10/2/2019 12:00:00 AM +06:30
SERAPHIM COMPANY LIMITED,False,10/23/2013 12:00:00 AM +00:00
ENERGY RELIABLE ACE COMPANY LIMITED,False,4/1/2016 12:00:00 AM +00:00
LSC - FMI COMPANY LIMITED,False,2/21/2014 12:00:00 AM +00:00
AYEYARNADY ADVANDED ENGINEERING COMPANY LIMITED,False,5/23/2013 12:00:00 AM +00:00
CHERRY MAYKHA COMAPNY LIMITED,False,2/24/2017 12:00:00 AM +00:00
"Tin Family Trading Co., Ltd.",False,8/27/1998 12:00:00 AM +00:00
SHI WAI YAN COMPANY LIMITED,False,2/22/2018 12:00:00 AM +00:00
KHIT THIT AYARMIN COMPANY LIMITED,False,10/2/2019 12:00:00 AM +06:30
K M W BROTHERS  COMPANY LIMITED,False,7/20/2017 12:00:00 AM +00:00
CENTURY RAYS COMPANY LIMITED,False,2/18/2020 9:39:54 PM +06:30
CERISE STAR SERVICES COMPANY LIMITED,False,6/5/2008 12:00:00 AM +00:00
UNIVERSAL ACARY BO COMPANY LIMITED,False,12/1/2011 12:00:00 AM +00:00
MYAT SAN YATI COMPANY LIMITED,False,6/27/2020 3:14:00 PM +06:30
PACIFIC -AA HOTELS LIMITED,False,5/3/2013 12:00:00 AM +00:00
AYEYARWADDY UNITED CONSTRUCTION COMPANY LIMITED,False,10/15/2010 12:00:00 AM +00:00
B'SMART MYANMAR COMPANY LIMITED,False,3/7/2016 12:00:00 AM +00:00
VEGA PRINCESS COMPANY LIMITED,False,8/19/2014 12:00:00 AM +00:00
DED GROUP COMPANY LIMITED,False,12/1/2020 8:32:30 PM +06:30
CITY PRIZE COMPANY LIMITED,False,7/16/2018 12:00:00 AM +00:00
OKAKAR MINN THIDA CONSTRUCTION & TRADING COMPANY LIMITED,False,2/12/2014 12:00:00 AM +00:00
MIMM COMPANY LIMITED,False,1/25/2017 12:00:00 AM +00:00
"Tet Kaung Kin Trading Co., Ltd.",False,4/2/2001 12:00:00 AM +00:00
AUNG MYAE SEIN YADANAR COMPANY LIMITED.,False,7/6/2015 12:00:00 AM +00:00
PAUK KYAW GROUP COMPANY LIMITED,False,1/21/2008 12:00:00 AM +00:00
THAN GADAY KYWE COMPANY LIMITED,False,3/13/2015 12:00:00 AM +00:00
"Ruby Lion Services Co., Ltd.",False,12/2/2002 12:00:00 AM +00:00
SIN KYAL SU COMPANY LIMITED,False,5/7/2019 9:40:17 PM +06:30
JIU ZHU CONSTRUCTION COMPANY LIMITED,True,3/26/2020 12:55:42 PM +06:30
DIAMOND EYE COMPANY LIMITED,False,4/1/2011 12:00:00 AM +00:00
CREDO MYANMAR PRIVATE COMPANY LIMITED,False,12/24/2018 8:38:28 AM +06:30
KSA COMPANY LIMITED,False,11/15/2017 12:00:00 AM +00:00
MYA THI CHAL COMPANY LIMITED,False,7/18/2013 12:00:00 AM +00:00
MM GREEN TECH MEDIA COMPANY LIMITED,False,7/12/2019 4:22:01 PM +06:30
KRONEX INFRA COMPANY LIMITED,False,2/17/2017 12:00:00 AM +00:00
YE HTET MYAT COMPANY LIMITED,False,10/30/2015 12:00:00 AM +00:00
MODERN HIGHLANDER COMPANY LIMITED,False,9/6/2016 12:00:00 AM +00:00
QUAN GUAN MINING COMPANY LIMITED,False,1/15/2020 7:23:58 PM +06:30
ASIAN JUST COMPANY LIMITED,True,6/29/2017 12:00:00 AM +00:00
"Aung Soe Moe War War Win Co.,Ltd.",False,3/19/2010 12:00:00 AM +00:00
MYINT MYAT AUNG MYIN COMPANY LIMITED,False,11/30/2018 12:00:00 AM +00:00
HAFELE (MYANMAR) LIMITED,True,2/13/2014 12:00:00 AM +00:00
MYANMAR FARMERS COMPANY LIMITED,False,12/19/2012 12:00:00 AM +00:00
ZWE MANN KHANT COMPANY LIMITED,False,8/23/2017 12:00:00 AM +00:00
LNS MYANMAR COMPANY LIMITED,True,4/23/2018 12:00:00 AM +00:00
KAUNG SU HAN COMPANY LIMITED,False,11/19/2012 12:00:00 AM +00:00
"Golden Optical Trading Co.,Ltd",False,2/10/2000 12:00:00 AM +00:00
BAM-DESIGN (STW) COMPANY LIMITED,False,5/23/2019 4:45:31 PM +06:30
"GOLDEN COSMOS CO., LTD.",False,5/10/2002 12:00:00 AM +00:00
J - ELEVEN COMPANY LIMITED,False,2/2/2019 3:12:52 PM +06:30
EASTERN AVA TRADING COMPANY LIMITED,False,11/1/1994 12:00:00 AM +00:00
ZHI TUI MECHANCIAL AUTOMATION EQUIPMENT TECHNOLOGY COMPANY LIMITED,False,11/26/2019 7:27:28 PM +06:30
TIPTOP LIGHT COMPANY LIMITED,False,11/6/2009 12:00:00 AM +06:30
THIN PYANT PYANT GROUP CONSTRUCTION & GENERAL SERVICES COMPANY LIMITED,False,1/10/2014 12:00:00 AM +00:00
YNC GLOBAL TRADING COMPANY LIMITED,True,12/1/2020 2:23:27 PM +06:30
HEIN KAUNG SAT MINING COMPANY LIMITED,False,12/31/2008 12:00:00 AM +06:30
IKEDA COMPANY LIMITED,False,8/6/2015 12:00:00 AM +00:00
"EVER FLOW RIVER MANUFACTURING CO., LTD",False,11/23/2004 12:00:00 AM +00:00
"ORIGIN PURCHASING SERVICES CO., LTD",False,8/7/2020 7:12:16 PM +06:30
"Super Zenith Co., Lt.",False,9/30/1998 12:00:00 AM +00:00
THEIN HTOON AUNG COMPANY LIMITED,False,3/21/1995 12:00:00 AM +00:00
DELTA PRINCE COMPANY LIMITED,False,1/7/2020 12:00:00 AM +06:30
HTOO SHWE SIN COMPANY LIMITED,False,5/12/2014 12:00:00 AM +00:00
AUNG SHWE NGWE COMPANY LIMITED,False,3/30/2019 4:01:36 PM +06:30
MYANMAR INTEGRATED BUSINESS SERVICES COMPANY LIMITED,False,7/5/2010 12:00:00 AM +00:00
"NEW NAVIGATION CO.,  LTD",False,12/4/2019 10:51:02 AM +06:30
MAWKOM YADANAR THIKE COMPANY LIMITED,True,11/26/2019 12:00:00 AM +06:30
PHU PWINT KHINE COMPANY LIMITED,False,3/25/2013 12:00:00 AM +00:00
GOLDEN WINTER COMAPNY LIMITED,False,3/6/2017 12:00:00 AM +00:00
PYOE KHINN THIT COMPANY LIMITED,False,7/27/2016 12:00:00 AM +00:00
BONCHON MYANMAR COMPANY LIMITED,True,10/3/2014 12:00:00 AM +00:00
UNITED 9 COMPANY LIMITED,False,9/28/2015 12:00:00 AM +00:00
THIHA WIN BO COMPANY LIMITED,False,11/19/2019 12:00:00 AM +06:30
SU LIN PAN MYA MO COMPANY LIMITED.,False,6/21/2013 12:00:00 AM +00:00
"SS  Holding  Co.,  Ltd.",False,6/19/1996 12:00:00 AM +00:00
"AWRA CONSTRUCTION CO., LTD.",False,5/2/2019 11:25:29 AM +06:30
FAST GREENLAND COMPANY LIMITED,False,4/30/2018 12:00:00 AM +00:00
RAZER GAMING COMPANY LIMITED,False,3/6/2020 8:59:39 PM +06:30
NGEE CHIN ENGINEERING (MYANMAR) PRIVATE COMPANY LIMITED,True,9/21/2017 12:00:00 AM +00:00
MANDALAR  MANDALAY COMPANY LIMITED,False,3/8/2019 3:16:33 PM +06:30
PERFECT MANDALAY COMPANY LIMITED,False,4/10/2018 12:00:00 AM +00:00
TANINTHARYI CONCRETE PRODUCTS COMPANY LIMITED,False,8/25/2017 12:00:00 AM +00:00
NGWE TUN TOE KYWE CONSTRUCTION COMPANY LIMITED,False,2/15/2013 12:00:00 AM +00:00
"Zeus International Co., Ltd.",False,9/27/2002 12:00:00 AM +00:00
NEW JOYFUL COMPANY LIMITED,False,11/16/2015 12:00:00 AM +00:00
SHWE EAINDAR COMPANY LIMITED,False,4/11/2018 12:00:00 AM +00:00
INVINCIBLE COMPANY LIMITED,False,11/15/2018 12:00:00 AM +00:00
GOODWILL G.W COMPANY LIMITED,False,1/2/2019 12:00:00 AM +00:00
WIN & TRUSTY COMPANY LIMITED,False,10/9/2019 1:07:18 PM +06:30
PYAE WA SOE PYAY COMPANY LIMITED,False,5/31/2018 12:00:00 AM +00:00
DRAGON MASTER COMPANY LIMITED,False,5/25/2011 12:00:00 AM +00:00
J T L JOHN KHAM COMPANY LIMITED,False,11/21/2017 12:00:00 AM +00:00
FUTURE GIFT INTERNATIONAL LTD.,False,12/9/2003 12:00:00 AM +00:00
OAK SOE PAING COMPANY LIMITED,False,6/20/2017 12:00:00 AM +00:00
LIANG CHI ENTERPRISE (MYANMAR) COMPANY LIMITED,True,5/9/2014 12:00:00 AM +00:00
DOUBLE POWER COMPANY LIMITED,False,5/15/2015 12:00:00 AM +00:00
