VERY GOOD FLOWER MINING COMPANY LIMITED,False,8/21/2007 12:00:00 AM +00:00
NGWE NAYT THIT COMPANY LIMITED,False,3/5/2014 12:00:00 AM +00:00
SHIPPING WORLD COMPANY LIMITED,False,8/1/2019 7:13:13 PM +06:30
FAMILY LAND CONSTRUCTION COMPANY LIMITED,False,3/14/2019 12:00:00 AM +00:00
SHWE LAT MYE' COMPANY LIMITED,False,1/10/2014 12:00:00 AM +06:30
TELEPHONE EYE DROP PHARMACEUTICALS COMPANY LIMITED,False,11/10/2018 7:31:12 AM +06:30
ASIA ID COMPANY LIMITED,False,9/30/2016 12:00:00 AM +00:00
"PRO ELECTRIC POWER CO., LTD",False,9/15/2016 12:00:00 AM +06:30
"THIT SAR SWAN ARR CO.,LTD.",False,1/23/2012 12:00:00 AM +00:00
"GREEN LAND FOREVER CO., LTD.",False,5/19/2020 12:00:00 AM +00:00
LAVENDER BLOSSOM COMPANY LTD,False,1/27/2011 12:00:00 AM +00:00
ZING POWER COMPANY LIMITED,False,11/14/2019 10:48:49 AM +06:30
MANDALAY REGION TREASURER GEMS & JEWELLERY ENTREPRENEURS  ASSOCIATION - INCORPORATED,False,9/7/2018 12:00:00 AM +00:00
"Hsu Pan Travels & Tours Co.,Ltd.",False,6/7/2000 12:00:00 AM +00:00
TRINITY APPARELS LIMITED,True,8/19/2015 12:00:00 AM +00:00
NEXT MARKETING SOLUTIONS LIMITED,False,9/17/2018 12:00:00 AM +06:30
RAR MAUNG THAR ARR MANN COMPANY LIMITED,False,7/27/2020 5:44:38 AM +06:30
"TITANIUM BUILDING CO., LTD",False,9/9/2020 6:38:24 PM +06:30
TAI LAT YAR COMPANY LIMITED,False,6/9/2017 12:00:00 AM +00:00
EUGENIA GOLD COMPANY LIMITED,False,10/26/2016 12:00:00 AM +00:00
"PYAE WA CHAN THAR MINGALAR CO., LTD.",False,9/13/2019 12:00:00 AM +00:00
"C . Y Engineering Co., Ltd",False,2/28/2012 12:00:00 AM +00:00
P AND A ALLIANCE LOGISTICS COMPANY LIMITED,False,4/5/2018 12:00:00 AM +00:00
YOU LAN COMPANY LIMITED,False,8/25/2015 12:00:00 AM +00:00
SHWE POWINT COMPANY LIMITED,False,4/8/2016 12:00:00 AM +00:00
Indofil Industries Limited,False,3/15/2017 12:00:00 AM +00:00
MYANMAR GOLDEN HARVEST COMPANY LIMITED,False,5/18/2016 12:00:00 AM +00:00
"Min Han Win Travels & Tours Co., Ltd.",False,2/11/1997 12:00:00 AM +00:00
ZAW THU TUN TRADING COMPANY LIMITED,False,8/12/2009 12:00:00 AM +00:00
"Yangon Panorama Trading Co., Ltd.",False,4/4/2000 12:00:00 AM +00:00
KANT KYAW MYAY MINING COMPANY LIMITED,False,1/11/2013 12:00:00 AM +00:00
KAUNG MYAT MON GEMS & JEWELLERY COMPANY LIMITED,False,6/15/2004 12:00:00 AM +00:00
PRIME UNITY TRADING COMPANY LIMITED,False,2/1/2008 12:00:00 AM +00:00
"Linn Linn Htet International Trading Co., Ltd.",False,5/3/2005 12:00:00 AM +00:00
KHIT THIT SHWE ARR  MAN COMPANY LIMITED,False,10/2/2020 4:30:21 PM +06:30
Home Product Manufacturing Co.Ltd.,False,2/4/1997 12:00:00 AM +00:00
YOUCAN COMPANY LIMITED.,False,2/16/2016 12:00:00 AM +00:00
"Honest  Trading Co.,Ltd ",False,8/5/2009 12:00:00 AM +00:00
XEROVIT PTE LTD,False,8/14/2019 12:00:00 AM +00:00
ROYAL JUSTICE ENGINEERING CONSULTANT & CONSTRUCTION COMPANY LIMITED,False,1/18/2018 12:00:00 AM +00:00
THANDA NGWE HLAING COMPANY LIMITED,False,1/18/2018 12:00:00 AM +00:00
SHWE MYIN SOUNG COMPANY LIMITED,False,8/3/2020 8:45:11 PM +06:30
THE ROYAL COASTAL COMPANY LIMITED,False,3/20/2020 8:43:23 PM +06:30
MOUNTAINIAN COMPANY LIMITED,False,5/7/2018 12:00:00 AM +00:00
"Silver Dagon Co., Ltd.",False,5/7/2004 12:00:00 AM +00:00
THUZAR LINN COMPANY LIMITED,False,1/18/2019 12:00:00 AM +00:00
MYKO FIRST INTERNATIONAL COOPERATION COMPANY LIMITED,True,11/30/2019 4:38:58 PM +06:30
SHWE PYONE COMPANY LIMITED,False,6/9/2017 12:00:00 AM +00:00
"BUILDCON CO.,LTD.",True,7/11/2017 12:00:00 AM +00:00
"Khaing Khant Plastic Industry Co., Ltd.",False,5/25/2000 12:00:00 AM +00:00
"Living Stone Production Co.,Ltd",False,8/9/2005 12:00:00 AM +00:00
HOLIDAYS SMITH MYANMAR COMPANY LIMITED,False,7/11/2017 12:00:00 AM +00:00
TET HLAING SERVICES COMPANY LIMITED,False,3/7/2014 12:00:00 AM +00:00
ARKAR PHYO KYAW COMPANY LIMITED,False,4/24/2018 12:00:00 AM +00:00
SOON ENTERPRISE COMPANY LIMITED,False,2/26/2013 12:00:00 AM +00:00
"SAI FARM CO., LTD.",False,2/23/2020 10:34:14 PM +06:30
FUTURO-CASA COMPANY LIMITED,False,4/28/2016 12:00:00 AM +00:00
"AUNG KHANT SU PAING MINING & PRODUCTION CO.,LTD.",False,7/25/2008 12:00:00 AM +00:00
MYANMAR INTERNATIONAL INNOVATION ACADEMY LTD,False,8/19/2020 9:12:28 PM +06:30
PEACE OMEN COMPANY LIMITED,False,11/9/2015 12:00:00 AM +00:00
NEW FAMILY COMPANY LIMITED.,False,4/5/2016 12:00:00 AM +00:00
YU HE TRADING COMPANY LIMITED,False,12/9/2016 12:00:00 AM +00:00
LIN LAT DAWEI COMPANY LIMITED,False,4/4/2018 12:00:00 AM +00:00
BEST OF BRILLIANCE (BOB) COMPANY LIMITED,False,7/2/2019 4:53:35 PM +06:30
CAPITAL K CONSTRUCTION  COMPANY  LIMITED,False,8/18/2014 12:00:00 AM +00:00
ITALY-MYANMAR.TOGETHER LTD GTY,True,1/21/2019 12:37:48 PM +06:30
"Royal Cherry Co., Ltd.",False,10/4/2006 12:00:00 AM +00:00
RAY MANPOWER SERVICES COMPANY LIMITED,False,10/25/2006 12:00:00 AM +06:30
TOUR  DE  INLE COMPANY LIMITED,False,10/4/1994 12:00:00 AM +06:30
LYNN THIHA MINING COMPANY LIMITED,False,12/15/2011 12:00:00 AM +00:00
MANDALA TRADING COMPANY LIMITED,False,10/2/2019 12:00:00 AM +06:30
TOUR PLUS COMPANY LIMITED,False,2/11/2020 9:12:54 PM +06:30
JIN HUA MYANMAR TRAVEL AGENCY COMPANY LIMITED,False,10/20/2018 12:00:00 AM +00:00
Myanmar  MBF  Education  Group  Ltd.,False,6/11/1996 12:00:00 AM +00:00
SWAN YEE TOE COMPANY LIMITED,False,7/14/2017 12:00:00 AM +00:00
AUNG MYINT MYAT HTUN CONSTRUCTION COMPANY LIMITED,False,7/17/2017 12:00:00 AM +00:00
"Diamond Mountain Co., Ltd.",False,2/25/1997 12:00:00 AM +00:00
MYA NAN COMPANY LIMITED,False,7/22/2016 12:00:00 AM +00:00
MOE LYAN COMPANY LIMITED,False,5/13/2019 12:00:00 AM +00:00
SE YAY HOTEL COMPANY LIMITED,False,2/17/2011 12:00:00 AM +00:00
SHWE NGWE PAN COMPANY LIMITED,False,1/9/2020 12:00:00 AM +06:30
MIZZIMA & MTN COMPANY LIMITED,False,7/31/2020 7:12:29 AM +06:30
SHWE KYAUK AI COMPANY LIMITED,False,7/27/2016 12:00:00 AM +00:00
TWO STAR ( K.M.T) COMPANY LIMITED,False,9/21/2018 12:00:00 AM +00:00
GMS GARDEN MAINTAINING SERVICE COMPANY LIMITED,False,8/20/2020 8:37:44 PM +06:30
SOYAI COMPANY LIMITED,False,10/21/2019 7:11:40 PM +06:30
"First Asia Dragon Trading Co.,Ltd.",False,8/4/1998 12:00:00 AM +00:00
SECURE LIFE COMPANY LIMITED,False,5/27/2015 12:00:00 AM +00:00
NAING HTET WAI SERVICES COMPANY LIMITED,False,9/8/2011 12:00:00 AM +00:00
LWIN OO HTWE TRADING COMPANY LIMITED,False,2/26/2010 12:00:00 AM +00:00
GIGANTIC COMPANY LIMITED,False,8/30/2016 12:00:00 AM +06:30
WELCOME WORLD GEMS COMPANY LIMITED.,False,11/26/2014 12:00:00 AM +00:00
MINGALARBAR UNIVERSAL  COMPANY LIMITED,False,8/4/2015 12:00:00 AM +00:00
TRILLION OCEAN COMPANY LIMITED,False,6/10/2019 3:46:39 PM +06:30
MYANMAR INVENTIVE ENGINEERING COMPANY LIMITED,False,7/26/2011 12:00:00 AM +00:00
KHAING SANN THAR COMPANY LIMITED,False,10/4/2018 12:00:00 AM +00:00
"Aung Kabar Kyaw Co., Ltd.",False,5/12/1999 12:00:00 AM +00:00
YADANAR SHWE MOUNG COMPANY LIMITED,False,7/5/2016 12:00:00 AM +00:00
KAUNG KITCHEN COMPANY LIMITED,False,8/21/2020 7:50:39 PM +06:30
NAVESSE TRAINING AND CONSULTING LIMITED,True,8/7/2018 12:00:00 AM +00:00
MY GROUP (MYANMAR) COMPANY LIMITED,False,8/7/2017 12:00:00 AM +00:00
SYNERGY GROWTH AUDIT & CONSULTING COMPANY LIMITED,False,12/3/2019 9:51:34 AM +06:30
KING EMPIRE COMPANY LIMITED,False,5/26/2017 12:00:00 AM +00:00
"JIN SHUO  CO., LTD",False,1/9/2020 12:00:00 AM +06:30
"PRIME ASIA LEATHER COPORATION CO., LTD",False,2/11/2020 8:38:39 PM +06:30
EMPEROR KING COMPANY LIMITED,False,9/20/2019 12:00:00 AM +06:30
WUNT SHWIN COMPANY LIMITED,False,7/9/2018 12:00:00 AM +00:00
MYANMAR THIRI HOTEL & TRADE LIMITED,False,3/7/1994 12:00:00 AM +00:00
"Ei Pain Manufacturing Co., Ltd.",False,5/16/2003 12:00:00 AM +00:00
YADANAR PAN SAN MINING COMPANY LIMITED,False,3/22/2013 12:00:00 AM +00:00
MYO MYINT KYAW COMPANY LIMITED,False,1/21/2019 12:00:00 AM +00:00
DAW KHIN NYEIN COMPANY LIMITED,False,2/16/2016 12:00:00 AM +00:00
ZWE THIHA HEIN COMPANY LIMITED,False,4/21/2020 8:13:00 PM +06:30
"Fast Dragon Travel & Tours Co.,Ltd.",False,6/21/1994 12:00:00 AM +00:00
LUCKY BLOSSOM COMPANY LIMITED,False,2/10/2016 12:00:00 AM +00:00
FIREFLY COMPANY LIMITED,False,10/12/2017 12:00:00 AM +00:00
"PROMOWORLD MYANMAR CO ., LTD.",False,8/8/2019 3:56:41 PM +06:30
SPRAYING SYSTEMS CO. (SINGAPORE) PTE LTD,False,9/16/2016 12:00:00 AM +00:00
SHWE NYUNT SAN EAIN COMPANY LIMITED,False,9/10/2013 12:00:00 AM +00:00
YANGON K.T.K COMPANY LIMITED,False,7/16/2018 12:00:00 AM +00:00
YMTU CONSTRUCTION COMPANY LIMITED,False,9/24/2019 1:22:13 PM +06:30
MOTHER PALACE CONSTRUCTION COMPANY LIMITED,False,10/3/2014 12:00:00 AM +00:00
K KAN COMPANY LIMITED,False,9/14/2018 12:00:00 AM +00:00
MYAT HNIN SHWESIN CONSTRUCTION COMPANY LIMITED,False,10/20/2020 6:06:40 PM +06:30
"Shwe Ke` Industry and Mining Co., Ltd.",False,11/17/2007 12:00:00 AM +00:00
MYANMAR SHWE LAND NGWE LAND COMPANY LIMITED,False,9/6/2018 12:00:00 AM +00:00
YT & AYE COMPANY LIMITED,False,6/25/2015 12:00:00 AM +00:00
"Nu Life Travels & Tours Co., Ltd. ",False,2/5/2010 12:00:00 AM +00:00
SHIN YANT GEMS COMPANY LTD,False,7/3/1996 12:00:00 AM +00:00
PHYO MYAT AUNG COMPANY LIMITED,False,10/17/2018 12:00:00 AM +06:30
GOLDEN LYRA COMPANY LIMITED,False,5/6/2016 12:00:00 AM +00:00
"LION STAR BROTHER CONSTRUCTION CO., LTD.",False,11/23/2020 11:11:16 PM +06:30
NAING FAMILY CONSTRUCTION MATERIALS TRADING COMPANY LIMITED,False,8/30/1996 12:00:00 AM +00:00
"Zay Yar International Co., Ltd.",False,8/13/2001 12:00:00 AM +00:00
LOI YOE COMPANY LIMITED,False,10/28/2018 12:00:00 AM +00:00
AYAR LAND CONSTRUCTION COMPANY LIMITED,False,4/26/2017 12:00:00 AM +00:00
ZAYAR THALAR CONSTRUCTION COMPANY LIMITED,False,10/11/2018 12:00:00 AM +00:00
SHWE SEIN LAE MYAY CONSTRUCTION COMPANY LIMITED,False,8/2/2016 12:00:00 AM +00:00
TREASURE LINN GEMS COMPANY LIMITED,False,6/27/2008 12:00:00 AM +00:00
"Attic International Hotel Group Co., Ltd.",False,6/14/2016 12:00:00 AM +00:00
SHWE HLAE YIN TRAVELS & TOURS COMPANY LIMITED,False,2/1/2011 12:00:00 AM +00:00
ALIBABA AMUSEMENT COMPANY LIMITED,False,6/30/2017 12:00:00 AM +00:00
ARRMHAN HTUT COMPANY LIMITED,False,4/5/2019 8:06:31 AM +06:30
WOLF KITCHEN COMPANY LIMITED,True,12/2/2019 12:00:00 AM +06:30
"RIFLE AERO MEDIA CO., LTD.",False,4/10/2018 12:00:00 AM +00:00
FIRST SAMUEL  COMPANY LIMITED,False,1/26/2021 10:45:47 PM +06:30
NGWE HNIN YAUNG CHI COMPANY LIMITED,False,6/2/2015 12:00:00 AM +00:00
"API Gilex International Co.,Ltd.",False,1/29/1997 12:00:00 AM +00:00
SKY MIN HTET HOME DECORATION COMPANY LIMITED,False,9/19/2018 12:00:00 AM +00:00
MYANMAR CAR GALLERY COMPANY LIMITED,False,6/22/2017 12:00:00 AM +00:00
"KAN TUN PAW Co.,Ltd.",False,7/4/2008 12:00:00 AM +00:00
NAY LA TAIN COMPANY LIMITED,False,9/18/2014 12:00:00 AM +00:00
TOE LWIN LWIN AUNG COMPANY LIMITED,False,3/10/2010 12:00:00 AM +00:00
HOUSEHOLD TEXTILE & TEXTURE HOLDER COMPANY LIMITED,False,1/9/2014 12:00:00 AM +00:00
GREAT N.N.N COMPANY LIMITED,False,10/31/2017 12:00:00 AM +00:00
Fujitrans Corporation (Myanmar Representative Office),False,1/31/2013 12:00:00 AM +00:00
MAY PYONE KHINE COMPANY LIMITED,False,10/24/2014 12:00:00 AM +00:00
"Sein Kant Kaw Pwint Co.,Ltd",False,8/9/2011 12:00:00 AM +00:00
FOCUS PROJECTS & ENGINEERING ( MYANMAR) COMPANY LIMITED,False,2/11/2016 12:00:00 AM +00:00
PHONE DANA LIN COMPANY LIMITED,False,9/26/2018 2:39:20 AM +06:30
GREAT OVER GREAT COMPANY LIMITED,False,1/28/2020 3:00:25 PM +06:30
"GOLDEN GONG FAMILY GROUP MINING Co.,Ltd.",False,2/4/2008 12:00:00 AM +00:00
"SHWE THAN SINN SERVICES CO., LTD",False,6/28/2004 12:00:00 AM +00:00
DAWEI FUTURE COMPANY LIMITED,False,10/29/2013 12:00:00 AM +00:00
"Silver Snowflake Model Agency Co.,Ltd.",False,9/6/2002 12:00:00 AM +00:00
ROCKET  T.Z GROUP COMPANY LIMITED,False,1/5/2015 12:00:00 AM +00:00
ANTARCTICA COOLING AND HEATING COMPANY LIMITED,False,5/18/2018 12:00:00 AM +00:00
"Myanma Shwe Padauk Travels & Tours Co., Ltd.",False,7/16/1999 12:00:00 AM +00:00
SEIN STAR COMPANY LIMITED,False,5/19/2017 12:00:00 AM +00:00
NATURE GARDEN COMPANY LIMITED,False,10/20/2017 12:00:00 AM +06:30
ULTERIOR COMPANY LIMITED,False,1/7/2016 12:00:00 AM +00:00
MYANMAR BRILLIANT PHOENIX SERVICES COMPANY LIMITED,False,5/16/2014 12:00:00 AM +00:00
GOLDEN MYANMAR  ZAW G  LTD,False,12/5/2019 12:00:00 AM +06:30
"MYANMAR V Z TECHNOLOGY SERVICE CO., LTD",True,11/28/2018 12:00:00 AM +00:00
"Yang Kyin International Trading Co., Ltd.",False,8/27/1996 12:00:00 AM +00:00
PERFECT SUCCESS COMPANY LIMITED,False,11/1/2012 12:00:00 AM +00:00
MAX PERFECT COMPANY LIMITED,False,5/25/2017 12:00:00 AM +00:00
ROYAL GOLDEN PALACE COMPANY LIMITED,False,9/22/2018 8:14:41 AM +06:30
K PIONEER FIBER TECH COMPANY LIMITED,False,12/4/2015 12:00:00 AM +00:00
"KYAW HI-TECH CO., LTD",False,7/4/2019 12:00:00 AM +00:00
KHIN KYAW COMPANY LIMITED,False,2/5/2016 12:00:00 AM +00:00
MYANMAR CINEPLEX COMPANY LIMITED,True,7/24/2014 12:00:00 AM +06:30
NANACHART TRADERS CONSOLIDATION LTD.,False,8/10/2015 12:00:00 AM +00:00
LIN YAUNGI COMPANY LIMITED,False,11/24/2019 12:00:00 AM +06:30
"MNH CO., LTD.",False,6/13/2018 12:00:00 AM +00:00
"TREASURE SOURCE TRADING Co.,Ltd.",False,5/30/2011 12:00:00 AM +00:00
LET SHWE YEE COMPANY LIMITED,False,11/8/2018 12:00:00 AM +06:30
NUT JOBS AUTOMOTIVE AESTHETICS COMPANY LIMITED,False,1/30/2019 8:06:42 PM +06:30
YOKO SUN COMPANY LIMITED,False,5/12/2016 12:00:00 AM +00:00
XAN IT SOLUTIONS COMPANY LIMITED,True,5/21/2018 12:00:00 AM +00:00
PHOO YAN COMPANY LIMITED,False,11/29/2016 12:00:00 AM +00:00
NYAN THIT TRADING COMPANY LIMITED,False,6/3/2011 12:00:00 AM +00:00
SEINN MAHAR MYAT COMPANY LIMITED,False,6/4/2019 12:00:00 AM +00:00
FOR YOU FASHION COMPANY LIMITED,False,4/5/2019 12:00:00 AM +00:00
NEWTOP LOTUS COMPANY LIMITED,True,8/21/2017 12:00:00 AM +00:00
GLOBAL RISE COMPANY LIMITED,False,6/8/2016 12:00:00 AM +00:00
GLOBAL LANGUAGE LEADERSHIP COMPANY LIMITED,False,12/20/2019 12:00:00 AM +06:30
ACRO COMPANY LIMITED,False,1/27/2003 12:00:00 AM +00:00
THAYET THAR COMPANY LIMITED,False,5/12/2017 12:00:00 AM +00:00
"Lynx Entertainment Co., Ltd.",False,2/18/1998 12:00:00 AM +00:00
GOLDEN SEED  AGRO PRODUCTION  COMPANY LIMITED,False,7/25/2020 6:27:31 AM +06:30
NORTH POLE CONSTRUCTION COMPANY LIMITED,False,1/16/2020 6:56:01 PM +06:30
FULL MOON TRAVELS & TOURS COMPANY LIMITED,False,1/20/1997 12:00:00 AM +00:00
JADE DRAGON ZAW LINN COMPANY LIMITED,False,6/27/2018 12:00:00 AM +00:00
I P G COMPANY LIMITED,False,11/10/2014 12:00:00 AM +00:00
THE GREEN COMPANY LIMITED,False,11/26/2018 12:00:00 AM +06:30
NICE FOOD  COMPANY LIMITED,False,2/8/2011 12:00:00 AM +00:00
CHOA MYANMAR COMPANY LIMITED,True,12/25/2019 12:00:00 AM +06:30
"HCM SOLUTIONS   CO., LTD.",True,11/30/2016 12:00:00 AM +06:30
GUYOMARC'H FORTUNE ANIMAL NUTRITION LTD.,True,12/21/1999 12:00:00 AM +00:00
MYANMA MOE MYAY COMPAMY LIMITED,False,1/25/2013 12:00:00 AM +00:00
BRAVE HEART LAND COMPANY LIMITED,False,9/15/2015 12:00:00 AM +00:00
"TAW WYN GABAR GROUP CO., LTD.",False,10/23/1996 12:00:00 AM +00:00
EASTERN INTERNATIONAL COMPANY LIMITED,False,2/4/2005 12:00:00 AM +00:00
"METRO COMPUTER SERVICE CO., LTD. ",False,8/28/2015 12:00:00 AM +00:00
OCEAN GOLD SERVICES COMPANY LIMITED,False,4/4/2016 12:00:00 AM +00:00
HAPPY FAMILY (MYAWADDY) COMPANY LIMITED,False,9/20/2018 12:00:00 AM +06:30
AUNG KABAR MANDALAY CONSTRUCTION & DECORATION COMPANY LIMITED,False,10/28/2020 4:10:17 PM +06:30
MR. EGG COMPANY LIMITED,False,10/24/2014 12:00:00 AM +00:00
"TTO NL FAMILY CO., LTD",False,9/9/2020 6:14:44 AM +06:30
Y. U. N YUN GROUP COMPANY LIMITED,False,2/19/2019 10:45:17 AM +06:30
SUKO COMPANY LIMITED,False,7/28/2014 12:00:00 AM +00:00
FREEZE POWER COMPANY LIMITED.,False,8/1/2011 12:00:00 AM +00:00
GREAT MASTER CONSTRUCTION COMPANY LIMITED,False,7/11/2005 12:00:00 AM +00:00
ASOHKA STAR COMPANY LIMITED.,False,1/11/2018 12:00:00 AM +00:00
ZOCHWELL MYANMAR COMPANY LIMITED,False,1/16/2014 12:00:00 AM +00:00
GOLDEN NEW DAY (MYANMAR) COMPANY LIMITED,False,10/15/2018 12:00:00 AM +00:00
"Thwin Thit Co., Ltd.",False,3/26/2004 12:00:00 AM +00:00
NEG (NOBIL ENGINEERING GROUP) COMPANY LIMITED,False,11/24/2017 12:00:00 AM +00:00
YI XIANG WANG YE LLC COMPANY LIMITED,False,12/18/2018 3:03:30 PM +06:30
MYANMA AH-HLA ENGINEERING & TRADING COMPANY LIMITED,False,3/16/2012 12:00:00 AM +00:00
MAIN DRAGON COMPANY LIMITED,False,5/20/2016 12:00:00 AM +00:00
CALVARY COMPANY LIMITED,False,3/7/2017 12:00:00 AM +00:00
"T.H.T International Co., Ltd.",False,12/3/1997 12:00:00 AM +00:00
SAI AUNG KHANT ZIN COMPANY LIMITED,False,2/23/2016 12:00:00 AM +00:00
NAY LA A DRAGON COMPANY LIMITED,False,7/23/2015 12:00:00 AM +00:00
VAST TIMBER INTERNATIONAL LIMITED,False,8/16/2010 12:00:00 AM +00:00
TOE LWIN KYAW TAT NAING COMPANY LIMITED,False,7/17/2019 12:00:00 AM +00:00
SWAN MYINT AUNG COMPANY  LIMITED,False,3/31/2016 12:00:00 AM +00:00
NYEIN CHAN TAUNG JADE & GEMS  COMPANY LIMITED,False,11/11/2003 12:00:00 AM +00:00
SHWE  THEIN  HEIN  COMPANY  LIMITED,False,8/15/2019 12:00:00 AM +00:00
"Top (Eleven) Internation Co.,Ltd",False,2/14/2000 12:00:00 AM +00:00
TAI COOL ENTERPRISES MYANMAR COMPANY LIMITED,False,2/2/2017 12:00:00 AM +00:00
ROYAL MALIHKU MINING & CONSTRUCTION COMPANY LIMITED,False,4/11/2017 12:00:00 AM +00:00
"MYANMAR GLORIOUS LAND CO., LTD.",False,9/8/2005 12:00:00 AM +00:00
MY LINN COMPANY LIMITED,False,8/18/2020 9:28:41 PM +06:30
SAN STAR COMPANY LIMITED,False,8/28/2019 12:00:00 AM +06:30
PYAE HMUE PAING TRADING COMPANY LIMITED,False,5/9/2013 12:00:00 AM +00:00
MOE PEARL THWE GROUP COMPANY LIMITED,False,7/2/2019 12:00:00 AM +00:00
CUNG HUUM FAMILY COMPANY LIMITED,False,9/1/2020 7:58:47 PM +06:30
UNIFIELD PROJECT MANAGEMENT LIMITED,False,6/30/2014 12:00:00 AM +00:00
ASCENSION MARITIME TRAINING CENTER LIMITED,False,9/9/2013 12:00:00 AM +00:00
CROSS TIME COMPANY LIMITED,False,4/3/2018 12:00:00 AM +00:00
"M.M.A(MYAT MYINTMO AUNG)ENVIRONMENTAL ENGINEERING CO., LTD",False,7/27/2017 12:00:00 AM +00:00
ENTERPRISE SOLUTIONS COMPANY LIMITED,False,1/21/2015 12:00:00 AM +00:00
MUSE GYI COMPANY LIMITED,False,9/3/2018 12:00:00 AM +06:30
PYI THEIN KYAW SALZIN COMPANY LIMITED,False,9/22/2018 12:00:00 AM +00:00
LWIN & HNINN DESIGN & DECORATION SERVICE COMPANY LIMITED,False,9/20/2016 12:00:00 AM +00:00
HATHATA INTERNATIONAL COMPANY LIMITED,False,10/23/2020 7:04:54 PM +06:30
TRIPOHOLIC TRAVELS AND TOUR COMPANY LIMITED,False,10/12/2017 12:00:00 AM +06:30
T.Z.T.M CONSTRUCTION COMPANY LIMITED,False,5/10/1999 12:00:00 AM +00:00
MYANMAR ECONOMIC RESEARCH & CONSULTING COMPANY LIMITED,False,10/10/2012 12:00:00 AM +06:30
GRAVITY ENERGY GROUP LIMITED,False,4/2/2019 7:00:04 PM +06:30
DECEMBER LIN COMPANY LIMITED,False,12/10/2019 12:00:00 AM +06:30
MAX  RESOURCES  COMPANY LIMITED,False,10/18/2019 10:06:09 AM +06:30
KYAL NI AUTOMOTIVE COMPANY LIMITED,False,10/24/2019 11:41:53 AM +06:30
DRAGON FORCE GROUP COMPANY LIMITED,False,5/9/2018 12:00:00 AM +00:00
MYA YADANAR KYAW GEMS COMPANY LIMITED,False,9/14/2017 12:00:00 AM +00:00
YADANAR ZWE MANN RENTAL AND LEASING COMPANY LIMITED,False,6/28/2011 12:00:00 AM +00:00
SEVEN LUCK COMPANY LIMITED,False,7/31/2013 12:00:00 AM +00:00
MYANMAR JHI LIMITED,False,9/4/2017 12:00:00 AM +00:00
NANN HTET OO COMPANY LIMITED.,False,11/10/2017 12:00:00 AM +00:00
IT HUB COMPANY LIMITED,False,5/19/2016 12:00:00 AM +00:00
"Haw Yun Gems Co., Ltd.",False,1/21/1999 12:00:00 AM +00:00
T & N ASSOCIATE COMPANY LIMITED,False,5/13/2016 12:00:00 AM +00:00
S . S . 3 GROUP COMPANY LIMITED,False,8/30/2019 1:19:54 PM +06:30
K2RAIN COMPANY LIMITED,False,12/14/2020 9:59:19 AM +06:30
GOLDEN HORN CONTAINERS HUB (MYANMAR) PVT. LTD,True,12/2/2019 2:40:46 PM +06:30
MYSTYLO COMPANY LIMITED,False,10/6/2015 12:00:00 AM +00:00
MM NAING CONSTRUCTION COMPANY LIMITED,False,11/4/2019 11:08:01 AM +06:30
MYANMAR WOODPECKER AGROSCIENCE COMPANY LIMITED,False,5/27/2020 3:39:03 PM +06:30
SUPER HERO MYANMAR COMPANY LIMITED,False,10/2/2015 12:00:00 AM +06:30
"Zaw Yadanar Phyo Co., Ltd",False,6/14/2010 12:00:00 AM +00:00
"Myanmar Golden Moon Construction Co.,Ltd.",False,8/26/2010 12:00:00 AM +00:00
GOD LOVE COMPANY LIMITED,False,9/9/2020 10:34:27 AM +06:30
UNIT KKK TRADING COMPANY LIMITED,False,2/5/2021 9:54:06 AM +06:30
P. D MIN KHANT KYAW COMPANY LIMITED,False,1/14/2019 12:00:00 AM +06:30
SUPER BLUE HAWK COMPANY LIMITED,False,4/25/2016 12:00:00 AM +00:00
MYANMAR AGRO LIMITED,False,11/2/2005 12:00:00 AM +00:00
ISUZU MOTORS ASIA LIMITED ,False,11/14/2018 2:45:11 PM +06:30
ZENITH SPARTANS COMPANY LIMITED,False,7/7/2015 12:00:00 AM +00:00
MTRM FAMILY COMPANY LIMITED,False,1/29/2021 6:42:21 AM +06:30
YADANAR SHIN THANT DEVELOPMENT PUBLIC LIMITED,False,8/15/2016 12:00:00 AM +00:00
??????HI TOP MIRAMAR COMPANY LIMITED,False,12/16/2015 12:00:00 AM +00:00
ONE NINE MANAGEMENT INDUSTRY COMPANY LIMITED,False,4/4/2012 12:00:00 AM +00:00
"Kan Group Co., Ltd.",False,12/14/2000 12:00:00 AM +00:00
ARDOR S ENGINEERING COMPANY LIMITED,False,11/27/2019 12:00:00 AM +06:30
ZAY YAR TUN TML COMPANY LIMITED,False,12/11/2018 12:00:00 AM +00:00
ROYAL MYANMAR MIN KHAUNG  COMPANY LIMITED,False,1/20/2017 12:00:00 AM +00:00
TUN MIN THIT COMPANY LIMITED,False,8/8/2020 3:11:48 PM +06:30
"Zen Direction Co., Ltd.",False,10/3/2017 12:00:00 AM +00:00
YOKE PYO COMPANY LIMITED,False,11/20/2012 12:00:00 AM +00:00
Aung Shwe Hein Company Limited,False,4/5/2006 12:00:00 AM +00:00
MINGALAR TECHNOLOGIES ICT SOLUTIONS COMPANY LIMITED,False,12/11/2020 7:39:56 PM +06:30
TIAN YU INTERNATIONAL COMPANY LIMITED,True,1/8/2014 12:00:00 AM +00:00
HAW KHAM LON MINING COMPANY LIMITED,False,5/3/2019 12:00:00 AM +00:00
"Myanmar Swann Shin Trading Co.,Ltd",False,9/20/2007 12:00:00 AM +00:00
ONE TWO COMPANY LIMITED,False,4/7/2011 12:00:00 AM +00:00
BOFAMILY COMPANY LIMITED,False,9/5/2018 12:00:00 AM +00:00
LIN LAT MYINE COMPANY LIMITED,False,3/3/2017 12:00:00 AM +00:00
KO PHONE FAMILY COMPANY LIMITED,False,2/1/2018 12:00:00 AM +00:00
NAMMADAR TRADING COMPANY LIMITED,False,12/21/2012 12:00:00 AM +00:00
MULTI-DIMENSIONS COMPANY LIMITED,False,8/28/2020 12:26:33 PM +06:30
MYANMAR BETTER COMPANY LIMITED,False,12/10/2013 12:00:00 AM +00:00
TOE NAGA ENGINEERING COMPANY LIMITED,False,9/4/2015 12:00:00 AM +06:30
YONG HUI PRINTING PACKING COMPANY LIMITED,True,11/26/2019 12:00:00 AM +06:30
SUN MARITIME COMPANY LIMITED,False,8/2/2013 12:00:00 AM +00:00
AMAZING ONE GEMS COMPANY LIMITED,False,7/8/2009 12:00:00 AM +00:00
"TROUW NUTRITION MYANMAR CO., LTD.",True,7/5/2017 12:00:00 AM +00:00
TEAMEDGE COMPANY LIMITED,False,8/13/2019 12:00:00 AM +00:00
LAO SARM LAW COMPANY LIMITED,False,10/2/2018 12:00:00 AM +00:00
MC INVESTMENTS COMPANY LIMITED,False,7/1/2020 2:35:50 PM +06:30
SHWE NAN BANYAR DALA M.P.D.F (HQ) COMPANY LIMITED,False,9/20/2018 12:00:00 AM +00:00
GLOBAL TREND COMPANY LIMITED,False,8/22/2019 1:01:28 PM +06:30
MYANMAR MIN HEIN COMPANY LIMITED,False,1/29/2019 12:00:00 AM +00:00
PURE NINETY DEGREE COMPANY LIMITED,False,12/11/2020 10:50:11 PM +06:30
REGAL WAY COMPANY LIMITED,False,11/27/2019 12:00:00 AM +06:30
"Myanmar Gandamar Trading Co.,Ltd.",False,9/5/2011 12:00:00 AM +00:00
P.S.S.C  LTD,False,6/30/2020 1:48:05 PM +06:30
ROYAL HUMAN LIMITED,False,5/22/2019 12:00:00 AM +00:00
POWER SHINNING STAR COMPANY LIMITED,False,8/20/2020 6:55:42 PM +06:30
GOD LIGHT GROUP INTERNATIONAL COMPANY LIMITED,False,4/7/2015 12:00:00 AM +00:00
KAY THAR CHAN MYAE COMPANY LIMITED,False,8/29/2020 7:18:09 AM +06:30
ROYAL SOPHY  COMPANY LIMITED,False,7/24/2017 12:00:00 AM +00:00
MPM Group Company Limited,False,6/30/2017 12:00:00 AM +00:00
PERFECT K & P COMPANY LIMITED,False,1/29/2019 7:49:43 PM +06:30
ROYAL NAY PYI TAW SERVICES COMPANY LIMITED,False,10/11/2012 12:00:00 AM +00:00
MYNOR COMPANY LIMITED,False,11/27/2014 12:00:00 AM +00:00
KANBALU STAR COMPANY LIMITED,False,9/20/2018 12:00:00 AM +06:30
Sum  Cheong  Mining  Ltd.,False,2/26/1996 12:00:00 AM +00:00
JIN DU COMMERCIAL AND TRADING COMPANY LIMITED,False,9/10/2018 12:00:00 AM +06:30
HANDLER COMAPANY LIMITED,False,1/9/2017 12:00:00 AM +00:00
AYE MYA THAWTAR GENERAL SERVICES COMPANY LIMITED,False,6/18/2018 12:00:00 AM +00:00
SHINE DEVELOPMENT COMPANY LIMITED,False,11/20/2014 12:00:00 AM +00:00
THE REAL MYANMAR AUTHENTIC TRAVEL COMPANY LIMITED,False,5/5/2015 12:00:00 AM +00:00
SKY INTERNATIONAL COMPANY LIMITED,False,5/21/1990 12:00:00 AM +00:00
PARTNER EXPERT TRADING COMPANY LIMITED,False,8/20/2012 12:00:00 AM +00:00
"Elegant Co.,Ltd",False,5/3/2001 12:00:00 AM +00:00
CLINE INTERNATIONAL COMPANY LIMITED,True,5/2/2018 12:00:00 AM +00:00
PLEASANT RAINY LAND COMPANY LIMITED,False,9/24/2015 12:00:00 AM +06:30
YE U YAUNG CHI COMPANY LIMITED,False,12/10/2014 12:00:00 AM +06:30
BAMA ZWE COMPANY LIMITED,False,9/22/2016 12:00:00 AM +00:00
KNOWLEDGE HUB INSTITUTE MYANMAR COMPANY LIMITED,False,5/26/2017 12:00:00 AM +00:00
HAVENKIST INTERNATIONALCOMPANY LIMITED,False,11/21/2017 12:00:00 AM +00:00
KAN TET MIN COMPANY LIMITED,False,9/18/2013 12:00:00 AM +00:00
NORTHWOOD INDUSTRY LIMITED,True,10/21/2015 12:00:00 AM +00:00
SHWE KHAR NAN MYITKYINA  COMPANY LIMITED,False,7/1/2020 4:26:29 PM +06:30
STS SYNERGY COMPANY LIMITED,False,12/5/2018 5:12:42 PM +06:30
THE SUNSHINE INTERNATIONAL COMPANY LIMITED,False,11/13/2018 12:00:00 AM +00:00
UT EDEN GENERAL TRADING COMPANY LIMITED,False,7/13/2017 12:00:00 AM +00:00
WIN SANDI COMPANY LIMITED,False,10/13/2014 12:00:00 AM +00:00
WAI YAN CHAN MYAE COMPANY LIMITED,False,9/6/2017 12:00:00 AM +00:00
API MYANMAR COMPANY LIMITED,False,3/8/2016 12:00:00 AM +00:00
GOLDEN PERFECT STRUCTURAL COMPANY LIMITED,False,6/26/2013 12:00:00 AM +00:00
"Tripod Success Co., Ltd.",False,12/8/1998 12:00:00 AM +00:00
SAFE HAVEN COMPANY LIMITED,False,4/29/2014 12:00:00 AM +00:00
