MAWLAMYAING HOLDINGS LIMITED,False,8/11/1994 12:00:00 AM +00:00
HONG MAO RESOURCES COMPANY LIMITED,False,8/11/2017 12:00:00 AM +00:00
DO DO  RETAIL BUSINESS  COMPANY LIMITED,False,5/20/2020 11:50:33 AM +06:30
"KAUNG KIN WAI YAN CO., LTD.",False,5/8/2019 12:00:00 AM +00:00
ELECTEST ENGINEERS MYANMAR LIMITED,True,12/21/2018 2:17:41 PM +06:30
PYAE AUNG KHAING COMPANY LIMITED,False,12/12/2018 12:00:00 AM +00:00
NAING NAING KYAW COMPANY LIMITED,False,2/7/2018 12:00:00 AM +00:00
CFG ENERGY PTE. LTD.,False,11/17/2014 12:00:00 AM +00:00
"NGWE WATHON TRAVELS & TOURS CO., LTD.",False,2/1/2011 12:00:00 AM +00:00
LUCKY ZAW COMPANY LIMITED,False,7/16/2018 12:00:00 AM +00:00
UNITED THREE LION BROTHERS  COMPANY LIMTED,False,6/9/2016 12:00:00 AM +00:00
MR GREEN AGRO HIGH TECH COMPANY LIMITED,False,3/9/2017 12:00:00 AM +00:00
PHOENIX NEW  GENERATION COMPANY LIMITED,False,10/29/2018 2:09:29 PM +06:30
MAIN WIN TRAVELS & TOURS COMPANY LIMITED,False,11/5/2019 12:00:00 AM +06:30
Aung Paing Moe Minig Company Limited,False,1/3/2007 12:00:00 AM +00:00
"Zar Ni Pyho Gems Co.,Ltd.",False,12/18/1995 12:00:00 AM +00:00
MYANMAR YANGZHENG HARDWARE SHELF COMPANY LIMITED,False,9/8/2018 12:00:45 PM +06:30
Ko Ba Hman  & Generations Trading ,False,8/6/2002 12:00:00 AM +00:00
HEALTHCARE ENRICHMENT ALLIANCE AND REHAB TECHNOLOGY SERVICES COMPANY LIMITED,False,1/24/2018 12:00:00 AM +00:00
AMYAR SU COMPANY LIMITED..,False,7/27/2017 12:00:00 AM +00:00
ROYAL LIGHT ELECTRIC COMPANY LIMITED,False,8/31/2018 1:51:34 PM +06:30
"ROYAL SHWE NAN SAN CO., LTD",False,1/7/2020 12:00:00 AM +06:30
MAHA ARAINDAMAR TRADING CO LTD,False,3/24/2019 12:00:00 AM +00:00
CONSTRUCTION MATERIALS PLAZA COMPANY LIMITED,False,10/27/2015 12:00:00 AM +00:00
HTARWAYA CHWIN CHAN COMPANY LIMITED,False,1/15/2015 12:00:00 AM +00:00
RUNG STAR COMPANY LIMITED,False,10/11/2020 2:21:48 PM +06:30
ARKAR LAMIN COMPANY LIMITED.,False,9/24/2015 12:00:00 AM +00:00
OHN & MYINT FAMILY  COMPANY LIMITED.,False,3/7/2013 12:00:00 AM +00:00
"Jade Country Co., Ltd.",False,2/23/2012 12:00:00 AM +00:00
HTAY KYAW & BROTHERS SERVICE & TRADING COMPANY LIMITED,False,6/17/2019 12:00:00 AM +00:00
A  ZAY  COMPANY  LIMITED,False,1/2/2014 12:00:00 AM +00:00
ASIA SMILE TRAVELS & TOURS COMPANY LIMITED,False,4/21/2006 12:00:00 AM +00:00
ZWE HTET KO KO COMPAMY LIMITED,False,10/4/2018 12:00:00 AM +00:00
SHINE AUTO KING LONG COMPANY LIMITED,False,2/5/2018 12:00:00 AM +00:00
SHWE NYUNT FAMILY COMPANY LIMITED,False,3/6/2013 12:00:00 AM +00:00
EAE` CHIT MAUNG COMPANY LIMITED,False,11/3/2020 1:10:01 PM +06:30
"MYANMAR SPLENDID KNIGHT INTERNATIONAL CO.,LTD.",False,6/29/2010 12:00:00 AM +00:00
HTUT FAMOUS CONSTRUCTION GROUP COMPANY LIMITED,False,9/19/2019 3:20:29 PM +06:30
TOE DANA TUN COMPANY LIMITED,False,9/3/2018 3:07:55 PM +06:30
MYANMA TRADE WIND INTERNATIONAL COMPANY LIMITED,False,5/29/2020 9:53:40 AM +06:30
"Ever Blue Trading Co.,Ltd.",False,10/15/2009 12:00:00 AM +00:00
"Zayar San Trading Co.,Ltd",False,5/16/2006 12:00:00 AM +00:00
PEAK  LAND LTD,False,11/7/2019 8:18:13 PM +06:30
SOE KYAW NAING CONSTRUCTION COMPANY LIMITED,False,10/9/2014 12:00:00 AM +06:30
MYAT TAW WIN COMPANY LIMITED,False,8/23/2016 12:00:00 AM +00:00
PHOO PWINT YADANAR MANDALAY COMPANY LIMITED,False,4/26/2016 12:00:00 AM +00:00
"MANGOSTEEN CO.,LTD",False,3/10/2008 12:00:00 AM +00:00
WAI HNIN COMPANY LIMITED,False,1/21/2014 12:00:00 AM +00:00
KAUNG LITE PRIVATE COMPANY LTD,False,5/10/2019 12:00:00 AM +00:00
SHWE SAN THEE COMPANY LIMITED,False,1/5/2010 12:00:00 AM +00:00
"GLOBAL FOOD AND BEVERAGE (F&B) MM GROUP CO., LTD",False,9/17/2020 12:00:00 AM +06:30
"GREEN RAY TRADING Co.,Ltd.",False,4/7/2008 12:00:00 AM +00:00
"ZSD GROUP CO., LTD",False,11/21/2019 2:58:26 PM +06:30
"ROYAL PYAY MYANMAR CO., LTD",False,9/10/2019 12:00:00 AM +06:30
UT & SON FAMILY COMPANY LIMITED,False,6/23/2017 12:00:00 AM +00:00
WHITE GROUP PUBLIC COMPANY LIMITED,False,10/30/2013 12:00:00 AM +00:00
ZAKH COMPANY LIMITED,False,7/14/2016 12:00:00 AM +00:00
HIGH COMMISSIONER COMPANY LIMITED,False,8/26/2016 12:00:00 AM +00:00
GREAT THAW ZIN TUN COMPANY LIMITED,False,4/26/2017 12:00:00 AM +00:00
"Shwe Thitsar Aung Trading Co., Ltd.",False,8/17/2005 12:00:00 AM +00:00
EXPORT TRADING COMMODITIES PTE LIMITED,False,12/8/2011 12:00:00 AM +00:00
ASIA MYANMAR APEX COMPANY LIMITED,False,2/25/2014 12:00:00 AM +00:00
HTUN SHING COMPANY LIMITED,False,9/22/2020 12:55:30 PM +06:30
Hua  Guang  Electrical  Products  Ltd.,False,1/9/1995 12:00:00 AM +00:00
MAN AUNG SWAM ARR  COMPANY LTD.,False,12/2/2020 5:16:20 PM +06:30
KYI SIN HEIN COMPANY LIMITED,False,1/10/2020 12:00:00 AM +06:30
S O A COMPANY LIMITED,False,12/18/2018 1:52:30 PM +06:30
KING OF WINNER COMPANY LIMITED,False,5/9/2018 12:00:00 AM +00:00
"Kyar Wah Co.,Ltd.",False,11/14/1997 12:00:00 AM +00:00
"ROYAL MARINE ENGINEERING CO., LTD.",False,4/22/1998 12:00:00 AM +00:00
"ARIAN MARINE SERVICES CO., LTD",False,2/19/2008 12:00:00 AM +00:00
U SOE ZAR NI & BROTHERS COMPANY LIMITED,False,12/29/2018 12:00:00 AM +06:30
MYANMAR KV POWER COMPANY LIMITED,True,5/16/2019 11:23:04 AM +06:30
TETLU PLUS THREE CONSTRUCTION COMPANY LIMITED,False,8/11/2017 12:00:00 AM +00:00
LOVE ANDAMAN(MYANMAR) TRAVEL & TOUR COMPANY LIMITED,False,11/19/2019 5:40:52 PM +06:30
"Naing Generation Co,.Ltd.",False,2/28/2012 12:00:00 AM +00:00
 ZAMBU YEIK COMPANY LIMITED,False,9/17/2018 12:00:00 AM +00:00
MYA SHWE MYINT MOH COMPANY LIMITED,False,12/9/2013 12:00:00 AM +00:00
"Nilar Yoma Mining Co., Ltd.",False,2/25/1999 12:00:00 AM +00:00
LHYAN HTUN TRAVEL & TOUR COMPANY LIMITED,False,9/5/2013 12:00:00 AM +00:00
KHANT TAY PO COMPANY LIMITED,False,10/30/2018 12:00:00 AM +00:00
NEW GENERATION ENGINEERING & SUPPLIES COMPANY LIMITED,False,8/30/2004 12:00:00 AM +00:00
B2IC BUSINESS AND INVESTMENT INFORMATION CONSULTANCY COMPANY LIMITED,False,1/9/2015 12:00:00 AM +00:00
"Integrated Power Trading Co., Ltd.",False,4/8/2003 12:00:00 AM +00:00
TA NIN THAR YEE YOE MA COMPANY LIMITED,False,2/18/2015 12:00:00 AM +00:00
DOTAMEX COMPANY LIMITED,False,8/24/2017 12:00:00 AM +00:00
NAY LA KYAL SIN  COMPANY LIMITED,False,8/14/2013 12:00:00 AM +00:00
THET NAING AUNG GEMS & JEWELLERY COMPANY LIMITED,False,1/27/2004 12:00:00 AM +00:00
"Kyaw Zayar Myat Gems & Jewellery Co., Ltd.",False,5/14/1999 12:00:00 AM +00:00
SHWE NAR COMPANY LIMITED,False,11/12/2018 12:00:00 AM +00:00
SHWE ANANTA MINING COMPANY LIMITED,False,7/23/2010 12:00:00 AM +00:00
"Chan Aung Myay Mining Co., Ltd.",False,5/24/2011 12:00:00 AM +00:00
MANSION CONSTRUCTION COMPANY LIMITED,False,10/10/2007 12:00:00 AM +00:00
WANXINDA TRAVEL GOODS COMPANY LIMITED,True,12/26/2018 5:41:18 PM +06:30
U KYU FAMILY GRAINS & MANUFACTURING COMPANY LIMITED,False,7/1/1999 12:00:00 AM +00:00
YADANAR SHWE LWIN PYIN COMPANY LIMITED,False,1/14/2019 12:00:00 AM +06:30
"Naing Thuriya Trading Co ., Ltd. ",False,10/2/2009 12:00:00 AM +00:00
THEIN WIN PHYO GROUP COMPANY LIMITED,False,9/12/2018 12:00:00 AM +06:30
KA DAY KYWAL COMPANY LIMITED,False,3/13/2019 8:49:36 AM +06:30
ZAY HTOO HTET COMPANY LIMITED.,False,4/8/2015 12:00:00 AM +00:00
TRI ONE HYDRAULIC & ENGINEERING COMPANY LIMITED,False,6/20/2018 12:00:00 AM +00:00
MYANMAR HONG TU SERVICE COMPANY LIMITED,False,1/3/2019 12:00:00 AM +00:00
CLOVER 16 COMPANY LIMITED,False,9/13/2019 12:00:00 AM +06:30
TELEDYNE COMPANY LIMITED,False,4/27/2018 12:00:00 AM +00:00
K F T (MYANMAR) ENGINEERING & CONSTRUCTION COMPANY LIMITED,False,2/4/2014 12:00:00 AM +00:00
YAUNG NI OO MINING COMPANY LIMITED,False,12/28/2004 12:00:00 AM +00:00
RED STAR MYANMAR GROUP COMPANY LIMITED,False,8/2/2010 12:00:00 AM +00:00
Yangon Trade Line Ltd,False,8/2/2007 12:00:00 AM +00:00
"Ruby Shine Gems Co., Ltd.",False,2/16/1996 12:00:00 AM +00:00
"Aung Zay Hein Co.,Ltd",False,6/20/2007 12:00:00 AM +00:00
APPLAY COMPANY LIMITED,False,5/25/2015 12:00:00 AM +00:00
VIGOROUS UNION ENGINEERING COMPANY LIMITED,False,12/12/2018 10:19:37 PM +06:30
HIN THAR  HTUT   COMPANY  LIMITED,False,5/14/2019 12:01:48 PM +06:30
"MAHA SHWE CO., LTD.",False,4/4/1996 12:00:00 AM +00:00
"DELTA STAR INFRA CO., LTD.",True,10/27/2017 12:00:00 AM +06:30
PHONE MYINTMOH COMPANY LIMITED,False,9/10/2012 12:00:00 AM +00:00
MIN NAING CONSTRUCTION COMPANY LIMITED,False,9/3/2012 12:00:00 AM +06:30
APRIL MOE COMPANY LIMITED,False,3/3/2017 12:00:00 AM +00:00
"Tokutokuya Co., Ltd.",False,5/11/2012 12:00:00 AM +00:00
YE YINT NAING COMPANY LIMITED,False,6/27/2018 12:00:00 AM +00:00
PYI TAW TOE COMPANY LIMITED,False,9/4/2014 12:00:00 AM +00:00
"Lamjian  Int'l  Co.,  Ltd.",False,6/10/1996 12:00:00 AM +00:00
THIHA TRADING LIMITED,False,4/30/2013 12:00:00 AM +00:00
MYANMAR GLOBAL MALT COMPANY LIMITED,False,8/21/2013 12:00:00 AM +00:00
MACOOR COMPANY LIMITED,False,5/20/2016 12:00:00 AM +00:00
NAY PYI TAW ECO ENERGY COMPANY LIMITED,False,1/20/2021 1:28:39 PM +06:30
"THE LIVING VINE TRAVELS & TOURS CO.,LTD.",False,3/12/2010 12:00:00 AM +00:00
"Kingbao Mining Co.,Ltd. (Yangon Branch)",False,4/11/2006 12:00:00 AM +00:00
AUNG PYAE SAY CONSTRUCTION COMPANY LIMITED,False,9/6/2013 12:00:00 AM +00:00
L & R ALOE VERA PRODUCTS COMPANY LIMITED,False,8/11/2015 12:00:00 AM +00:00
MOE UTK CONSTRUCTION COMPANY LIMITED,False,5/15/2015 12:00:00 AM +00:00
ROYAL KMC TRADING COMPANY LIMITED,False,11/8/2018 12:00:00 AM +06:30
TAWIN  LIN  LIN  COMPANY  LIMITED,False,9/26/2019 7:07:34 AM +06:30
GRACE LAND MYITKYINA COMPANY LIMITED,False,2/5/2019 12:00:00 AM +00:00
MASTER TWINS LTD,False,3/7/2019 3:59:19 PM +06:30
GOLDEN HORSE COMPANY LIMITED,False,5/7/1990 12:00:00 AM +00:00
GREEN PARADISE COMPANY LIMITED,False,3/22/2013 12:00:00 AM +00:00
NATURAL HUMAN HAIR COMPANY LIMITED,False,8/27/2018 12:00:00 AM +00:00
WIN THU AUNG COMPANY LTD,False,12/16/2019 12:00:00 AM +06:30
PATTAYA MYANMAR COMPANY LIMITED,True,1/14/2013 12:00:00 AM +00:00
NOUVELLE LUNE COMPANY LIMITED,False,7/21/2014 12:00:00 AM +00:00
ECO GREEN VENTURE COMPANY LIMITED,False,1/8/2019 12:00:00 AM +06:30
"KONOIKE CONSTRUCTION CO.,LTD",False,10/22/1996 12:00:00 AM +00:00
SOE ORGANIC COMPANY LIMITED,False,3/31/2020 9:09:09 PM +06:30
"HUKAUNG VALLEY DEVELOPMENT GROUP CO., LTD",False,12/18/2020 6:57:51 PM +06:30
"Infinity Horizon Industrial Co., Ltd.",False,6/2/2011 12:00:00 AM +00:00
CHIN TAW WIN COMPANY LIMITED,False,6/1/2016 12:00:00 AM +00:00
MYANMAR LEGAL MHM LIMITED,True,2/18/2014 12:00:00 AM +00:00
MYANMAR SEILONE SERVICES COMPANY LIMITED,False,12/6/2007 12:00:00 AM +00:00
UPTERIORS COMPANY LIMITED,True,2/20/2017 12:00:00 AM +00:00
LU NGE ARRMAN THIT COMPANY LIMITED,False,1/19/2019 9:48:50 AM +06:30
GRAND IMPERIAL COMPANY LIMITED,False,8/22/2011 12:00:00 AM +00:00
ASIA NET COMM COMPANY LIMITED.,False,7/25/2013 12:00:00 AM +00:00
 HAI  LIANG  COMPANY LIMITED,False,11/18/2015 12:00:00 AM +00:00
NAWNGTUNG GEMS & JEWELLERY COMPANY LIMITED,False,6/21/2011 12:00:00 AM +00:00
SHWE KAUNG SU KHAING COMPANY LIMITED,False,10/1/2018 9:38:11 PM +06:30
HMM & ELS TRADING COMPANY LIMITED,False,2/1/2018 12:00:00 AM +00:00
"Western Auto (Myanmar) Co.,Ltd.",False,12/12/2011 12:00:00 AM +00:00
MOKAN CRUISES LIMITED,False,8/25/2017 12:00:00 AM +00:00
"Shwe Sin Ngwe Sin Co., Ltd.",False,9/16/2004 12:00:00 AM +00:00
POWER TRUCK SERVICES & SHOWROOM COMPANY LIMITED,False,11/27/2012 12:00:00 AM +00:00
"Bagan  Hotel  Co.,  Ltd.",False,12/7/1995 12:00:00 AM +00:00
"Management And Business Care Co., Ltd.",False,8/14/2001 12:00:00 AM +00:00
MIN MOE KYAW COMPANY LIMITED,False,2/20/2017 12:00:00 AM +00:00
MYANMAR FLYING LOGISTICS COMPANY LIMITED,False,1/5/2019 12:00:00 AM +06:30
Succesful Pride Company Limited,False,12/20/2006 12:00:00 AM +00:00
"Crystal General Trading Co., Ltd.",False,3/22/1994 12:00:00 AM +00:00
GREEN PLANET TRADING COMPANY LIMITED,False,5/21/2012 12:00:00 AM +00:00
U P K JADE & GEMS COMPANY LIMITED,False,9/19/2012 12:00:00 AM +00:00
ZAGAR COMMUNICATIONS LTD,True,3/14/2019 9:04:49 AM +06:30
KYAL  16 COMPANY LIMITED,False,4/26/2017 12:00:00 AM +00:00
YADANAR PAW LONE COMPANY LIMITED,False,10/10/2013 12:00:00 AM +00:00
DREAM WALKERZ PRODUCTION COMPANY LIMITED,False,1/20/2020 7:23:13 PM +06:30
"AEON MALL MYANMAR CO., LTD.",True,7/10/2020 9:25:26 AM +06:30
AUNG MYIN HTUN COMPANY LIMITED,False,10/6/2016 12:00:00 AM +00:00
 ZAWGYI SYSTEMS COMPANY LIMITED,False,10/23/2003 12:00:00 AM +00:00
CRICKET COMPANY LIMITED.,False,7/4/2017 12:00:00 AM +00:00
BAGO ITC COMPANY LIMITED,False,10/18/2016 12:00:00 AM +00:00
AUNG KHAING SOE MOE COMPANY LIMITED,False,11/14/2017 12:00:00 AM +00:00
ZINMAHAR COMPANY LTD.,False,5/15/2020 2:31:08 PM +06:30
"THE KEY POINT CONSTRUCTION & ENGINEERING CO., LTD",False,5/27/2019 3:43:32 PM +06:30
HONE YINE FAMILY TRADING COMPANY LIMITED,False,5/27/2014 12:00:00 AM +00:00
"Win Win Lyinn Mining Co., Ltd. ",False,8/16/2010 12:00:00 AM +00:00
PEACE EMPIRE COMPANY LIMITED,False,1/24/2020 11:22:34 AM +06:30
NAT YAY KAN CONSTRUCTION & MACHINERY RENTAL COMPANY LIMITED,False,12/24/2015 12:00:00 AM +00:00
AUNG THUKHA (MDY) COMPANY LIMITED  ,False,4/10/2019 11:42:35 AM +06:30
"Fantastic Star Trading Co., Ltd.",False,12/30/2009 12:00:00 AM +00:00
TODAY ASIA  LION COMPANY LIMITED,False,4/5/2017 12:00:00 AM +00:00
SHWE MEIK SAT REAL ESTATE COMPANY LIMITED,False,11/10/2018 11:44:57 AM +06:30
TOP N SEASONS COMPANY LIMITED,False,6/24/2019 12:00:00 AM +00:00
UNITED EAGLES CONSULTING ENGINEERS GROUP COMPANY LIMITED,False,5/3/2019 9:55:24 PM +06:30
PII INTERNATIONAL COMPANY LIMITED,False,11/28/2017 12:00:00 AM +00:00
MYINT WAI STRATEGIC  HOLDING  COMPANY LIMITED,False,8/4/2020 10:45:48 PM +06:30
STAR RESOURCES COMPANY LIMITED,False,10/3/2005 12:00:00 AM +00:00
UBER MYANMAR LIMITED,True,2/7/2017 12:00:00 AM +00:00
"Kham War Shwe And Mining Production Co., Ltd.",False,2/21/2005 12:00:00 AM +00:00
"VERTEX VACATIONS TRAVELS & TOURS CO., LTD.",False,5/13/2010 12:00:00 AM +00:00
XINGSHENG CONSTRUCTION ENGINEERING COMPANY LIMITED,False,9/12/2018 12:00:00 AM +00:00
HONG YANG COMPANY LIMITED,False,9/17/2018 12:00:00 AM +06:30
SE DAW GYI COMPANY LIMITED,False,6/2/2016 12:00:00 AM +00:00
GOLDEN BLUE SKY COMPANY LIMITED,False,10/12/2018 12:00:00 AM +00:00
WIN HTIKE AUNG COMPANY LIMITED,False,12/11/2017 12:00:00 AM +00:00
GREAT LEAP FORWARD MINING COMPANY LIMITED,False,11/30/2012 12:00:00 AM +00:00
RA MA TI COMPANY LIMITED,False,6/22/2017 12:00:00 AM +00:00
GRACIOUSNESS AYE NAING TUN TRADING COMPANY LIMITED,False,11/9/2018 12:00:00 AM +06:30
GOLD GRADE MYANMAR COMPANY LIMITED,False,11/14/2018 12:00:00 AM +00:00
"BINTAI KINDENKO MYANMAR CO., LTD",True,5/30/2013 12:00:00 AM +00:00
"TOP ONE DELTA Co., Ltd.",False,2/2/2012 12:00:00 AM +00:00
DOUBLE HTU COMPANY LIMITED,False,9/6/2018 12:00:00 AM +00:00
WAY OF GOAL COMPANY LIMITED,False,9/12/2016 12:00:00 AM +00:00
MAHAR KYAW KYAR COMPANY LIMITED,False,7/4/2020 2:20:58 AM +06:30
FOOD SECURITY WORKING GROUP COMPANY LIMITED,False,12/9/2014 12:00:00 AM +00:00
GREEN ICON COMPANY LIMITED,False,1/6/2014 12:00:00 AM +00:00
MYANMAR GREENWAYS SHIPPING AGENCY COMPANY LIMITED,False,8/14/2009 12:00:00 AM +00:00
NEW MODEN ASIA THREE FLOWER COMPANY LIMITED,False,6/24/2013 12:00:00 AM +00:00
MEGA SKY COMPANY LIMITED,False,3/9/2015 12:00:00 AM +00:00
PANNTAMAR MYANMAR COMPANY LIMITED,False,2/9/2015 12:00:00 AM +00:00
"Shwe Khant Trading Co., Ltd.",False,2/10/2005 12:00:00 AM +00:00
SHUNYI COMPANY LIMITED,False,7/18/2018 12:00:00 AM +00:00
NAING PLUS COMPANY LIMITED,False,3/9/2018 12:00:00 AM +00:00
SEIJI (MYANMAR) COMPANY LIMITED,False,3/26/2015 12:00:00 AM +00:00
MYITKYINA GOLDEN BUTTERFLY COMPANY LIMITED,False,11/19/2018 12:00:00 AM +00:00
REAL COMET COMPANY LIMITED,False,4/9/2015 12:00:00 AM +00:00
APN ENGINEERING COMPANY LIMITED,False,8/14/2017 12:00:00 AM +00:00
GREEN CLOUDS RESOURCES COMPANY LIMITED,False,6/19/2020 7:20:41 PM +06:30
T . M . G TRADING COMPANY LIMITED,False,1/14/1997 12:00:00 AM +00:00
"Bawa Trading Co., Ltd.",False,7/24/1998 12:00:00 AM +00:00
Z PLAN SERVICES COMPANY LIMITED,False,2/28/2019 12:00:00 AM +00:00
T WORLD KOREA MOBILE COMPANY LIMITED,False,10/9/2013 12:00:00 AM +00:00
SHWE TAT TAUNG COMPANY LIMITED,False,9/11/2014 12:00:00 AM +00:00
NEW EXPLORER TRAVEL & TOURS COMPANY LIMITED,False,8/29/2012 12:00:00 AM +00:00
"DIGI NETWORK OF MYANMAR CO., LTD",True,1/3/2019 12:00:00 AM +06:30
MINE SEVEN COMPANY LIMITED,False,7/16/2013 12:00:00 AM +00:00
JAM IT ENTERTAINMENT COMPANY LTD.,False,8/13/2020 1:14:58 PM +06:30
"North Shore Garments Co., Ltd",False,8/31/2011 12:00:00 AM +00:00
KYI SHWIN THAR GEMS & JEWELLERY COMPANY LIMITED,False,1/7/2021 5:07:30 PM +06:30
MYAT SWE MON SERVICES COMPANY LIMITED,False,2/15/2011 12:00:00 AM +00:00
"Shwe Ngwe Naing Co., Ltd.",False,7/5/2005 12:00:00 AM +00:00
JUU MANN COMPANY LIMITED,False,1/2/2018 12:00:00 AM +00:00
HEIN HTET NAING ELECTRICAL SERVICE COMPANY LIMITED,False,9/7/2010 12:00:00 AM +00:00
EXCELLENT RELATION COMPANY LIMITED,False,2/7/2018 12:00:00 AM +00:00
SUYAN (MYANMAR)  COSMETIC COMPANY LIMITED,False,8/21/2019 12:00:00 AM +00:00
DESIGN OFFICE MYANMAR COMPANY LIMITED,True,2/17/2017 12:00:00 AM +00:00
YADANAR YAR PYAE AUNG COMPANY LIMITED,False,11/26/2019 8:29:33 PM +06:30
CLASSIC INTERNATIONAL COMPANY LIMITED,False,12/14/2005 12:00:00 AM +00:00
"Art Deco- Classical Co., Ltd",False,10/14/2011 12:00:00 AM +00:00
EW LOGISTICS AND TRANSPORT (MYANMAR) COMPANY LIMITED,False,5/2/2018 12:00:00 AM +00:00
SEVEN GLORY COMPANY LIMITED,False,1/31/2012 12:00:00 AM +00:00
"Yan Min Win International Trading Co., Ltd.",False,4/28/2009 12:00:00 AM +00:00
KHUN YAR ZAR COMPANY LIMITED,False,4/4/2017 12:00:00 AM +00:00
THREE GLORIES COMPANY LIMITED,False,7/27/2016 12:00:00 AM +00:00
"Gold & Gold Trading Co., Ltd.",False,10/3/2001 12:00:00 AM +00:00
TUN BAIK MAN COMPANY LIMITED,False,9/20/2018 12:00:00 AM +06:30
"Shinn Rone Trading Co.,Ltd.",False,9/11/1998 12:00:00 AM +00:00
"Majesta Group Co.,Ltd.",False,8/11/1997 12:00:00 AM +00:00
SHWE HLAING GU COMPANY LIMITED,False,10/17/2014 12:00:00 AM +00:00
INLE INNOVATION TECHNOLOGY COMPANY LIMITED,False,7/9/2019 7:53:31 PM +06:30
SUN STAR MYANMAR TRADING COMPANY LIMITED,False,12/30/2015 12:00:00 AM +00:00
APOLLO  ELITE HEALTHCARE COMPANY LIMITED,False,10/2/2018 10:32:12 AM +06:30
T Z M A  MYANMAR COMPANY LIMITED,False,3/5/2019 12:01:26 PM +06:30
LAMIN KYI THAR COMPANY LIMITED,False,8/27/2018 12:00:00 AM +06:30
SOE HAN THAT COMPANY LIMITED,False,2/17/2019 12:00:00 AM +00:00
YANGON WHITE LIGHT CORPORATION AGENCY LIMITED,False,6/19/2017 12:00:00 AM +00:00
M . A . C ENGINEERING & CONSTRUCTION COMPANY LIMITED,False,12/6/2012 12:00:00 AM +00:00
GLORY POWER COMPANY LIMITED,False,7/12/2017 12:00:00 AM +00:00
"I-4 Co., Ltd.",False,3/28/2012 12:00:00 AM +00:00
MY LINK MARKETING COMPANY LIMITED,False,3/7/2020 1:32:54 PM +06:30
REBECCA COMPANY LIMITED,False,9/26/2018 3:15:22 PM +06:30
"Honser International Co., Ltd.",False,2/9/1999 12:00:00 AM +00:00
SEIN PWINT THARAPHU COMPANY LIMITED,False,5/22/2018 12:00:00 AM +00:00
KINESIS COMPANY LIMITED,False,10/18/2013 12:00:00 AM +00:00
AUNG AYE FAMILY COMPANY LIMITED,False,9/11/2019 12:00:00 AM +06:30
YOMA BANK LIMITED,False,5/19/1993 12:00:00 AM +00:00
AGROLEAD MYANMAR LTD,False,5/28/2020 7:29:32 PM +06:30
FONG KAI MYANMAR BUSINESS GROUP COMPANY LIMITED,True,7/17/2017 12:00:00 AM +00:00
N'WADDY  COMPANY  LIMITED,False,2/5/2020 11:20:32 PM +06:30
"Khant Htet Kaung Co., Ltd.",False,10/29/1999 12:00:00 AM +00:00
GOLDEN SAHARA COMPANY LIMITED,False,3/16/2017 12:00:00 AM +00:00
"Aye Kaung Han Trading Co., Ltd.",False,1/15/2003 12:00:00 AM +00:00
MYOT GONE SAUNG LASHIO SERVICES COMPANY LIMITED,False,6/14/2013 12:00:00 AM +00:00
MYANMAR BALA COMPANY LIMITED,False,5/28/2012 12:00:00 AM +00:00
"CORAL KBK ENGINEERING CO., LTD",False,11/26/2020 6:19:51 AM +06:30
BURMA RUBY MO MO COMPANY LIMITED,False,9/22/2014 12:00:00 AM +00:00
CENTRAL BASE COMPANY LIMITED,False,6/8/2018 12:00:00 AM +00:00
I GOLDEN PAY COMPANY LIMITED,False,12/30/2015 12:00:00 AM +06:30
UKTG COMPANY LIMITED,False,10/21/2020 3:47:48 PM +06:30
NAING ONE TRADING COMPANY LIMITED,False,12/30/2020 7:22:22 PM +06:30
KABAR HTUN GEMS COMPANY LIMITED,False,2/3/2012 12:00:00 AM +00:00
MYANMAR PROMOTIONAL SERVICES (MPS) COMPANY LIMITED,False,12/12/2013 12:00:00 AM +06:30
NGWE MOE HEIN COMPANY LIMITED,False,5/3/2010 12:00:00 AM +00:00
ROYAL SWS MYANMAR COMPANY LIMITED,False,6/22/2018 12:00:00 AM +00:00
SERENA SERVICES COMPANY LIMITED,True,3/4/2016 12:00:00 AM +00:00
KAY GOLDEN MYANMAR COMPANY LIMITED,False,4/3/2013 12:00:00 AM +00:00
"Aung Shine Wai Gems Co., Ltd",False,8/30/2011 12:00:00 AM +00:00
KANPETLET SHWE MYAY COMPANY LIMITED,False,2/18/2020 8:09:37 PM +06:30
THOUSAND SUNNY COMPANY LIMITED,False,9/20/2020 10:11:57 PM +06:30
RESOURCES GROUP LOGISTICS COMPANY LIMITED,False,3/20/2012 12:00:00 AM +00:00
MYA PONNAMI COMPANY LIMITED,False,3/5/2010 12:00:00 AM +00:00
ZAWGYI ONE EXPRESS COMPANY LIMITED,False,7/14/2020 11:29:46 AM +06:30
THE FIRST JOB MEDIA & PRINTING SERVICES COMPANY LIMITED,False,9/15/2019 12:00:00 AM +06:30
KAPPA POWER INTERNATIONAL LIMITED,False,8/19/2004 12:00:00 AM +00:00
CHIN SHWE HAW TRADING COMPANY LIMITED,False,3/11/2010 12:00:00 AM +00:00
ASIA PIONEER MACHINERY COMPANY LIMITED,False,3/21/2012 12:00:00 AM +00:00
SMART ENVIRONS COMPANY LIMITED,False,6/20/2016 12:00:00 AM +00:00
IMA FINANCE COMPANY LIMITED,False,2/19/2015 12:00:00 AM +00:00
"Nagar Tun Tun Co., Ltd.",False,5/13/1999 12:00:00 AM +00:00
POLARIS INTERNATIONAL COMPANY LIMITED,False,2/11/2014 12:00:00 AM +00:00
GOLDEN LIGHT GRACE PRESCHOOL  COMPANY LIMITED,False,2/21/2020 12:56:13 PM +06:30
GOLD WIN STAR BROTHERS COMPANY LIMITED,False,12/24/2013 12:00:00 AM +00:00
"Saung Taw Win Trading Co.,Ltd.",False,8/12/1999 12:00:00 AM +00:00
K.MIN THWE NAUNG COMPANY LIMITED,False,1/29/2016 12:00:00 AM +00:00
NGWE ZIN AUNG  ENGINEERING GROUP CO; LTD,False,11/6/2020 8:57:19 PM +06:30
MUDRA AYA COMPANY LIMITED,False,5/31/2018 12:00:00 AM +00:00
OMPL LIMITED,False,6/24/2019 2:47:34 PM +06:30
DANA-J INTERIOR COMPANY LIMITED,True,6/19/2018 12:00:00 AM +00:00
BEST BOSS COMPANY LIMITED,False,8/27/2019 12:00:00 AM +06:30
LAY PYAY HNYIN TRADING COMPANY LIMITED,False,5/16/2001 12:00:00 AM +00:00
GOLDEN GOOD BROTHERS TRADING COMPANY LIMITED,False,10/4/2011 12:00:00 AM +00:00
LIGHT MASTERS COMPANY LIMITED,False,10/26/2016 12:00:00 AM +00:00
BUZZY COMPANY LIMITED,False,7/13/2020 12:54:58 PM +06:30
"SHWE PADONMAR PWINT CO., LTD.",False,7/2/2013 12:00:00 AM +00:00
MONE AYAR COMPANY LIMITED,False,5/5/2020 1:28:28 PM +06:30
"Common  Int'l  Group  Co.,  Ltd.",False,7/11/1996 12:00:00 AM +00:00
SOUTHERN MYANMAR TIMBER COMPANY LIMITED,False,10/21/1992 12:00:00 AM +00:00
GLOBAL CHAMPION TRAVEL& TOURS COMPANY LIMITED,False,2/27/2017 12:00:00 AM +00:00
RITZ CYBER INTELLIGENCE SERVICES COMPANY LIMITED,False,3/19/2018 12:00:00 AM +00:00
EMPEROR MYANMAR COMPANY LIMITED,False,8/26/2020 7:52:44 PM +06:30
HTOO NANDA KYAW COMPANY LIMITED,False,10/29/2019 12:00:00 AM +06:30
LINK ALL SUPPLY CHAIN MYANMAR COMPANY LIMITED,True,10/31/2018 12:00:00 AM +06:30
SHWE ANN MYAY COMPANY LIMITED,False,11/24/2014 12:00:00 AM +00:00
MYANMAR INTELLIGENT TRAVEL & TOURS COMPANY LIMITED,False,10/25/2016 12:00:00 AM +00:00
DAEYAR INTERNATIONAL COMPANY LIMITED,False,3/19/2015 12:00:00 AM +00:00
DREAM HUB MEDIA GROUP COMPANY LIMITED,False,6/6/2016 12:00:00 AM +00:00
THE JOINT STOCK COMMERCIAL BANK FOR INVESTMENT AND DEVELOPMENT OF VIETNAM ,False,4/26/2016 12:00:00 AM +00:00
RAZI CLIMBING CENTER COMPANY LIMITED,False,12/27/2016 12:00:00 AM +00:00
"Aung Zay Nann Co., Ltd.",False,5/12/1997 12:00:00 AM +00:00
UNITED NATIONAL RESOURCES DEVELOPMENT  CONSTRUCTION COMPANY LIMITED,False,12/26/2011 12:00:00 AM +00:00
YANGON MATE REAL ESTATE SERVICES COMPANY LIMITED,False,12/18/2019 4:48:13 PM +06:30
BEGET CONSTRUCTION COMPANY LIMITED,False,10/13/2014 12:00:00 AM +06:30
MYANMAR SAN BAO (INTERNATIONAL) COMPANY LIMITED,False,4/10/2015 12:00:00 AM +00:00
MANDALAY ACADEMIC INSTITUTE COMPANY LIMITED,False,2/8/2011 12:00:00 AM +00:00
U AUNG OO COMPANY LIMITED,False,2/15/2019 12:00:00 AM +00:00
NICE KAYAH COMPANY LIMITED,False,4/21/2017 12:00:00 AM +00:00
HLA CHERRY COMPANY LIMITED,False,11/4/2014 12:00:00 AM +00:00
"TOP ONE ENERGY CO., LTD.",False,11/9/2019 12:00:00 AM +06:30
CIRCUWORLD (MYANMAR) COMPANY LIMITED,True,12/4/2019 1:55:27 PM +06:30
OMIC INSPECTION & SURVEYING COMPANY LIMITED,False,6/14/1996 12:00:00 AM +00:00
CROWN VICTORY COMPANY LIMITED,False,10/17/2019 12:06:27 PM +06:30
HTOO HAN THIT AUTO SERVICES COMPANY LIMITED,False,2/14/2012 12:00:00 AM +00:00
HSBMYANMAR CO LTD,False,1/29/2021 9:04:15 AM +06:30
AERO EXPRESS RESOURCES COMPANY LIMITED,False,7/29/2016 12:00:00 AM +00:00
"Golden Mingalar Co.,Ltd.",False,10/6/2005 12:00:00 AM +00:00
INFINITE BUSINESS SOLUTION COMPANY LIMITED,False,9/23/2016 12:00:00 AM +00:00
KYAUK SEIN MUDRA COMPANY LIMITED,False,1/18/2020 9:19:16 AM +06:30
"HTUN POWER MYANMAR CO., LTD",False,7/25/2020 6:29:36 PM +06:30
KASET (MYANMAR) COMPANY LIMITED,False,11/13/2014 12:00:00 AM +00:00
"Sakura Cherry Tours & Travels Co., Ltd.",False,12/15/1994 12:00:00 AM +00:00
TINY HEAVEN LTD,False,8/9/2020 8:48:26 AM +06:30
PHOENIX EIGHT COMPANY LIMITED,False,7/2/2018 12:00:00 AM +00:00
CHAY COMPANY LIMITED,False,3/11/2019 12:42:07 PM +06:30
THUN KHA TAKHUN COMPANY LIMITED,False,9/7/2018 12:00:00 AM +06:30
WIN LAE AUNG GROUP COMPANY LIMITED,False,3/8/2013 12:00:00 AM +00:00
PATHEIN MAW KUN COMPANY LIMITED,False,11/16/2020 10:10:24 PM +06:30
"Win Soe Family Trading Co., Ltd.",False,3/21/2011 12:00:00 AM +00:00
