ROYAL TOP STAR COMPANY LIMITED,False,10/19/2020 6:25:37 PM +06:30
GRP SERVICES MYANMAR COMPANY LIMITED,True,3/11/2014 12:00:00 AM +00:00
"Shining  Galaxy  Co., Ltd.",False,11/10/2009 12:00:00 AM +00:00
"Myanmar Investment and Development Co.,Ltd.",False,7/9/2010 12:00:00 AM +00:00
DAWEI RIVER ENTERPRISE COMPANY LIMITED,False,3/22/2005 12:00:00 AM +00:00
NIPPON KOEI COMPANY LIMITED,False,8/4/1998 12:00:00 AM +00:00
JJA SUPPORT COMPANY LIMITED,False,5/29/2019 12:00:00 AM +00:00
GREAT MASTER INDUSTRY COMPANY LIMITED,False,12/19/2008 12:00:00 AM +00:00
KYAW ZAW MOE CONSTRUCTION COMPANY LIMITED,False,9/15/2011 12:00:00 AM +06:30
ROYAL CONQUEST COMPANY LIMITED,False,11/21/2018 10:55:20 AM +06:30
YADANA INC COMPANY LIMITED,True,11/20/2013 12:00:00 AM +00:00
JAMES ALEX COMPANY LIMITED,False,5/27/2015 12:00:00 AM +00:00
"Tiger Lumber Co.,Ltd.",False,4/10/1998 12:00:00 AM +00:00
"Sane Yawt Hlwar Gems Co., Ltd. ",False,10/29/2009 12:00:00 AM +00:00
BOLY TRADING COMPANY LIMITED,False,8/5/2016 12:00:00 AM +00:00
MANAW SHWE TAUNG TAN COMPANY LIMITED,False,11/16/2012 12:00:00 AM +00:00
"Minn Khant Chaw Trading Co.,Ltd.",False,12/13/1995 12:00:00 AM +00:00
SHWE MAN YAN GYI AUNG CONSTRUCTION COMPANY  LIMITED,False,4/6/2016 12:00:00 AM +00:00
SYNERGY POWER ENGINEERING & CONSTRUCTION COMPANY LIMITED,False,5/29/2013 12:00:00 AM +00:00
HHT COMPANY LIMITED,False,8/2/2017 12:00:00 AM +00:00
THANDAR AH HLA CONSTRUCTION COMPANY LIMITED.,False,12/2/2014 12:00:00 AM +00:00
VICTORY CIRCLE COMPANY LIMITED,False,1/28/2013 12:00:00 AM +00:00
WHIZZ ENGINEERING SERVICES COMPANY LIMITED,False,8/26/2015 12:00:00 AM +00:00
K & Z KHAING ZAR COMPANY LIMITED,False,5/16/2017 12:00:00 AM +00:00
HYBRID EMPORIUM LTD,False,11/10/2020 4:41:00 PM +06:30
JUSTICE AND INDEPENDENT TRACK COMPANY LIMITED,False,5/28/2014 12:00:00 AM +00:00
MAY MYAT MYINT MO CONSTRUCTION COMPANY LIMITED,False,12/1/2017 12:00:00 AM +00:00
EN-JIN GEMS & JEWELLERY COMPANY LIMITED,False,1/21/2013 12:00:00 AM +00:00
SATURN AND  FORTUNE COMPANY LIMITED,True,1/30/2018 12:00:00 AM +00:00
"SHWE TOENAYAR DECORATION, MECHANICAL & ELECTRICAL ENGINEERING CO., LTD.",True,11/25/2020 9:05:05 PM +06:30
TUN CHO HEIN CONSTRUCTION COMPANY LIMITED,False,9/3/2020 8:19:23 PM +06:30
"""Aye Yadanar Tun"" Family Gems Co.,Ltd",False,3/17/1999 12:00:00 AM +00:00
ABC SMART SOLUTIONS COMPANY LIMITED,False,1/12/2021 12:03:39 PM +06:30
HI-TRUST COMPANY LIMITED,False,1/25/2016 12:00:00 AM +00:00
CHAN THAR MYO MYAT COMPANY LIMITED,False,10/30/2019 5:39:28 PM +06:30
ROYAL THEE HLAING  COMPANY  LIMITED,False,9/23/2016 12:00:00 AM +00:00
THU YA SWAN COMPANY LIMITED,False,5/17/2017 12:00:00 AM +00:00
MANOHARI ENGINEERING GROUP ELECTRICAL TRADING AND ENGINEERING COMPANY LIMITED,False,8/29/2020 1:21:56 PM +06:30
TRAVELS SUPPORT COMPANY LIMITED,False,9/13/2010 12:00:00 AM +00:00
ROYAL FLYING PHOENIX COMPANY LIMITED,False,9/6/2020 2:15:30 PM +06:30
EMERALD MOE COMPANY LIMITED,False,5/4/2015 12:00:00 AM +00:00
NGAT PYAW KYUN HTAIN LIN COMPANY LIMITED,False,5/5/2015 12:00:00 AM +00:00
CREST GROUP OF COMPANY LIMITED,False,2/9/2017 12:00:00 AM +00:00
ROYAL HUKAUNG COMPANY LIMITED,False,10/5/2020 7:44:45 AM +06:30
BLUE BUTTERFLY CARE  COMPANY LIMITED,False,4/26/2019 10:24:51 AM +06:30
UNIVERSAL SUPPLY TRADING COMPANY LIMITED,True,8/13/2018 12:00:00 AM +00:00
SKY ARROW COMPANY LIMITED,False,8/7/2019 3:06:12 PM +06:30
MYANMAR ECO TRAVELS & TOURS COMPANY LIMITED,False,10/17/2012 12:00:00 AM +00:00
SHENG DAR CONSTRUCTION COMPANY LIMITED,False,3/21/2019 12:00:00 AM +00:00
GOLDEN FISH FUTURE COMPANY LIMITED,False,7/9/2018 12:00:00 AM +00:00
NAING THU AUNG ENGINEERING GROUP COMPANY LIMITED,False,10/9/2015 12:00:00 AM +00:00
SKY HOLIDAY COMPANY LIMITED,False,8/10/2015 12:00:00 AM +00:00
GOLDWIN GLOBAL COMPANY LIMITED,False,2/20/2013 12:00:00 AM +00:00
SAN PYAE THIT SAR CONSTRUCTION GROUP COMPANY LIMITED,False,10/4/2018 12:00:00 AM +00:00
LUCKY CITY WORLD COMPANY LIMITED,False,8/8/2019 12:00:00 AM +00:00
JU HNIN MAR NAING TRADING COMPANY LIMITED,False,10/10/2018 8:03:39 AM +06:30
 MACRO FELIX COMPANY LIMITED,False,1/10/2017 12:00:00 AM +06:30
KING CHAUNG WA CONSTRUCTION COMPANY LIMITED ,False,3/11/2013 12:00:00 AM +00:00
Hnin Hnin Aye Company limited,False,3/30/1993 12:00:00 AM +00:00
FIRST ORIGINAL NATIVE LAND MYANMAR COMPANY LIMITED,False,2/16/2017 12:00:00 AM +00:00
SHWE KAN THAR HTUN COMPANY LIMITED,False,2/12/2020 9:41:07 PM +06:30
S & M EMPIRE GROUP COMPANY LIMITED,False,7/11/2018 12:00:00 AM +00:00
CINDERELLA COMPANY LIMITED,False,7/2/2012 12:00:00 AM +00:00
 TRUSTINNO COMPANY LIMITED,False,3/15/2017 12:00:00 AM +00:00
A PAUNG THAR COMPANY LIMITED,False,1/5/2021 6:38:52 PM +06:30
FREE MYANMAR COMPANY LIMITED,False,3/17/2016 12:00:00 AM +00:00
SU WADI HTUN CONSTRUCTIONCOMPANY LIMITED,False,11/2/2015 12:00:00 AM +06:30
PREMIUM BUILDER BROTHERS COMPANY LIMITED,False,8/13/2020 10:35:37 PM +06:30
PHYO SI THU JEWELLERY COMPANY LTD,False,6/17/2011 12:00:00 AM +00:00
KISPA NADI COMPANY LIMITED,False,10/7/1999 12:00:00 AM +00:00
KHAING YOMA CONSTRUCTION COMPANY LIMITED,False,5/24/2018 12:00:00 AM +00:00
FAMILY YADANARBON COMPANY LIMITED,False,12/9/2015 12:00:00 AM +00:00
Acclaim Insurance Brokers Pte Ltd,False,6/28/2018 12:00:00 AM +00:00
NOVEMBER RAIN COMPANY LIMITED.,False,7/13/2017 12:00:00 AM +00:00
Y.H.O COMPANY LIMITED,False,11/27/1992 12:00:00 AM +00:00
OUR STRENGTH COMPANY LIMITED,False,8/9/2019 12:35:54 PM +06:30
LWIN LAY MYANMAR COMPANY LIMITED.,False,6/27/2016 12:00:00 AM +00:00
THIDA AYE MYA SERVICES COMPANY LIMITED,False,1/31/2011 12:00:00 AM +00:00
HEIN YAUNG CHI AUNG COMPANY LIMITED,False,12/27/2011 12:00:00 AM +00:00
TCIS INSPECTION (MYANMAR) COMPANY LIMITED,True,8/11/2018 12:00:00 AM +00:00
CELLAR DOOR COMPANY LIMITED,False,2/27/2017 12:00:00 AM +00:00
HTAIK HTAR AKARI COMPANY LIMITED,False,6/6/2018 12:00:00 AM +00:00
MYANMAR BAWGA COMPANY LIMITED,False,12/6/2019 12:00:00 AM +06:30
WORLD PEARL COMPANY LIMITED,False,8/31/2020 4:01:25 PM +06:30
TRIPSTAR MYANMAR TOURS & TRAVEL COMPANY LIMITED,False,5/22/2013 12:00:00 AM +06:30
GOLDEN TWO BROTHER TRADING COMPANY LIMITED,False,6/22/2017 12:00:00 AM +00:00
MUSE THU COMPANY LIMITED,False,11/1/2010 12:00:00 AM +00:00
HTUN TAUK SHWE MYAY COMPANY LIMITED,False,8/21/2017 12:00:00 AM +00:00
SILVER COMET COMPANY LIMITED,False,5/29/2014 12:00:00 AM +00:00
GOLDEN MYANMAR EDUCATION INTERNATIONAL SERVICE COMPANY LIMITED,False,3/25/2020 3:00:32 PM +06:30
KAUNG WANA HTET COMPANY LIMITED,False,2/20/2019 4:02:02 PM +06:30
SHINING LIGHTS COMPANY LIMITED,False,8/18/2015 12:00:00 AM +00:00
MK May Myanmar Company Limited.,False,6/6/2018 12:00:00 AM +00:00
PRINCESS PUHTWAR COMPANY  LTD,False,1/26/2016 12:00:00 AM +00:00
KYAW LOGISTICS MYAWADDY COMPANY LIMITED,False,7/2/2018 12:00:00 AM +00:00
ONE GO COMPANY LIMITED,False,5/8/2019 12:00:00 AM +00:00
"SHWE KO LAY MINING Co., Ltd.",False,12/18/2007 12:00:00 AM +00:00
ASIA ZEUS (MYANMAR) COMPANY LIMITED,True,2/5/2014 12:00:00 AM +00:00
SHWE KABA MAUNG MAUNG MARINE PRODUCTS MANUFACTURING COMPANY LIMITED,False,4/26/2013 12:00:00 AM +00:00
MYANMA EVER TRUTH COMPANY LIMITED,False,12/17/2013 12:00:00 AM +00:00
KAUNG SAN TOE COMPANY LIMITED,False,12/28/2019 12:00:00 AM +06:30
AUNG PHYO HTIKE COMPANY LIMITED,False,11/27/2020 10:07:23 AM +06:30
UTA GLOBAL LOGISTICS COMPANY LIMITED,False,12/20/2018 9:51:23 PM +06:30
NEW ASIA PALACE COMPANY LIMITED,False,9/6/2013 12:00:00 AM +00:00
WAN YWAL COMPANY LIMITED,False,1/5/2018 12:00:00 AM +00:00
"Central  Gulf  Services Co.,Ltd.",False,2/13/2008 12:00:00 AM +00:00
SHWE NI MYAY COMPANY LIMITED,False,11/19/2018 12:00:00 AM +00:00
GRAND FORCE STAR COMPANY LIMITED,False,10/14/2018 12:00:00 AM +06:30
AUNG MYAT MOEE COMPANY LIMITED,False,12/5/2013 12:00:00 AM +06:30
RNN (DAWEI) COMPANY LIMITED,False,12/2/2019 9:11:24 PM +06:30
JIMG DIMG COMPANY LIMITED,False,5/15/2018 12:00:00 AM +00:00
ZAYAR SHWE SIN COMPANY LIMITED,False,9/6/2018 12:00:00 AM +00:00
K.M.DASTUR & COMPANY PRIVATE LIMITED,False,7/31/2014 12:00:00 AM +00:00
BRIGHTLY SUN MOON STAR COMPANY LIMITED,False,8/31/2018 12:00:00 AM +00:00
SKY COMET COMPANY LIMITED,False,2/23/2011 12:00:00 AM +00:00
"Aye Win Thiri Co., Ltd.",False,9/21/2004 12:00:00 AM +00:00
MASS CO COMPANY LIMITED ,False,10/5/2016 12:00:00 AM +00:00
MEG  TRANSPORT  COMPANY  LIMITED,False,3/14/2019 12:00:00 AM +00:00
XIANG HENG BEE PRODUCTS DEVELOPMENT LIMITED,False,12/1/2016 12:00:00 AM +00:00
INGYINN KHIN COMPANY LIMITED,False,4/11/2018 12:00:00 AM +00:00
PAING PAING NAING NAING COMPANY LIMITED,False,4/11/2017 12:00:00 AM +00:00
TAW WIN YADANAR AUNG COMPANY LTD,False,7/22/2019 12:00:00 AM +00:00
"UNITED CHANNEL CO., LTD.",False,4/28/2011 12:00:00 AM +00:00
SAN AKARI SOE COMPANY LIMITED,False,5/19/2015 12:00:00 AM +00:00
LIGHTHOUSE MM COMPNAY LIMITED,False,3/12/2018 12:00:00 AM +00:00
FFF COMPANY LIMITED,False,1/29/2018 12:00:00 AM +00:00
"CHAN NYEIN AUNG CO., LTD",False,9/18/2002 12:00:00 AM +00:00
KYAW GYI GENERAL SERVICES COMPANY LIMITED,False,12/13/2011 12:00:00 AM +00:00
ORIENT VICTOR COMPANY LIMITED,False,2/14/2019 12:02:43 PM +06:30
STATIC ALERT TRADING COMPANY LIMITED,False,11/8/2013 12:00:00 AM +00:00
QBP MYANMAR LIMITED,True,10/8/2015 12:00:00 AM +06:30
WIN STAR MYANMAR REAL ESTATE COMPANY LIMITED,False,12/16/2020 9:34:55 AM +06:30
"TABOUNG NAWE EXPORT & IMPORT CO.,LTD.",False,9/24/2008 12:00:00 AM +00:00
AUNG TRIO TECHNO ENGINEERING COMPANY LIMITED.,False,9/12/2014 12:00:00 AM +00:00
GOLDEN LION HEART COMPANY LIMITED,False,5/2/2017 12:00:00 AM +00:00
AUNG SITT MIN KSA COMPANY LIMITED,False,1/8/2019 1:31:33 PM +06:30
ROYAL LUXURY GROUP INTERNATIONAL COMPANY LIMITED,False,10/7/2013 12:00:00 AM +00:00
SANDIAN AND GROUP OF COMPANY LIMITED,False,3/25/1997 12:00:00 AM +00:00
SAUNG TAW KUU COMPANY LIMITED,False,9/22/2020 9:09:24 PM +06:30
HEX LITE COMPANY LIMITED,False,5/2/2018 12:00:00 AM +00:00
DANA SUYAR COMPANY LIMITED,False,4/23/2015 12:00:00 AM +00:00
TOP  GREAT  STAR  COMPANY  LIMITED,False,2/15/2019 7:18:46 PM +06:30
TYPICAL THREE COMPANY LIMITED,False,2/8/2017 12:00:00 AM +00:00
STEEL LINE COMPANY LIMITED,False,11/20/1996 12:00:00 AM +00:00
A.N.A.T COMPANY LIMITED,False,7/26/2017 12:00:00 AM +00:00
EXPERTISE TRADING COMPANY LIMITED,False,9/1/2016 12:00:00 AM +00:00
business  Networking Services Ltd,False,4/11/2001 12:00:00 AM +00:00
BENTZ JAZ MYANMAR COMPANY LIMITED,False,7/11/2013 12:00:00 AM +00:00
OCEAN GOLDEN PEARL GROUP COMPANY LIMITED,False,10/6/2011 12:00:00 AM +00:00
MAN GI RI SERVICES COMPANY LIMITED,False,10/31/2012 12:00:00 AM +00:00
ASIA LACE EMBROIDERY COMPANY LIMITED,False,1/18/2018 12:00:00 AM +00:00
"THUN SHWE MOE CO.,LTD.",False,7/13/2011 12:00:00 AM +00:00
MK ZENITH COMPANY LIMITED,False,2/6/2017 12:00:00 AM +00:00
LIGHTION (MYANMAR) COMPANY LIMITED,True,1/16/2020 12:00:00 AM +00:00
RICH YADANA SHWE MYAY MINING COMPANY LIMITED,False,7/28/2011 12:00:00 AM +00:00
FWP RESEARCH COMPANY LIMITED,False,3/15/2016 12:00:00 AM +00:00
"MYANMAR DOWA  GOLDEN ECO-SYSTEM TRADING., LIMITED",False,7/7/2020 11:09:39 PM +06:30
FLY AWAY COMPANY LIMITED,False,1/9/2018 12:00:00 AM +00:00
PAN AKARI COMPANY LIMITED,False,1/20/2015 12:00:00 AM +00:00
NATURAL RESOURCE GOVERNANCE INSTITUTE ,False,2/10/2021 3:15:03 PM +06:30
C & L CONSTRUCTION COMPANY LIMITED,False,7/30/2019 3:34:42 PM +06:30
ICICLE FOODS INDUSTRIAL COMPANY LIMITED,False,6/2/2010 12:00:00 AM +00:00
KACHIN SPECIAL REGION (1)IMAWBUM (PUBLIC) COMPANY LIMITED,False,10/29/2013 12:00:00 AM +00:00
WAANEIZA WORLDWIDE TRAVELS & TOURS COMPANY LIMITED,False,1/2/2012 12:00:00 AM +00:00
KWAN GLOBAL COMPANY LIMITED,False,11/11/2020 4:02:03 PM +06:30
THAN DANA COMPANY LIMITED,False,5/19/2020 7:19:08 AM +06:30
sanyos,False,3/23/2018 12:00:00 AM +00:00
"Whitening International Trading Co., Ltd",False,4/10/2006 12:00:00 AM +00:00
"SUPERLIFE WORLD MYANMAR CO., LTD.",False,12/11/2019 12:00:00 AM +06:30
HTET NAY LIN COMPANY LIMITED,False,10/7/2019 7:17:44 AM +06:30
GOLDEN UNIVERSE COMPANY LIMITED,False,10/9/1996 12:00:00 AM +06:30
NAN HTAIKE AYER COMPANY LIMITED,False,10/9/2012 12:00:00 AM +00:00
HLEDAN CENTRE MANAGEMENT COMPANY LIMITED,False,6/16/2016 12:00:00 AM +00:00
SHINING ACCESS GARMENT MANUFACTURING COMPANY LIMITED 2,False,11/8/2013 12:00:00 AM +00:00
WELLSPRING OF POWER TRAVELS & TOURS COMPANY LIMITED,False,10/26/2012 12:00:00 AM +00:00
NY NEW YORK COMPANY LIMITED,False,7/4/2018 12:00:00 AM +00:00
KFLA DEVELOPMENT COMPANY LTD,False,11/4/2019 12:00:00 AM +06:30
"Visibility Myanmar Co.,ltd.",False,3/29/2013 12:00:00 AM +00:00
THE RIVER YAMONA COMPANY LIMITED,False,11/11/2020 11:09:48 AM +06:30
ONE PAY COMPANY LIMITED,False,1/3/2019 12:00:00 AM +06:30
KHAY MARN KYAW COMPANY LIMITED,False,10/2/2018 12:00:00 AM +00:00
GTA TRANSPORTATION  COMPANY LTD.,False,12/13/2018 5:04:49 PM +06:30
MAGI POWER GROUP INDUSTRIES COMPANY LIMITED,False,9/19/2011 12:00:00 AM +00:00
GLOBAL SUSTAINABLE CERTIFICATION SERVICES LIMITED,True,3/13/2018 12:00:00 AM +00:00
MANDALAY MOTORS LIMITED,False,5/21/2012 12:00:00 AM +00:00
CECILIA(CCL) COMPANY LIMITED,False,8/3/2019 12:00:00 AM +00:00
"Uranus Co., Ltd.",False,6/21/2002 12:00:00 AM +00:00
LUX DIGITALS COMPANY LIMITED,False,1/8/2020 12:00:00 AM +06:30
"Kyaw Ye Aung Trading Co., Ltd.",False,8/20/2002 12:00:00 AM +00:00
MYANMAR NAWARAT CEMENT LIMITED,False,11/1/2012 12:00:00 AM +00:00
"AGGA YADANAR JADE, GEMS & JEWELLERY COMPANY LIMITED",False,9/5/2008 12:00:00 AM +00:00
AUNG PAING HEIN COMPANY LIMITED,False,3/9/2015 12:00:00 AM +00:00
OI KAKEHASHI CONSTRUCTION COMPANY LIMITED,True,6/23/2014 12:00:00 AM +00:00
UNITED EVER COMPANY LIMITED,False,12/30/2015 12:00:00 AM +00:00
CHO SUPPLY KYAUK PHYU COMPANY LIMITED,False,8/18/2014 12:00:00 AM +00:00
SUCCESS TIME INTERNATIONAL COMPANY LIMITED,False,1/2/2014 12:00:00 AM +00:00
SHWE  PHYO PHYO AUTO SERVICE COMPANY LIMITED,False,12/6/2012 12:00:00 AM +06:30
BA LA KHA JADE COMPANY LIMITED,False,6/7/2019 12:00:00 AM +00:00
VICTORIA POINT MYANMAR COMPANY LIMITED,False,10/31/2016 12:00:00 AM +00:00
KHAING MYINT MYAT COMPANY LIMITED,False,10/7/2020 4:05:47 PM +06:30
EXCELLENT PRINTERS GROUP COMPANY LIMITED,False,10/23/2018 9:34:19 AM +06:30
JYYF INVESTMENT DEVELOPMENT COMPANY LIMITED,True,11/22/2019 12:00:00 AM +06:30
"Myo Family Trading Co.,Ltd.",False,5/9/2003 12:00:00 AM +00:00
U T Z CONSTRUCTION AND ENGINEERING COMPANY LIMITED,False,3/23/2015 12:00:00 AM +00:00
HONGO TSUJI TAX & ACCOUNTING  MYANMAR COMPANY LIMITED,True,4/1/2015 12:00:00 AM +00:00
THREE FIVE THREE COMPANY LIMITED,False,10/29/2018 12:00:00 AM +00:00
OAKAR SOE MOE COMPANY LIMITED,False,6/3/2020 5:49:05 AM +06:30
HUAN QIU CONSTRUCTION & ENGINEERING COMPANY LIMITED,False,11/1/2018 12:00:00 AM +00:00
TE LI NAI TOOLS COMPANY LIMITED,True,1/8/2020 4:48:26 PM +06:30
TRIPLE Z TRADING COMPANY LIMITED,False,5/7/2012 12:00:00 AM +00:00
SHENG JIAN SCIENTIFIC SERVICE COMPANY LIMITED,False,9/8/2014 12:00:00 AM +00:00
SHWE SIN LA MIN CONSTRUCTION COMPANY LIMITED,False,2/1/2018 12:00:00 AM +00:00
INYA MYANMAR TRAVELS & TOURS COMPANY LIMITED.,False,4/30/2013 12:00:00 AM +00:00
9 G COMPANY LIMITED,False,5/18/2019 7:40:55 AM +06:30
"DGB CAPITAL CO., LTD.",False,5/28/2020 5:54:37 PM +06:30
KHAING & KYAW SERVICES COMPANY LIMITED,False,12/13/2010 12:00:00 AM +06:30
SHEPHERD COMPANY LIMITED,False,5/5/2015 12:00:00 AM +00:00
"Great Wall Wood Industry Co,ltd",False,8/16/2012 12:00:00 AM +00:00
DIAMOND STAIR COMPANY LIMITED,False,12/30/2008 12:00:00 AM +06:30
PUTAO ADVENTURE COMPANY LIMITED,False,6/4/2019 10:45:00 AM +06:30
DONGZHIYANG (MYANMAR) TRADING COMPANY LIMITED,False,6/25/2020 7:33:34 PM +06:30
AUNG THU KHA YADANAR CONSTRUCTION COMPANY LIMITED,False,6/26/2014 12:00:00 AM +00:00
EAST GROWTH GARMENT COMPANY LIMITED,False,3/14/2011 12:00:00 AM +00:00
FU XING MEI COMPANY LIMITED,False,1/26/2018 12:00:00 AM +00:00
"Myanmar Sunny International 
Co., Ltd.",False,1/16/1998 12:00:00 AM +00:00
GOLDEN FUTURE KKN COMPANY LIMITED,False,1/16/2020 10:53:07 AM +06:30
JIADE HOLDFORTUNE DEVELOPMENT COMPANY LIMITED,False,5/29/2015 12:00:00 AM +00:00
ASIA GOLDEN MYANMAR  COMPANY LIMITED,False,9/12/2019 10:46:28 PM +06:30
"YHI AUNG (MYANMAR) CO., LTD",True,1/9/2018 12:00:00 AM +00:00
MYANMAR FOC MAINTENANCE SERVICE COMPANY LIMITED,True,5/8/2018 12:00:00 AM +00:00
URBANIZE COMPANY LIMITED,False,6/19/2018 12:00:00 AM +00:00
PHYO MIN KYAL COMPANY LIMITED,False,1/11/2018 12:00:00 AM +00:00
KPBS TRADING COMPANY LIMITED,False,9/25/2013 12:00:00 AM +00:00
KAUNG SATT KO KO COMPANY LIMITED,False,9/14/2020 12:27:20 PM +06:30
YADANAR WIT YI COMPANY LIMITED,False,10/24/2013 12:00:00 AM +00:00
DIAMOND VALLEY ENGINEERING AND CONSTRUCTION COMPANY LIMITED,False,4/28/2015 12:00:00 AM +00:00
WATANABE KIKAKU (MYANMAR) COMPANY LTD,True,2/28/2017 12:00:00 AM +00:00
"Ananda Oversea Co., Ltd.",False,8/9/2005 12:00:00 AM +00:00
N C POWER COMPANY LIMITED,False,10/11/2016 12:00:00 AM +00:00
BLUETEX MYANMAR COMPANY LIMITED,True,1/31/2020 12:01:00 PM +06:30
N N International Ltd.,False,12/4/1998 12:00:00 AM +00:00
"Eternal Five Group Co., Ltd.",False,6/1/1999 12:00:00 AM +00:00
MYANMAR SWAN ARR THIT (SP) COMPANY LIMITED,False,12/30/2020 3:13:21 PM +06:30
SSMLCA (SHAN STATE MYANMAR LICENSED CONTRACTORS ASSOCIATION) COMPANY LIMITED,False,10/18/2019 12:00:00 AM +06:30
PROJECT SOLUTIONS MYANMAR COMPANY LIMITED,False,11/30/2016 12:00:00 AM +00:00
ZAW PHAY AYE COMPANY LIMITED,False,8/24/2017 12:00:00 AM +00:00
AUTO D TECH CORPORATION  LIMITED,False,9/9/2014 12:00:00 AM +00:00
"Kang Long Travels & Tours Co., Ltd.",False,6/14/1996 12:00:00 AM +00:00
Summit Trading Ltd.,False,6/7/2002 12:00:00 AM +00:00
LA MIN THA (KYEINTALI) COMPANY LIMITED,False,12/25/2020 4:37:58 AM +06:30
TOGETHER MYANMAR COMPANY LIMITED,False,9/4/2013 12:00:00 AM +00:00
YE KYAW WIN ENTERPRISE LIMITED,False,7/8/2011 12:00:00 AM +00:00
SHELL FOOD AND BEVERAGE CONSULTING SERVICE COMPANY LIMITED,False,8/16/2018 12:00:00 AM +00:00
PARSONS DEVELOPMENT COMPANY LIMITED,False,12/13/2016 12:00:00 AM +00:00
OHA NA EZE NDI IGBO ASSOCIATION LTD GTY,True,9/27/2019 12:00:00 AM +06:30
"Mya Yadana Htun Trading Co., Ltd.",False,2/8/1991 12:00:00 AM +00:00
URU HTET OO THAR COMPANY LIMITED,False,3/29/2019 12:00:00 AM +00:00
SHWE MYINT MO HTET COMPANY LIMITED,False,11/4/2019 12:00:00 AM +06:30
MUNNA ENTERPRISE COMPANY LIMITED,False,3/6/1995 12:00:00 AM +00:00
LUNG TIN PI COMPANY LIMITED,False,3/19/2015 12:00:00 AM +00:00
CLEAR REFLECTION GROUP COMPANY LIMITED,False,12/7/2016 12:00:00 AM +00:00
"Noble Shinning Star Co., Ltd",False,11/18/2011 12:00:00 AM +00:00
"KABAR HLWAN INDUSTRY Co.,Ltd.",False,2/5/2008 12:00:00 AM +00:00
NAN HTIKE WADY COMPANY LIMITED,False,4/2/2019 12:00:00 AM +00:00
M M A TROPHY COMPANY LIMITED,False,1/23/2013 12:00:00 AM +00:00
A BRIGHT SPARK GENERAL TRADING COMPANY LIMITED,False,9/17/2019 12:00:00 AM +06:30
"Zarli Industrial & Construction Co., Ltd.",False,3/1/1996 12:00:00 AM +00:00
NAW BU BAW COMPANY LIMITED,False,6/9/2014 12:00:00 AM +00:00
UNITED NATIONAL RESOURCES DEVELOPMENT COMPANY LIMITED,False,2/19/2009 12:00:00 AM +00:00
NGWE LA YAUNG AYE COMPANY LIMITED.,False,3/29/2016 12:00:00 AM +00:00
"CHIN LAND DEVELOPMENT CO., LTD",False,8/17/2009 12:00:00 AM +00:00
"MEVO Myanmar Co., Ltd.",False,9/25/2014 12:00:00 AM +00:00
GREAT EVER TOP ONE COMPANY LIMITED,False,9/14/2012 12:00:00 AM +06:30
UAC  VENTURES COMPANY LIMITED,False,9/8/2019 4:35:11 PM +06:30
"Sigma Transmission And Distribution Co., Ltd.",False,3/11/2004 12:00:00 AM +00:00
STRATA GEOTECHNICAL INVESTIGATION COMPANY LIMITED,False,7/30/2014 12:00:00 AM +00:00
NGWE SANDAR TRADING COMPANY LIMITED,False,5/10/2011 12:00:00 AM +00:00
9999 MOTOR SERVICES COMPANY LIMITED,False,10/21/2019 12:00:00 AM +06:30
R-UNITY GROUP COMPANY LIMITED,False,12/15/2015 12:00:00 AM +00:00
"Highway Heaven Co.,Ltd.",False,7/27/2010 12:00:00 AM +00:00
U-K-L CONSTRUCTION COMPANY LIMITED,False,10/27/2014 12:00:00 AM +06:30
PHYU PHYWE COMPANY LIMITED,False,4/27/2016 12:00:00 AM +00:00
CHIN NAYCHI COMPANY LIMITED,False,8/23/2016 12:00:00 AM +00:00
SHWE ZIN HTUN COMPANY LIMITED,False,1/22/2020 12:21:24 PM +06:30
TRAVEL  EXCLUSIVE EXPERIENCE A DIFFERENT JOURNEY COMPANY LIMITED,False,2/2/2020 4:10:05 PM +06:30
KKH KYAW KYAW HAN  COMPANY LIMITED,False,6/4/2019 2:36:17 PM +06:30
ELSA CONSTRUCTION COMPANY LIMITED,False,10/2/2020 5:40:52 PM +06:30
TRUST SYNERGY MYANMAR COMPANY LIMITED,False,2/26/2018 12:00:00 AM +00:00
COCOGUY INTERNATIONAL COMPANY LIMITED,True,9/26/2018 12:00:00 AM +00:00
"Triple Dragon Co., Ltd.",False,6/9/1998 12:00:00 AM +00:00
SAN & ZAW INTERNATIONAL LAW FIRM LIMITED.,False,6/15/2016 12:00:00 AM +00:00
FLYING COLOURS COMPANY LIMITED,False,11/1/2016 12:00:00 AM +00:00
"MYANMAR GRAND PACIFIC CO.,LTD.",False,12/5/1997 12:00:00 AM +00:00
ASIA BOND BROTHERS COMPANY LIMITED,False,8/18/2020 11:14:50 AM +06:30
LUCKY WORLD MANDALAR COMPANY LIMITED,False,10/5/2015 12:00:00 AM +00:00
GRANDMOTHER'S SHADOW COMPANY LIMITED,False,9/1/2020 8:56:45 PM +06:30
"TOP STYLE CONSTRUCTION CO.,LTD",False,1/17/2008 12:00:00 AM +00:00
HTUN PADETHA INDUSTRIES AND TRADING COMPANY LIMITED,False,11/16/1990 12:00:00 AM +06:30
MOT  COMPANY LIMITED,False,8/25/2017 12:00:00 AM +06:30
AYE PA PA BHONE COMPANY LIMITED,False,3/7/2019 12:00:00 AM +00:00
SAI JAR BON JADE COMPANY LIMITED,False,6/6/2019 12:00:00 AM +00:00
TU.E CAPITAL FREE DYNAMIC MYANMAR COMPANY LIMITED,False,11/29/2017 12:00:00 AM +00:00
"Su Naing Co., Ltd ",False,10/11/1999 12:00:00 AM +00:00
MANDALAY KMC COMPANY LIMITED,False,12/17/2019 10:07:56 AM +06:30
"Suruga Co., Ltd.",False,7/31/1998 12:00:00 AM +00:00
JOTIKA AUTOMOBILE CORPORATION LIMITED,False,9/23/2019 7:24:59 PM +06:30
THAN LWIN SHWE PYI COMPANY LIMITED,False,3/28/2008 12:00:00 AM +00:00
MYANMAR MAXX INTER NETWORK COMPANY LIMITED,False,9/22/2015 12:00:00 AM +00:00
E I G COMPANY LIMITED,False,7/3/2019 10:56:09 AM +06:30
NADY AENT BHONE COMPANY LIMITED,False,11/28/2019 12:00:00 AM +06:30
MOE & TUN ASSOCIATES LIMITED,False,7/5/2013 12:00:00 AM +00:00
CAZ CONSULTANCY SERVICES COMPANY LIMITED,False,1/8/2021 5:16:42 PM +06:30
"Myanmar South Pacific Co., Ltd",False,9/19/2006 12:00:00 AM +00:00
NAGA BROTHERS COMPANY LIMITED,False,5/7/2015 12:00:00 AM +00:00
GLOBAL RICH CONSTRUCTION COMPANY LIMITED,False,2/21/2013 12:00:00 AM +00:00
5 MASCOTS COMPANY LIMITED,False,8/22/2020 5:41:35 AM +06:30
"Lynn Mouk Co., Lt.d",False,4/6/2005 12:00:00 AM +00:00
KAUNG HTET WAI YAN KYAW COMPANY LIMITED,False,11/26/2013 12:00:00 AM +00:00
"TOP JOY TRADING CO., LTD",False,3/22/2012 12:00:00 AM +00:00
YANGON FIRST STATIONERY MANUFACTURING COMPANY LIMITED,True,5/29/2015 12:00:00 AM +06:30
M-HUMAS COMPANY LIMITED,False,4/1/2014 12:00:00 AM +00:00
"ZENITH OCEAN ENGINEERING & CONSTRUCTION CO, LTD",False,3/9/2020 8:45:08 AM +06:30
"GOUVERNEUR SERVICES INTERNATIONAL CO., LTD.",True,1/25/2013 12:00:00 AM +00:00
MYANMAR HONG FA INVESTMENT & DEVELOPMENT COMPANY LIMITED,False,9/8/2014 12:00:00 AM +00:00
TRUST DAY COMPANY LTD,False,8/6/2020 9:23:15 PM +06:30
"Barefoot Co., Ltd. ",False,5/27/2014 12:00:00 AM +00:00
SEIN SHWE YADANAR TUN COMPANY LIMITED,False,1/18/2018 12:00:00 AM +00:00
LINN MYAT THIT COMPANY LIMITED,False,10/12/2020 6:08:43 PM +06:30
ASIA ONE MYANMAR CONSTRUCTION COMPANY LIMITED,False,11/12/2014 12:00:00 AM +00:00
"ROYAL NATION CAR SALES & GENERAL SERVICES CO, LTD",False,7/28/2020 6:14:24 AM +06:30
VITAL NUTRIENTS SUPPLY COMPANY LIMITED,False,6/17/2016 12:00:00 AM +00:00
"ROYAL SHWE THAZIN HOTEL CO.,LTD",False,7/14/2008 12:00:00 AM +00:00
Siostyle Company Limited.,False,8/2/2017 12:00:00 AM +00:00
MR.ZAW OVERSEAS EMPLOYMENT SERVICES AGENCY COMPANY LIMITED,False,5/15/2018 12:00:00 AM +00:00
GOOD GOAL COMPANY LIMITED,False,12/6/2020 10:08:48 PM +06:30
T.P.T JAPAN COMPANY LIMITED,False,6/21/2017 12:00:00 AM +00:00
SKYJET & OSKAR WEHR KG SHIPPING COMPANY LIMITED,False,7/31/2013 12:00:00 AM +00:00
SPLENDID EMPIRE COMPANY LIMITED,False,12/9/2020 4:33:12 PM +06:30
"Ya Htaik Co., Ltd.",False,5/7/1997 12:00:00 AM +00:00
Lotus  Holdings  Ltd.,False,5/27/2013 12:00:00 AM +00:00
"MIN DANA TOE JADE, GEMS & JEWELLERY COMPANY LIMITED",False,8/19/2019 12:00:00 AM +00:00
MYANMAR YUAN DONG NAN YANG TRADING COMPANY  LIMITED,False,5/24/2016 12:00:00 AM +00:00
EXPERIAN  DEVELOPMENT LTD.,False,2/4/2019 12:00:00 AM +00:00
HTOO AUNG KHIT ( H A K ) COMPANY LIMITED,False,12/15/2020 6:31:12 PM +06:30
PYAE PHYO MYINT MO SERVICES COMPANY LIMITED,False,3/13/2013 12:00:00 AM +00:00
RELIANCE VILLE COMPANY LIMITED,False,7/5/2016 12:00:00 AM +00:00
MYANMAR DING SHI CAPITAL  DEVELOPMENT COMPANY LIMITED,True,12/14/2015 12:00:00 AM +00:00
EXCELLENCE MINING COMPANY LIMITED,False,9/29/2005 12:00:00 AM +00:00
 SHWE NANN YIN HLA MINING COMPANY LIMITED,False,6/2/2010 12:00:00 AM +00:00
DURABLE COMPANY LIMITED,False,1/5/2007 12:00:00 AM +06:30
HEIN DANA NWE COMPANY LIMITED,False,10/8/2020 2:23:37 PM +06:30
S T N M COMPANY LIMITED,False,2/24/2020 1:48:38 PM +06:30
"Khine Zaw Linn Mining Co.,",False,5/29/2012 12:00:00 AM +00:00
FIBER LIFE COMPANY LIMITED,False,6/20/2019 1:28:37 PM +06:30
ASIA ELEVATOR VENTILATION EQUIPMENT LTD,True,5/13/2016 12:00:00 AM +00:00
MHL MYANMAR COMPANY LIMITED,False,7/9/2015 12:00:00 AM +00:00
KYAW HEIN (KH) COMPANY LIMITED,False,6/21/2016 12:00:00 AM +00:00
"INTERNATIONAL HUMAN RESOURCES CO., LTD",True,7/25/2019 12:00:00 AM +00:00
ZARMANI PAING COMPANY LIMITED,False,10/1/2020 12:15:30 PM +06:30
AUNG MYO CHIT COMPANY LTD,False,7/18/2019 3:42:26 PM +06:30
