 GREAT SHWE MYINT ZU CUSTOMER SERVICE  LTD,False,1/16/2019 12:00:00 AM +00:00
I.I.I GLOBAL INTERNATIONAL COMPANY LIMITED,False,9/27/2019 12:00:00 AM +06:30
CHARMING ANGEL MINING COMPANY LIMITED,False,3/16/2020 10:59:54 AM +06:30
BEAUTY NO(1) COMPANY LIMITED,False,7/17/2018 12:00:00 AM +00:00
SHWE MYOE KAYTU COMPANY LIMITED,False,8/21/2020 8:23:46 PM +06:30
KAUNG MYINT SAN GEMS & JEWELLERY COMPANY LIMITED,False,6/21/2010 12:00:00 AM +00:00
"Valley Rain Mining  Co., Ltd",False,8/5/2010 12:00:00 AM +00:00
YA TI THANT CONSTRUCTION MATERIALS AND MACHINERY COMPANY LIMITED,False,11/24/2014 12:00:00 AM +00:00
ZO LEGACY LTD,False,8/9/2019 12:00:00 AM +00:00
PAING HTET WIN COMPANY LTD,False,7/5/2017 12:00:00 AM +00:00
SEIN KABA JEWELLERY COMPANY LTD,False,11/13/1995 12:00:00 AM +00:00
"MEIA FURNISHINGS (MYANMAR) CO., LTD",True,12/31/2020 4:29:48 PM +06:30
"TRADITIONAL CLASSIC PRODUCTS COMPANY, LIMITED",False,11/25/2019 12:00:00 AM +06:30
Y L A COMPANY LIMITED,False,1/8/2014 12:00:00 AM +00:00
ECMIS KLA COMPANY LIMITED,False,6/6/2016 12:00:00 AM +00:00
ZWE THUUTA NAING COMPANY LIMITED,False,3/3/2017 12:00:00 AM +00:00
THE LIFE ENTERPRISE COMPANY LIMITED,False,11/14/2018 11:42:52 AM +06:30
TONK SAM KENG COMPANY LIMITED ,False,4/28/2017 12:00:00 AM +00:00
HAW NAN INTERNATIONAL TRADING COMPANY LIMITED,False,8/15/2012 12:00:00 AM +00:00
INYA FILMS COMPANY LIMITED,False,3/10/2016 12:00:00 AM +00:00
GALAXY GUARDIANS COMPANY LIMITED,False,5/25/2015 12:00:00 AM +00:00
NANT THAR TOE COMPANY LIMITED,False,11/1/2019 4:09:33 PM +06:30
GLOBAL TNA COMPANY LIMITED,False,10/28/2019 10:15:51 PM +06:30
"Dignity Trading Co.,Ltd.",False,6/16/1998 12:00:00 AM +00:00
SHWE SHWE SHWE COMPANY LIMITED.,False,12/20/2017 12:00:00 AM +00:00
VICTORY WEALTH CONSTRUCTON COMPANY LIMITED,False,10/20/2014 12:00:00 AM +00:00
HAWN SARR COMPANY LIMITED,False,4/5/2016 12:00:00 AM +00:00
TRADERS SQUARE COMPANY LIMITED,True,9/6/1996 12:00:00 AM +00:00
SHWE KHIT THIT OO CONSTRUCTION COMPANY LIMITED,False,10/13/2011 12:00:00 AM +00:00
KALAY CITY INTERNATIONAL GROUP COMPANY LIMITED,False,3/9/2016 12:00:00 AM +00:00
WAI YAN THAW HPA AN COMPANY LIMITED,False,9/30/2020 11:11:43 AM +06:30
ZAW MIN HTUT FAMILY COMPANY LIMITED,False,9/17/2018 12:00:00 AM +06:30
ROYAL GREEN HOME COMPANY  LIMITED,False,8/19/2013 12:00:00 AM +00:00
TODAY MEDIA & INFORMATION LIMITED,False,10/4/1993 12:00:00 AM +00:00
AUNG KA NYAR  COMPANY LIMITED,False,5/29/2017 12:00:00 AM +00:00
ASIA CONFECTIONERY PRIVATE LIMITED,False,8/15/2016 12:00:00 AM +00:00
UNIMUSIC  RECORD LABELS COMPANY LIMITED,False,2/10/2017 12:00:00 AM +00:00
MYAT MON CHAN THAR COMPANY LIMITED,False,11/27/2018 12:00:00 AM +06:30
KYAUK SEINN BO GROUP GEMS COMPANY LIMITED,False,6/27/2012 12:00:00 AM +00:00
THU KHA SHLAN COMPANY LIMITED,False,1/24/2018 12:00:00 AM +00:00
"Min Kyan Sit Mining Co.,Ltd.",False,12/8/2009 12:00:00 AM +00:00
REAL NET COMPANY LIMITED,False,11/19/2014 12:00:00 AM +00:00
YANANT TUN COMPANY LIMITED,False,2/8/2017 12:00:00 AM +00:00
ASIA LINK (MYANMAR) FASHION COMPANY LIMITED,True,1/8/2019 1:47:03 PM +06:30
A - LUDA TRADING COMPANY LIMITED,False,12/27/2013 12:00:00 AM +00:00
TRIPLE THAR COMPANY LIMITED,False,11/7/2018 5:36:24 AM +06:30
EVER PALACE COMPANY LIMITED,False,3/20/2015 12:00:00 AM +00:00
THE PROMINENT PRODUCTION COMPANY LIMITED,False,10/12/2005 12:00:00 AM +00:00
DAWEI SPECIAL ECONOMIC ZONE MANAGEMENT COMMITTEE COMPANY LIMITED,False,7/24/2015 12:00:00 AM +00:00
AYARWADY NGWETAUNG DEVELOPMENT COMPANY LIMITED,False,9/2/2015 12:00:00 AM +00:00
YANGON HARAMAIN COMPANY LIMITED,True,11/20/2019 8:26:25 PM +06:30
KHAING A MOONLIGHT  ELECTRICAL COMPAY LIMITED,False,12/12/2018 10:26:11 AM +06:30
SOE SU SAN COMPANY LIMITED,False,2/20/2020 12:48:39 PM +06:30
HTAY MYANMAR AHLA COMPANY LIMITED,False,7/25/2013 12:00:00 AM +00:00
INFRA TOWERS MYANMAR LIMITED,True,2/9/2017 12:00:00 AM +00:00
ROYAL WISARA COMPANY LIMITED,False,8/6/2013 12:00:00 AM +00:00
CHYUN CHYI ENVIRONMENTAL TECH (MYANMAR) COMPANY LIMITED,False,5/11/2016 12:00:00 AM +00:00
DHOBI.CO COMPANY LIMITED,False,10/26/2018 12:00:00 AM +06:30
THE PROMINENT GEMS & JEWELLERY COMPANY LIMITED,False,2/28/2012 12:00:00 AM +00:00
LUCKY SUPER ONE COMPANY LIMITED,False,11/1/2017 12:00:00 AM +06:30
WIN MIN TUN (W.M.T) COMPANY LIMITED,False,9/4/2018 12:00:00 AM +06:30
MYA MYINT THIDA CONSTRUCTION COMPANY LIMITED,False,1/31/2011 12:00:00 AM +00:00
SPEEDY AUTO SERVICES COMPANY LIMITED,False,11/18/2011 12:00:00 AM +00:00
MYANMAR TML LIMITED,True,11/24/2014 12:00:00 AM +00:00
NGWE TAUNG (TTT) COMPANY LIMITED,False,3/4/2020 12:37:55 PM +06:30
"U Po And Nephews Jade & Gems Co.,Ltd",False,8/3/2007 12:00:00 AM +00:00
TINT NAING MOE COMPANY LIMITED,False,2/22/2018 12:00:00 AM +00:00
MAHAR AYEYAR COMPANY LIMITED,False,5/5/2010 12:00:00 AM +00:00
"Endeavour Travels & Tours Co.,Ltd.",False,2/11/2008 12:00:00 AM +00:00
"Myanmar Super Development Trading Co., Ltd.",False,7/20/1998 12:00:00 AM +00:00
"Lucky Face Trading Co,.Ltd.",False,3/6/2012 12:00:00 AM +00:00
"Shwe Sizar Co., Ltd.",False,9/21/2004 12:00:00 AM +00:00
HT2M GROUP COMPANY LIMITED,False,4/9/2018 12:00:00 AM +00:00
"Supreme Product Industry Co.,Ltd.",False,8/20/2002 12:00:00 AM +00:00
ZAW NAING MIN COMPANY LIMITED,False,2/9/2018 12:00:00 AM +00:00
UNITED BUSINESS FRIENDS COMPANY LIMITED,False,6/14/2016 12:00:00 AM +00:00
"Wooden Palace International Trading Co., Ltd.",False,7/8/1999 12:00:00 AM +00:00
"HTUN INTERNATIONAL MANUFACTURING Co.,Ltd.",False,9/26/2008 12:00:00 AM +00:00
SILLVER BRIGHTWAY SERVICES COMPANY LIMITED.,False,10/24/2008 12:00:00 AM +00:00
SPA ELEVATOR LIMITED,False,9/19/2012 12:00:00 AM +00:00
MINGALAR 38 COMPANY LIMITED,False,4/1/2019 12:00:00 AM +00:00
MYANMAR ECO SOLUTIONS TRADING COMPANY LIMITED,False,2/5/2013 12:00:00 AM +00:00
DAWNA THANLWIN COMPANY LIMITED,False,7/21/2017 12:00:00 AM +00:00
GOLD FOIL COMPANY LIMITED,False,11/19/2009 12:00:00 AM +00:00
"ROYAL FUTURE DEVELOPMENT CONSTRUCTION CO., LTD.",False,8/9/2019 12:00:00 AM +00:00
SUSTINEO COMPANY LIMITED,False,12/23/2014 12:00:00 AM +00:00
DAKANG(MYANMAR)AGRICULTURE & LIVESTOCK DEVELOPMENT COMPANY LIMITED,True,3/5/2018 12:00:00 AM +00:00
YANGON REGION REAL ESTATE SERVICES ASSOCIATION INCORPORATED,False,10/3/2018 10:21:10 AM +06:30
AYE CHANN NAING COMPANY LIMITED,False,5/25/2017 12:00:00 AM +00:00
THARAWUN INTERNATIONAL SERVICE COMPANY LIMITED,False,2/11/2006 12:00:00 AM +00:00
ZAR THA PYIN (INTERNATIONAL) TRADING COMPANY LIMITED,False,11/6/1998 12:00:00 AM +06:30
SHWE DAING YADANAR COMPANY LIMITED,False,10/3/2014 12:00:00 AM +00:00
"Moon Shadow Trading Co., Ltd.",False,12/30/1997 12:00:00 AM +00:00
"Trans World Freight Management Co., Ltd.",False,9/3/1998 12:00:00 AM +00:00
MYAT PHONE SAN COMPANY LIMITED,False,6/4/2019 12:00:00 AM +00:00
OMO OMO HANDMADE LIMITED,False,2/27/2019 12:00:00 AM +00:00
GADAY SOE COMPANY LIMITED,False,11/7/2013 12:00:00 AM +00:00
EFFECTIVE LIFE CONSULTANT TEAM COMPANY LIMITED,False,11/29/2016 12:00:00 AM +00:00
MYANMAR PREMIUM CLASSIC ASSOCIATES (MPCA) LIMITED,False,6/17/2019 3:22:12 PM +06:30
THE BEST CHANCE COMPANY LIMITED,False,1/26/2019 12:00:00 AM +00:00
CI YUAN COMPANY LIMITED,False,10/30/2019 12:00:00 AM +06:30
WIN & LAE COMPANY LIMITED,False,6/3/2011 12:00:00 AM +00:00
GREENLAND ENERGY SOLUTIONS COMPANY LIMITED.,False,2/22/2013 12:00:00 AM +00:00
"EAST CO.,LTD.",False,12/7/2007 12:00:00 AM +00:00
"A I M S International Co., Ltd.",False,6/16/1999 12:00:00 AM +00:00
"Golden Hornbill Mining Co,.Ltd",False,3/16/2012 12:00:00 AM +00:00
MMM ( M3 ) COMPANY LIMITED,False,10/7/2020 3:58:29 PM +06:30
SEA-BREEZE SHIP MANAGEMENT AND CONSULTANCY COMPANY LIMITED,False,5/25/2009 12:00:00 AM +00:00
SHWE HTAE WAH COMPANY LIMITED,False,2/17/2015 12:00:00 AM +00:00
"Royal Light Co.,Ltd",False,11/15/2007 12:00:00 AM +00:00
"WA THONE AYE CO., LTD",False,8/14/2020 1:22:15 PM +06:30
HAN MANDALAY CONSTRUCTION GROUP PRIVATE LIMITED,False,8/24/2015 12:00:00 AM +00:00
LAK LIN HTET (PA LAUK) COMPANY LIMITED,False,7/11/2016 12:00:00 AM +00:00
MAHA HLAN COMPANY LIMITED,False,3/20/2015 12:00:00 AM +00:00
SOE SHWE HTIKE COMPANY LIMITED,False,7/6/2010 12:00:00 AM +00:00
HTOI DAN COMPANY LIMITED,False,5/28/2019 12:00:00 AM +00:00
SOE KYAW AUNG COMPANY LIMITED,False,5/25/2019 5:19:31 PM +06:30
SAN LA HTUT COMPANY LIMITED,False,2/15/2016 12:00:00 AM +00:00
SUNNY BOY SHIPPING COMPANY LIMITED,False,4/10/2014 12:00:00 AM +00:00
"Kan Paw Construction Co., Ltd.",False,12/29/2011 12:00:00 AM +00:00
DOE SHAE SAUNG COMPANY LIMITED,False,5/12/2017 12:00:00 AM +06:30
SHWE PWINT KHAING COMPANY LIMITED,False,5/8/2018 12:00:00 AM +00:00
X PRESS TRAVEL & TOURS COMPANY LIMITED,False,9/13/2012 12:00:00 AM +00:00
KUBOTA CORPORATION,False,8/27/2012 12:00:00 AM +00:00
KN MARINE COMPANY LIMITED,False,12/6/2018 8:57:16 PM +06:30
"Aung Myint San International Trading Co.,Ltd.",False,4/4/2008 12:00:00 AM +00:00
"SHWE MYAN AUNG CO., LTD.",False,8/2/2005 12:00:00 AM +00:00
"Aung Htet Kyaw Co., Ltd.",False,6/10/1997 12:00:00 AM +00:00
YOON MYINT MO COMPANY LIMITED,False,5/19/2017 12:00:00 AM +00:00
YADANAR NYEIN COMPANY LIMITED,False,9/3/2018 12:00:00 AM +00:00
ZA TI LA COMPANY LIMITED,False,3/30/2015 12:00:00 AM +00:00
CLINIC SEVEN LTD,False,1/8/2020 12:00:00 AM +06:30
"Diamond Key Pharma & General Trading Co., Ltd.",False,3/14/2006 12:00:00 AM +00:00
A T H COMPANY LIMITED,False,5/9/2014 12:00:00 AM +00:00
ZENITH POINT COMPANY  LIMITED,False,8/19/2019 12:00:00 AM +00:00
J.K  ENGINEERING MYANKOR COMPANY LIMITED,True,5/12/2016 12:00:00 AM +00:00
SHWE MOE (YENATHAR) CONSTRUCTION COMPANY LIMITED,False,4/29/2015 12:00:00 AM +00:00
INSPIRATION GROUP PRIVATE LIMITED,False,6/13/2012 12:00:00 AM +00:00
SAUNG SESAR COMPANY LIMITED,False,8/25/2013 12:00:00 AM +00:00
"AHTULA MINING CO.,LTD",False,1/31/2008 12:00:00 AM +00:00
SU MYAT SAN TRADING COMPANY LIMITED,False,10/16/2017 12:00:00 AM +00:00
PYAE MAUNG MAUNG FAMILY COMPANY LIMITED,False,5/6/2014 12:00:00 AM +00:00
BOFFO MYANMAR COMPANY LIMITED,False,5/9/2016 12:00:00 AM +00:00
AUNG SHWE TUN MYO COMPANY LIMITED,False,8/23/2020 7:59:32 PM +06:30
GREAT FORMOSA COMPANY LIMITED,False,8/14/2018 3:51:48 PM +06:30
ALMA AUNG FAMILY COMPANY LIMITED,False,11/2/2015 12:00:00 AM +00:00
RESILIENT ENTERPRISE DESIGN COMPANY LIMITED,True,1/16/2018 12:00:00 AM +00:00
"Hein Htike General Jewellery Co.,Ltd.",False,3/22/2000 12:00:00 AM +00:00
DAWEI TREASURE WORLD COMPANY LIMITED,False,5/6/2015 12:00:00 AM +00:00
SHWE ZI ZA WAH TRADING COMPANY LIMITED,False,3/24/2009 12:00:00 AM +00:00
GOLDEN CHARM COMPANY LIMITED,False,12/30/2015 12:00:00 AM +00:00
"Aye Kyaw Trading Co., Ltd.",False,7/24/2001 12:00:00 AM +00:00
"Sun Myint Co., Ltd.",False,6/10/2004 12:00:00 AM +00:00
"Asia Star Wood work Co.,Ltd",False,11/6/1998 12:00:00 AM +00:00
MANN ERAWON COMPANY LIMITED,False,6/17/2015 12:00:00 AM +00:00
THIHA THARAWON COMPANY LIMITED,False,1/31/2021 2:30:28 PM +06:30
MYANMAR TEDRAIL INTERNATIONAL COMPANY LIMITED,False,2/14/2019 2:59:31 PM +06:30
DIALOGUE MYANMAR LTD,True,12/7/2019 12:00:00 AM +06:30
"Myat Gon Ye Co., Ltd.",False,11/22/2004 12:00:00 AM +00:00
TINE MYAN PYAY COMPANY LIMITED,False,11/17/2020 8:24:31 PM +06:30
NYI NANDAR OO TRADING COMPANY LIMITED,False,2/16/2017 12:00:00 AM +00:00
TWO IN ONE COMPANY LIMITED,False,3/28/2017 12:00:00 AM +00:00
NILAR YOMA GEMS COMPANY LIMITED,False,1/29/1996 12:00:00 AM +00:00
EQUIP HEALTH CAE MYANMAR COMPANY LIMITED,False,2/22/2012 12:00:00 AM +00:00
"Taunggyi - Ayetharyar Industrial Co,Ltd.",False,3/21/2011 12:00:00 AM +00:00
POLARIS (KPU) ENGINEERING GROUP COMPANY LIMITED,False,1/4/2021 5:25:05 PM +06:30
DOLLOR MIN MOE COMPANY LIMITED,False,9/20/2019 12:00:00 AM +06:30
"Barcelona Myanmar Co., Ltd.",False,10/9/1992 12:00:00 AM +00:00
A P S (MYANMAR)  LIMITED,True,4/10/2014 12:00:00 AM +00:00
Y K E P  COMPANY LIMITED,False,7/22/2020 10:00:03 PM +06:30
ROYAL HAN MYINT MO COMPANY LIMITED,False,1/27/2020 12:21:12 PM +06:30
BRIGHT NEW WORLD COMPANY LIMITED,False,12/6/2016 12:00:00 AM +00:00
MIN KYAW KHAUNG CONSTRUCTION & MINING COMANY LIMITED,False,4/6/2017 12:00:00 AM +00:00
ZWE MOE MYINT ELECTRICAL ENGINEERING COMPANY LIMITED,False,10/3/2018 12:00:00 AM +00:00
SHWE SONE MYAING  COMPANY LIMITED,False,11/17/2020 8:58:48 PM +06:30
SPL COMPANY LIMITED,False,10/22/2014 12:00:00 AM +00:00
"Hon Pei General Trading Co.,Ltd.",False,12/11/1995 12:00:00 AM +00:00
MYANMAR TOURISM FEDERATION INCORPORATED,False,4/29/2013 12:00:00 AM +00:00
SEE SANG-MYANMAR(2014)COMPANY LIMITED ,False,2/26/2015 12:00:00 AM +00:00
MYANMAR INTERNATIONAL CONSULTANTS (MMIC) COMPANY LIMITED,True,10/15/2012 12:00:00 AM +00:00
DE PAR KYAW COMPANY LIMITED,False,2/17/2020 10:24:27 AM +06:30
ARKAR SEIN COMPANY LIMITED,False,1/22/2019 4:52:31 PM +06:30
"LOOP AVOIDANCE CO., LTD",False,1/21/2021 2:52:46 AM +06:30
"THEIN ZAYAR TRADING CO.,LTD.",False,12/13/2011 12:00:00 AM +00:00
SANPYA ENGINEERING ALLIANCE COMPANY LIMITED,False,2/19/2015 12:00:00 AM +00:00
AUNG THAPYAY OO DEVELOPMENT PUBLIC COMPANY LIMITED,False,12/17/2014 12:00:00 AM +00:00
EASTERN PLASTICS MYANMAR COMPANY LIMITED,False,6/21/2016 12:00:00 AM +00:00
IT NET DAWEI COMPANY LIMITED,False,12/7/2018 2:19:14 PM +06:30
"Myanmar Image Construction Co., Ltd.",False,11/22/2004 12:00:00 AM +00:00
CMHT MYANMAR PACKAGING COMPANY LIMITED,False,3/17/2020 8:16:01 PM +06:30
T S UNITED COMPANY LIMITED,False,10/20/2018 12:00:00 AM +00:00
NANN HTIKE TAW WIN COMPANY LIMITED,False,1/18/2019 12:00:00 AM +00:00
FAMILY MARKETING GROUP COMPANY LIMITED,False,2/8/2013 12:00:00 AM +00:00
SARAMANDA MYANMAR COMPANY LIMITED,False,9/13/2019 8:45:37 PM +06:30
MANI KISNAR COMPANY  LIMITED,False,10/25/2017 12:00:00 AM +00:00
UDH   Limited,False,5/22/1996 12:00:00 AM +00:00
AUNG THAN HTAY COMPANY LIMITED,False,4/9/2013 12:00:00 AM +00:00
BETTER FORTUNE COMPANY LIMITED,False,2/13/2020 10:59:11 AM +06:30
"SS  International  Co.,  Ltd.",False,5/14/1996 12:00:00 AM +00:00
MONYWA ZONE PUBLIC COMPANY LIMITED,False,12/18/2003 12:00:00 AM +06:30
"Eastern Power International Trading Co., Ltd.",False,11/25/1997 12:00:00 AM +00:00
MARVELOUS   CREATION   DEVELOPMENT  SERVICES    COMPANY  LIMITED,False,11/14/2019 12:00:00 AM +06:30
HUIJINBAO TECHNOLOGY MYANMAR COMPANY LIMITED,True,5/20/2019 10:16:44 AM +06:30
G.U.S COMPANY LIMITED,False,3/8/2016 12:00:00 AM +00:00
GRACER COMPANY LIMITED,False,12/2/2020 1:30:02 AM +06:30
MYANMAR HUMAN COMMUNITY DEVELOPMENT COMPANY LIMITED,False,6/3/2016 12:00:00 AM +00:00
GREEN PEACE MYANMAR COMPANY LIMITED,False,1/10/2021 6:01:50 PM +06:30
FRANKLINCOVEY MYANMAR COMPANY LIMITED,True,4/28/2017 12:00:00 AM +00:00
ONG COMPANY LIMITED,False,9/20/2019 12:00:00 AM +06:30
SHWE MOE MYAY HLAN COMPANY LIMITED,False,10/3/2013 12:00:00 AM +00:00
Mian Xin Myanmar Mining 3 Group Ltd.,False,11/26/2012 12:00:00 AM +00:00
DIAMOND PLATINUM MINING COMPANY LIMITED,False,10/9/2003 12:00:00 AM +00:00
"NAMASTE INDIA CO., LTD",False,1/8/2020 12:00:00 AM +06:30
MTMS COMPANY LIMITED,False,6/13/2017 12:00:00 AM +00:00
MYEIK H.S CONSTRUCTION COMPANY LIMITED,False,3/25/2016 12:00:00 AM +00:00
THU KHA YEIT NYAIN COMPANY LIMITED,False,12/2/2020 12:12:36 PM +06:30
"CHEN SEIN CO., LTD.",False,10/23/2019 12:00:00 AM +06:30
FLUFFY TAIL GROOMING AND PET ACCESSORIES COMPANY LIMITED,False,10/18/2020 6:01:30 PM +06:30
THA RA PHU REAL ESTATE AND LEGAL SERVICES COMPANY LIMITED,False,11/2/2018 12:00:00 AM +00:00
Thilawar24,False,7/1/2014 12:00:00 AM +00:00
HLAING HTET AUNG COMPANY LIMITED,False,8/31/2018 12:00:00 AM +06:30
"Thukha San Co., Ltd.",False,5/9/2002 12:00:00 AM +00:00
MIN THIT NAING COMPANY LIMITED,False,12/4/2019 6:49:13 PM +06:30
"Su Latt-Pwint Gems Co., Ltd.",False,1/22/2008 12:00:00 AM +00:00
ROYAL NAWNGHKIO COMPANY LIMITED,False,8/29/2019 2:14:20 PM +06:30
THE HEAVEN MYANMAR INTERNATIONAL  TRADING COMPANY LIMITED,False,6/19/2019 11:16:44 AM +06:30
RONG -ZE  COMPANY LIMITED,False,6/9/2017 12:00:00 AM +00:00
GEO-CHEM (MYANMAR) COMPANY LIMITED,False,6/1/2016 12:00:00 AM +00:00
TECHNO POT COMPANY LIMITED,False,6/18/2018 12:00:00 AM +00:00
MYA NAN WADDY LOGISTIC COMPANY LIMITED,False,3/12/2019 3:17:16 PM +06:30
BRIGHT PATH INSTITUTE OF BUSINESS AND TECHNOLOGY COMPANY LIMITED,False,4/4/2016 12:00:00 AM +00:00
SHWE TAW TAR AUNG COMPANY LIMITED,False,3/6/2019 8:53:29 AM +06:30
"San Win Family Mining Co., Ltd.",False,8/23/2004 12:00:00 AM +00:00
MAY MOUNTAIN FAMILY COMPANY LIMITED,False,5/21/2018 12:00:00 AM +00:00
UNITED HAN FAMILY COMPANY LIMITED,False,9/16/2015 12:00:00 AM +06:30
MYANMAR FINANCE COMPANY LIMITED,False,1/27/2012 12:00:00 AM +00:00
"Gandamar Engineering Co.,Ltd.",False,3/20/2009 12:00:00 AM +00:00
OOREDOO MYANMAR FINTECH LIMITED,True,10/3/2016 12:00:00 AM +00:00
AUNG HNIN KHANT COMPANY LTD,False,4/11/2018 12:00:00 AM +00:00
"Taw Win(Fujiyama) Production Co., Ltd.",False,5/7/1997 12:00:00 AM +00:00
"Hnin Wai Wai Gems & Jewellery Co., Ltd.",False,1/18/2007 12:00:00 AM +00:00
MYE LATT HTANI COMPANY LIMITED,False,11/21/2013 12:00:00 AM +00:00
P-SQUARE ARCHITECTS LTD,False,5/19/2020 1:05:31 PM +06:30
GOLDEN BRIDGE COMPANY LIMITED,False,6/25/2019 12:00:00 AM +00:00
KAUNG THUKHA AUNG COMPANY LIMITED,False,1/20/2020 8:37:16 PM +06:30
WIN NAN DA ZAWCOMAPNY LIMITED,False,12/4/2018 12:00:00 AM +06:30
KIMBERLY COMPANY LIMITED.,False,1/19/2015 12:00:00 AM +00:00
ROYAL TETRAGON TRADING COMPANY LIMITED,False,10/29/2018 12:00:00 AM +00:00
"INTER ACME SERVICES & CONSULTING CO., LTD.",False,2/3/2012 12:00:00 AM +00:00
A N A Y COMPANY LIMITED,False,3/6/2018 12:00:00 AM +00:00
"Lynn Pyae Hein Trading Co,.Ltd.",False,10/31/2011 12:00:00 AM +00:00
MAY THIRI COMPANY LIMITED,False,9/29/2020 9:51:39 PM +06:30
"CAREMED MEDICAL TECHNOLOGY CO.,  LTD",False,8/10/2020 3:57:47 PM +06:30
NORTH FARMERS UNITED PUBLIC COMPANY LIMITED,False,8/28/2018 9:45:17 PM +06:30
MAJOI DEVELOPMENT ENTERPRISE LTD,False,1/20/2021 7:48:25 PM +06:30
PARTNERS' LINK COMPANY LIMITED,False,6/6/2019 12:00:00 AM +00:00
SALMONS CONSTRUCTION LTD,False,10/30/2019 12:00:00 AM +06:30
CHINDWIN  MYIT  THAR  COMPANY  LIMITED,False,10/14/2020 9:57:46 PM +06:30
"Asia Africa Commodities (Myanmar) Co., Ltd.",False,11/20/2013 12:00:00 AM +00:00
GOLDEN THREE BROTHERS (LPT) COMPANY LIMITED,False,12/4/2018 12:00:00 AM +06:30
GLORIA HSU COMPANY LIMITED,False,4/2/2019 12:00:00 AM +00:00
"Khaing Khant Kyaw Trading Co.,Ltd.",False,2/11/2009 12:00:00 AM +00:00
"Foresee International Trading Co., Ltd.",False,9/23/2009 12:00:00 AM +00:00
LAND CONSULTING GROUP COMPANY LIMITED,False,10/3/2014 12:00:00 AM +00:00
"Za Mi Yaung Chi Myay Mining Co.,Ltd ",False,2/1/2012 12:00:00 AM +00:00
"MAROON MANAGEMENT CO., LTD",False,7/6/2015 12:00:00 AM +00:00
7 APPLE COMPANY LIMITED,False,1/16/2017 12:00:00 AM +00:00
THEIN KADAY AYE COMPANY LIMITED,False,6/26/2018 12:00:00 AM +00:00
"Lin Zaw Co.,Ltd.",False,6/7/2002 12:00:00 AM +00:00
NAY THU YEIN [HAN] GOLD MINING COMPANY LIMITED,False,5/25/2009 12:00:00 AM +00:00
PHYO MYAT KYAW COMPANY LIMITED,False,1/31/2019 2:06:22 PM +06:30
SUPERB STELLAR MYANMAR COMPANY LIMITED,False,11/27/2017 12:00:00 AM +00:00
POLYSACK MYANMAR COMPANY LIMITED,True,4/10/2013 12:00:00 AM +00:00
TRI GROUP ENGINEERING COMPANY LIMITED,False,8/15/2018 12:00:00 AM +00:00
MYO CHIT D.M.C COMPANY LIMITED,False,9/29/2016 12:00:00 AM +00:00
"Flower Padauk Co., Ltd.",False,6/23/2004 12:00:00 AM +00:00
UNITED ALUMINIUM COMPANY LIMITED,False,11/19/2019 12:00:00 AM +06:30
"Wai Lu Waddy  Co.,Ltd.",False,4/5/2006 12:00:00 AM +00:00
MOH NOH MAUNG NAUNG COMPANY LIMITED,False,9/6/2018 12:00:00 AM +00:00
STARLET SERVICES COMPANY LIMITED,False,5/10/2016 12:00:00 AM +00:00
BEST PACKING MAKING COMPANY LIMITED,False,9/22/2015 12:00:00 AM +00:00
M GARDEN COMPANY LIMITED,False,3/4/2019 12:00:00 AM +00:00
NT  3 COMPANY LIMITED,False,3/31/2017 12:00:00 AM +00:00
GOLDEN EMPEROR 2021 COMPANY LIMITED,False,1/28/2021 7:21:12 PM +06:30
SYSTEM INTEGRATION COMPANY LIMITED,False,6/23/2011 12:00:00 AM +00:00
MOE SWE THIRI COMPANY LIMITED,False,12/8/2020 5:25:46 PM +06:30
GOLDEN BIKE COMPANY LIMITED,False,12/7/2020 2:50:38 PM +06:30
A.P.K AUNGPHYOKYAWCOMPANY LIMITED,False,12/10/2018 12:00:00 AM +00:00
GCM COMPANY LIMITED,False,8/25/2018 1:25:41 PM +06:30
"GOLDEN BELL MK CO., LTD",False,6/13/2020 7:40:51 PM +06:30
MODERN SWITCH COMPANY LIMITED,False,9/1/2019 12:00:00 AM +06:30
Lisu U Sein & Sons Gem Stone Ltd.,False,12/20/1995 12:00:00 AM +00:00
MEDA ANANKWIN ASSOCIATION INCORPORATED,False,12/13/2019 1:34:23 PM +06:30
"Myanmar Trans World Trading Co.,Ltd.",False,3/1/2006 12:00:00 AM +00:00
RONG HENG MYANMAR TRADING COMPANY LIMITED,False,9/19/2018 12:00:00 AM +00:00
COMEGA SEEDS MYANMAR LIMITED,True,10/18/2018 12:00:00 AM +00:00
YA BAR DE COMPANY LIMITED,False,7/13/2012 12:00:00 AM +00:00
DAW PU COMPANY LIMITED,False,9/19/2018 11:16:17 PM +06:30
"Wyn & Sons Co., Ltd.",False,9/10/1993 12:00:00 AM +00:00
SOLID GREEN COMPANY LIMITED,False,6/26/2014 12:00:00 AM +00:00
SAI SAN COMPANY LIMITED,False,3/8/2020 11:37:59 AM +06:30
WIN KINGDOM INTERNATIONAL COMPANY LIMITED.,False,11/28/2014 12:00:00 AM +00:00
MARID TRADING COMPANY LIMITED,False,6/24/2020 9:15:17 PM +06:30
KYAW & HTIKE LOGISTICS AND TRADING COMPANY LIMITED,False,5/13/2013 12:00:00 AM +00:00
"MYANMAR UPA CO., LTD.",True,3/17/2016 12:00:00 AM +00:00
SC CORNERSTONE COMPANY LIMITED,True,8/7/2014 12:00:00 AM +00:00
GAS TURBINE GROUP LIMITED,False,7/25/2011 12:00:00 AM +00:00
CHAIYO PRODUCTS COMPANY LIMITED,False,12/15/2017 12:00:00 AM +00:00
CENTRAL (CNITS) COMPANY LIMITED,False,7/6/2020 2:26:14 PM +06:30
SUPER GRAND COMPANY LIMITED,False,10/4/2018 7:07:18 AM +06:30
YUCCA  COMPANY LIMITED,False,1/10/2008 12:00:00 AM +00:00
"Swe Nay Min Travels & Tour Co.,Ltd",False,12/12/2003 12:00:00 AM +00:00
GIANT STEEL COMPANY LIMITED,True,4/9/2019 9:01:43 AM +06:30
"Golden Thazin Services Co., Ltd.",False,3/26/1996 12:00:00 AM +00:00
"MYANMAR ELEGANT SUPREME LEATHER GOODS CO., LTD",True,8/10/2018 4:09:31 PM +06:30
Pacific Zone Management Services Ltd.,False,9/14/2000 12:00:00 AM +00:00
"Ngwe Su Mon Co.,Ltd.",False,6/19/2009 12:00:00 AM +00:00
LINN VISION COMPANY LIMITED,False,5/5/2016 12:00:00 AM +00:00
DBS BANK LIMITED 											,False,9/16/1994 12:00:00 AM +00:00
MYINT MO YEIK CONSTRUCTION COMPANY LIMITED,False,10/24/2014 12:00:00 AM +00:00
SHWE HEIN SAN FAMILY COMPANY LIMITED,False,12/4/2013 12:00:00 AM +00:00
EAGLE SECURITY SERVICES COMPANY LIMITED,False,7/13/2010 12:00:00 AM +00:00
LUMINOUS TERRA COMPANY LIMITED,False,12/8/2020 2:15:11 PM +06:30
EASTERN SUMMIT CONSTRUCTION COMPANY LIMITED,False,9/28/2012 12:00:00 AM +00:00
LOVE HERO LAND COMPANY LIMITED,False,9/26/2014 12:00:00 AM +06:30
"Seikta Thukha Co.,Ltd.",False,11/28/1996 12:00:00 AM +00:00
CHU MYAT TRADING COMPANY LIMITED,False,1/9/2019 12:00:00 AM +06:30
KENWA MYANMAR COMPANY LIMITED,False,11/6/2015 12:00:00 AM +06:30
"MODERN TECH TRADING CO., LTD",False,7/10/2008 12:00:00 AM +00:00
THUKHA SHWE MYAY COMPANY LIMITED,False,8/23/2019 12:00:00 AM +00:00
HLYAN MOE HEIN ENGINEERING COMPANY LIMITED,False,5/12/2017 12:00:00 AM +00:00
MESON MEDIA COMPANY LIMITED,False,9/16/2015 12:00:00 AM +00:00
"Honesty Holding Manufacturing Co.,Ltd.",False,8/15/2011 12:00:00 AM +00:00
CLOUD SOURCE MYANMAR COMPANY LIMITED,True,4/24/2014 12:00:00 AM +00:00
SHWE NGWE KHINE COMPANY LIMITED,False,1/21/2016 12:00:00 AM +00:00
THANLWIN DIAMOND COMPANY LIMITED,False,4/4/2019 12:00:00 AM +00:00
PSWN HOLDINGS LIMITED,False,8/17/2018 9:27:37 AM +06:30
FONE FON COMPANY LIMITED,False,1/16/2020 11:22:02 AM +06:30
GOLDEN DANICA COMPANY LIMITED,False,3/17/2015 12:00:00 AM +00:00
MAY YU GABAR TRADING COMPANY LIMITED,False,2/23/2018 12:00:00 AM +00:00
"Insight  Myanmar  Tourism  Co.,  Ltd.",False,2/1/1995 12:00:00 AM +00:00
KALAW HIGH LAND COMPANY LIMITED,False,4/3/2013 12:00:00 AM +00:00
Terra Nova Enterprise Ltd,False,12/17/1990 12:00:00 AM +00:00
NATIVE TECHNOLOGY INTERNATIONAL COMPANY LIMITED,False,1/7/2021 12:41:03 AM +06:30
EVERGREEN SPORTS MYANMAR LIMITED,True,1/24/2017 12:00:00 AM +00:00
GORAGO COMPANY LIMITED,False,1/10/2018 12:00:00 AM +06:30
MANDALAY MANAGEMENT CORPORATION LIMITED,False,5/19/2014 12:00:00 AM +00:00
"Nan Aung Myay Co.,Ltd.",False,9/19/2000 12:00:00 AM +00:00
TOE SAT TOE COMPANY LIMITED,False,6/7/2019 12:03:20 PM +06:30
AMAZING MYANMAR ASIA (AMA) BUSINESS GROUP COMPANY LIMITED,False,5/23/2018 12:00:00 AM +00:00
MZN  COMPANY LIMITED,False,1/8/2021 5:36:44 PM +06:30
COLAY HILLS COMPANY LIMITED,False,10/2/2009 12:00:00 AM +06:30
CMA CGM (MYANMAR) COMPANY LIMITED,True,7/25/2014 12:00:00 AM +00:00
DAWEI SHWE PYI TAW COMPANY LIMITED,False,12/21/2017 12:00:00 AM +06:30
ECRO COMPANY LIMITED,False,2/16/2018 12:00:00 AM +00:00
TIMBERMATE -HMTIND CORPORATION COMPANY LIMITED,False,12/4/2017 12:00:00 AM +00:00
KO WIN ZAW AND SONS COMPANY LIMITED,False,2/28/2017 12:00:00 AM +00:00
LIN HEIN THU COMPANY LIMITED,False,12/13/2020 7:40:53 AM +06:30
MYANMAR FLORIGEN TRADING COMPANY LIMITED,False,6/19/2012 12:00:00 AM +00:00
JASS COMPANY LIMITED,False,5/11/2020 10:59:00 AM +06:30
NAN SAN TAW COMPANY LIMITED,False,11/3/2016 12:00:00 AM +00:00
FUKUSHIMA GALILEI MYANMAR CO. LTD,True,11/21/2016 12:00:00 AM +00:00
VERTEX VENTURE COMPANY LIMITED,False,5/7/2009 12:00:00 AM +00:00
MO SENG TAI COMPANY LIMITED,False,11/22/2013 12:00:00 AM +00:00
HTAIN WAR LIN COMPANY LIMITED,False,1/8/2021 12:06:14 AM +06:30
B.B ZINMAUNG COMPANY LIMITED,False,4/25/2013 12:00:00 AM +00:00
GOURMET SM TRADING COMPANY LIMITED,False,6/18/2014 12:00:00 AM +00:00