"AUNG GOLDEN LION CONSTRUCTION CO., LTD.",False,1/24/2020 9:15:56 PM +06:30
"Golen Food Co.,Ltd.",False,1/27/1997 12:00:00 AM +00:00
YMM COMPANY LIMITED,False,9/20/2019 12:00:00 AM +06:30
PITI PHYU SIN COMPANY LIMITED,False,11/13/2020 7:28:46 AM +06:30
FRILL TRADING COMPANY LIMITED,False,6/7/2005 12:00:00 AM +00:00
JINT PHONE BROTHERS COMPANY LIMITED,False,11/23/2020 12:46:55 PM +06:30
SHWE MYAY WAI PHYA COMPANY LIMITED,False,9/30/2015 12:00:00 AM +00:00
"The Trio Resource Co., Ltd.",False,3/7/2006 12:00:00 AM +00:00
REHOBOTH STEELWELD ENGINEERING LIMITED,False,1/9/2021 6:05:08 PM +06:30
 AWESOME MYANMAR COMPANY LIMITED,False,4/4/2017 12:00:00 AM +00:00
DANA HTET NAING COMPANY LIMITED,False,8/13/2019 5:08:21 PM +06:30
"May Khin Co.,Ltd.",False,10/3/2008 12:00:00 AM +00:00
HS CUSTOM BROKERAGE AND CONSULTANT COMPANY LIMITED,False,10/15/2018 12:00:00 AM +06:30
"Lucky Center Services Co., Ltd.",False,12/7/2011 12:00:00 AM +00:00
PLUMERIA TECH COMPANY LIMITED,False,9/11/2014 12:00:00 AM +00:00
DAGON MIN MIN COMPANY LIMITED,False,7/7/2020 9:16:54 AM +06:30
ZIN ZIN KO COMPANY LIMITED,False,2/15/2018 12:00:00 AM +00:00
TRENDY WAVE COMPANY LIMITED,False,6/22/2011 12:00:00 AM +00:00
GREEN ZONE INTERNATIONAL COMPANY LIMITED,False,5/21/2020 3:19:52 PM +06:30
MYANMAR HLP ENTERPRISE COMPANY LIMITED,True,1/13/2020 12:00:00 AM +06:30
COMPLETE CHEMICAL MANUFACTURING ( CCM ) MYANMAR  COMPANY LIMITED,False,1/5/2021 10:59:57 AM +06:30
POPULAR INTERNATIONAL GARMENT MANUFACTURING COMPANY LIMITED,True,11/12/2012 12:00:00 AM +00:00
CHIN TAUNG TAN COMPANY LIMITED,False,3/31/2020 4:21:20 PM +06:30
ZAN YAWAI COMPANY LIMITED,False,9/22/2015 12:00:00 AM +06:30
HEVEA MYANMAR LIMITED,False,11/18/2019 9:22:08 PM +06:30
DELTA SEA COMPANY LTD,False,4/9/2015 12:00:00 AM +00:00
TRANS HORIZON COMPANY LIMITED,False,9/4/2008 12:00:00 AM +00:00
NINE NETWORK COMPANY LIMITED,False,4/28/2016 12:00:00 AM +00:00
HNIN PWINT KYAW ENGINEERING & TRADING GROUP COMPANY LTD.,False,3/7/2019 12:00:00 AM +00:00
"SHWE PYAE AUNG TRADING Co.,Ltd.",False,3/19/2008 12:00:00 AM +00:00
"SEINN CHANCELLOR GEMS &  JEWELLERY  CO,. LTD",False,8/21/2012 12:00:00 AM +00:00
KHANT NAY LA CONSTRUCTION COMPANY LIMITED,False,1/19/2012 12:00:00 AM +00:00
BEYOND WAY COMPANY LIMITED,False,4/1/2014 12:00:00 AM +00:00
"MENICON CO., LTD",False,5/18/2018 12:00:00 AM +00:00
LUCKY TRIP TRAVELS @ TOURS COMPANY LIMITED,False,9/22/2018 12:00:00 AM +06:30
NUMKHONE MOP SHELL AND SOUVENIR COMPANY LIMITED,False,2/24/2020 7:29:42 PM +06:30
PROSPERITY 6  LTD,False,12/1/2020 10:22:35 AM +06:30
Great Genius Mining Company Limited,False,8/22/2006 12:00:00 AM +00:00
SJMN COMPANY LIMITED,False,9/3/2013 12:00:00 AM +00:00
HOM COMPANY LIMITED,False,4/22/2015 12:00:00 AM +00:00
JIN LONG HTOO CONSTRUCTION COMPANY LIMITED,False,11/8/2017 12:00:00 AM +06:30
NS SEAFOODS MYANMAR COMPANY LIMITED,False,10/12/2018 10:12:26 PM +06:30
NAN MYINT YADANAR COMPAY LIMITED,False,10/10/2018 12:00:00 AM +06:30
MG MOUNT COMPANY LIMITED,False,8/23/2017 12:00:00 AM +00:00
ROYAL NAM KOTE COMPANY LIMITED,False,5/15/2017 12:00:00 AM +00:00
SHWE YEE MYA COMPANY LIMITED,False,5/3/2018 12:00:00 AM +00:00
ASIG WILL COMPANY LIMITED,True,8/5/2016 12:00:00 AM +00:00
MYANMAR THE PLOUGH COMMUNICATION COMPANY LIMITED,False,1/24/2019 5:04:48 PM +06:30
A.A OO TRAVEL & TOURS COMPANY LIMITED,False,8/15/2016 12:00:00 AM +00:00
CKT  CONSTRUCTION AND ENGINEERING COMPANY LIMITED,False,10/4/2018 12:00:00 AM +00:00
"Htoo Thet Brothers Construction Group Co., Ltd.",False,8/24/2005 12:00:00 AM +00:00
ACTIVE LIFE COMPANY LIMITED,False,1/26/2016 12:00:00 AM +00:00
ROYAL KO KO NYI NYI BUSINESS COMPANY LIMITED,False,12/9/2015 12:00:00 AM +00:00
"Ayeyar Star International Co., Ltd.",False,5/11/1992 12:00:00 AM +00:00
SHWE TOE Q COMPANY LIMITED,False,1/7/2020 12:00:00 AM +06:30
PLATINUM COLOUR COMPANY LIMITED,False,6/8/2020 2:19:41 PM +06:30
THIN THIN HMWE COMPANY LIMITED,False,8/10/2017 12:00:00 AM +00:00
HTOO INTERNATIONAL INDUSTRY GROUP COMPANY LIMITED,False,1/11/2005 12:00:00 AM +06:30
MIN MAHAR KYAW COMPANY LIMITED,False,4/10/2018 12:00:00 AM +00:00
MYO SWE MYINT COMPANY LIMITED,False,1/8/2018 12:00:00 AM +00:00
UNITY SPORTS COMPANY LIMITED,True,9/13/2013 12:00:00 AM +00:00
ANCHENG CARTON (MYANMAR) COMPANY LIMITED,False,6/12/2020 3:28:56 PM +06:30
"BUSINESS TREASURE TRADING CO., LTD.",False,9/13/2019 12:00:00 AM +06:30
"Royal Win Co., Ltd.",False,2/13/2003 12:00:00 AM +00:00
NEW  SMILE COMPANY LIMITED,False,3/5/2019 12:00:00 AM +00:00
"ZENITX DESIGN & CONSTRUCTION CO., LTD",False,10/23/2019 12:00:00 AM +06:30
AGRO CENTRE POINT  COMPANY LIMITED,False,1/24/2019 12:00:00 AM +00:00
NAY LA AUNG CONSTRUCTION COMPANY LIMITED,False,4/4/2018 12:00:00 AM +00:00
MYANMAR OPEN TALK NEWS COMPANY LIMITED,False,6/15/2019 4:53:17 PM +06:30
SWAM HTET CHO COMPANY LIMITED,False,10/18/2013 12:00:00 AM +00:00
STETIG COMPANY LIMITED,False,1/3/2019 3:29:59 PM +06:30
AUNG WINNER LAND COMPANY LIMITED,False,8/16/2007 12:00:00 AM +00:00
"White Tin Mining Co.,Ltd.",False,12/26/2011 12:00:00 AM +00:00
"TECHWIRE CO., LTD.",False,12/28/2020 2:46:05 PM +06:30
TOP CHANCE SERVICES COMPANY LIMITED,False,11/30/2011 12:00:00 AM +00:00
SHWE HLAING PHYO MICROFINANCE COMPANY LIMITED,False,6/5/2018 12:00:00 AM +00:00
P.T  AMIGO MARINETIME SERVICES COMPANY  LIMITED,False,7/26/2019 12:00:00 AM +00:00
"PYI THAR FOUNDATION CO., LTD",False,1/10/2020 12:00:00 AM +06:30
INNOVATIVE SOLUTION MITSUNAGA MYANMAR COMPANY LIMITED,True,4/28/2017 12:00:00 AM +00:00
"ZENITH JEWELLERY & GEM STONES ARTS CO., LTD.",False,2/15/2020 3:43:24 PM +06:30
"NOBEL DIGITAL MYANMAR CO., LTD.",False,2/5/2020 9:02:49 PM +06:30
"Prime Seasons Co., Ltd.",False,9/18/2003 12:00:00 AM +00:00
"Kyei Sin Aung Kabar Gems & Jewellery Co.,Ltd",False,5/15/2008 12:00:00 AM +00:00
PYAE WA TOE COMPANY LIMITED,False,6/6/2013 12:00:00 AM +00:00
"Right Aim Co., Ltd.",False,2/19/1997 12:00:00 AM +00:00
AUNG NANDAR COMPANY LIMITED,False,6/17/2015 12:00:00 AM +00:00
"Shwe Htake Htar Co., Ltd.",False,9/20/2005 12:00:00 AM +00:00
DOLPHIN KING FAMILY COMPANY LIMITED,False,12/4/2019 4:57:06 PM +06:30
GLOXIA COMPANY LIMITED,False,12/16/2020 8:27:27 PM +06:30
LINK UP TRADING LIMITED,True,6/22/2020 9:43:57 PM +06:30
ROYAL  POLLEN COMPANY  LIMITED,False,10/18/2019 12:00:00 AM +06:30
"Myanmar Minami Trading Co.,Ltd.",False,10/1/1997 12:00:00 AM +00:00
"Beng Beng Services Co., Ltd.",False,11/22/2011 12:00:00 AM +00:00
RV MAN BAKE MHAN COMPANY LIMITED,False,1/30/2020 12:34:16 PM +06:30
CHAN MYAE HTUN CONSTRUCTION COMPANY LIMITED,False,9/25/2012 12:00:00 AM +00:00
S Y J COMPANY LIMITED,False,1/29/2014 12:00:00 AM +00:00
"Shwe Min Taung Mining Co., Ltd.",False,4/25/2006 12:00:00 AM +00:00
BULBUL GEMS & JEWELLERY COMPANY LIMITED,False,12/30/2003 12:00:00 AM +00:00
Myanmar K Ltd,False,10/19/1992 12:00:00 AM +00:00
MYANMAR TECHNOLOGIES AND INVESTMENT CORPORATION PUBLIC COMPANY LIMITED,False,11/26/2012 12:00:00 AM +00:00
CHOEY STUDIO & GALLERY (MYANMAR) COMPANY LIMITED.,False,10/8/2012 12:00:00 AM +00:00
THAR KAUNG BAYIN COMPANY LIMITED,False,2/22/2020 10:24:42 AM +06:30
AUNG KO HS TRADING COMPANY LIMITED,False,5/11/2017 12:00:00 AM +00:00
Aung Moe Hein Ltd.,False,5/4/1994 12:00:00 AM +00:00
HTAY WIN & BROTHERS COMPANY LIMITED,False,10/5/2018 12:00:00 AM +00:00
MYANMAR COLORIDO COMPAMY LIMITED,False,1/9/2017 12:00:00 AM +00:00
ASIA MYANMAR CONSORTIUM DEVELOPMENT COMPANY LIMITED,False,5/10/2011 12:00:00 AM +00:00
SHWE DANA OO COMPANY LIMITED,False,10/30/2014 12:00:00 AM +00:00
"PERFECT HILL CO., LTD",False,1/12/2021 3:11:08 PM +06:30
KYEE PWAR HAN THAR COMPANY LIMITED,False,9/6/2017 12:00:00 AM +00:00
MYANMAR CHIN SHWE HAW TOURISM DEVELOPMENT LIMITED,False,12/29/2009 12:00:00 AM +00:00
THREE KING STAR COMPANY LIMITED,False,8/25/2020 6:50:30 PM +06:30
TAI COM COMPANY LIMITED,True,11/24/2017 12:00:00 AM +06:30
MON STATE CHAMBER OF COMMERCE AND INDUSTRY INCORPORATED,False,3/16/1992 12:00:00 AM +00:00
GLOBAL POWER ENGINEERING GROUP COMPANY LIMITED,False,3/19/2012 12:00:00 AM +00:00
"THE KAYIN STATE, MYAWADDY BORDER TRANS -PORTATION AND SERVICES ENTREPRENEUR’S ASSOCIATION INCORPORATED",False,5/28/2018 12:00:00 AM +00:00
"Shwe Thamin Co., Ltd.",False,10/19/1989 12:00:00 AM +00:00
 SKY ISLAND TRAVELS & TOURS COMPANY LIMITED,False,3/8/2016 12:00:00 AM +00:00
UNIQUE POTENTIAL COMPANY LIMITED,False,5/6/2016 12:00:00 AM +00:00
"Ngwe Nan Oo Travels & Tours Co., Ltd.",False,2/28/2002 12:00:00 AM +00:00
GREEN ASIA COMPANY LIMITED,False,11/15/1996 12:00:00 AM +00:00
"SPP CO., LTD",False,12/24/2020 11:07:40 PM +06:30
JUIZE COMPANY LIMITED,False,6/1/2016 12:00:00 AM +00:00
ZAW HTAIK TAN COMPANY LIMITED,False,11/19/2019 2:50:59 PM +06:30
LUCKY BIRD CONSTRUCTION COMPANY LIMITED,False,8/4/2015 12:00:00 AM +00:00
"Si Taw Wun Travels & Tours Co., Ltd.",False,7/5/1996 12:00:00 AM +00:00
PYILONECHANTHA TRADING COMPANY LIMITED,False,4/27/1993 12:00:00 AM +00:00
"Min Min Htwe Co.,Ltd.",False,5/20/1999 12:00:00 AM +00:00
Y.S.O MYINT MO MAY MAY COMPANY LIMITED,False,3/5/2019 12:00:00 AM +00:00
B4T.MM COMPANY LIMITED,False,8/10/2015 12:00:00 AM +00:00
HARESI COMPANY LIMITED,False,5/8/2017 12:00:00 AM +00:00
MARVEL LAND COMPANY LIMITED,False,9/17/2015 12:00:00 AM +00:00
"Kaung Yati Co.,Ltd",False,6/14/2011 12:00:00 AM +00:00
M&S COMPANY LIMITED,False,8/30/2019 12:00:00 AM +06:30
TRADEASIA INTERNATIONAL PTE LIMITED,False,5/17/2016 12:00:00 AM +00:00
Z.W.A COMPANY LIMITED,False,7/17/2020 5:59:10 AM +06:30
EMERALD ANGEL COMPANY LIMITED,False,5/4/2015 12:00:00 AM +00:00
LOGIC ASSOCIATES COMPANY LIMITED,False,4/22/2015 12:00:00 AM +00:00
K T L COMPANY LIMITED.,False,5/11/2015 12:00:00 AM +00:00
UNITED M-P BROTHERS INTERNATIONAL  COMPANY LIMITED,False,1/14/1999 12:00:00 AM +00:00
TAW THAR LAY ZWE COMPANY LIMITED,False,4/27/2017 12:00:00 AM +00:00
V B C COMPANY LIMITED,False,1/10/2018 12:00:00 AM +00:00
TRUST PRO COMPANY LIMITED,True,10/17/2016 12:00:00 AM +00:00
LIGHT OASIS MARINE SHIPPING COMPANY LIMITED,False,5/20/2014 12:00:00 AM +00:00
KHIN SAN THEIN COMPANY LIMITED,False,2/27/2020 11:07:49 PM +06:30
GOLDEN HAPPY COMPANY LIMITED,False,10/7/2019 12:00:00 AM +06:30
MOPA COMPANY LIMITED,False,8/30/2013 12:00:00 AM +00:00
"FRIENDS  & FAMILY  SERVICES  Co.,Ltd.",False,1/16/2008 12:00:00 AM +00:00
GANGAW TRAVELS & TOURS COMPANY LIMITED,False,2/19/1997 12:00:00 AM +00:00
MADE IN MYANMAR CO. LTD,False,2/15/2019 12:00:00 AM +00:00
"LIGHT &  GROWTH  PRINTING SERVICES CO., LTD.",False,6/30/2020 10:46:49 AM +06:30
"BLACK GOLDEN AGE COMPREHENSIVE ECONOMIC AND TRADE CO., LTD",False,6/30/2020 11:48:20 AM +06:30
MUSE DOORS COMPANY LIMITED,False,2/26/2013 12:00:00 AM +00:00
GOLDEN PLUS MYANMAR COMPANY LIMITED,False,8/21/2020 3:25:29 PM +06:30
"U A M LAWFIRM & ASSOCIATION CO., LTD.",False,10/7/2020 6:40:32 PM +06:30
"CRUISER MYANMAR CO., LTD.",False,12/18/2020 1:46:30 PM +06:30
"SANN SANN & FANCY GROUP OF CO., LTD.",False,5/9/2008 12:00:00 AM +00:00
SHWE BYAI MIN COMPANY LIMITED,False,7/14/2017 12:00:00 AM +00:00
"Super Sprinter Co., Ltd,",False,4/8/2011 12:00:00 AM +00:00
TET NAY MYINT CONSTRUCTION COMPANY LIMITED.,False,10/9/2014 12:00:00 AM +00:00
SUPER SYNERGY POWER ENGINEERING COMPANY LIMITED,False,11/5/2019 7:05:10 AM +06:30
T M P COMPANY LIMITED,False,3/24/2015 12:00:00 AM +00:00
"Wum Sin Co.,Ltd.",False,5/14/1997 12:00:00 AM +00:00
GRAND SKY LINE COMPANY LIMITED,False,8/24/2016 12:00:00 AM +00:00
CJ HEAVY MACHINERY COMPANY LIMITED,False,10/1/2015 12:00:00 AM +00:00
HEIN MYANMAR SOE COMPANY LIMITED,False,4/24/2019 11:39:33 AM +06:30
 TWO PLUS AUTO SERVICES COMPANY LIMITED,False,3/14/2017 12:00:00 AM +00:00
HEIN HAN THIT COMPANY LIMITED,False,11/18/2014 12:00:00 AM +06:30
"YANGON TECHNICAL AND TRADING CO,.LTD",False,1/25/2010 12:00:00 AM +00:00
"Imperial Services Co.,Ltd",False,4/6/2005 12:00:00 AM +00:00
MYA MANDALAY TRAVELS & TOURS COMPANY LIMITED,False,12/7/2004 12:00:00 AM +00:00
HTOO MYAT MYINT MOH JADE & GEMS COMPANY LIMITED,False,10/13/2017 12:00:00 AM +00:00
"Man Wint Thu Co., Ltd.",False,12/6/2005 12:00:00 AM +00:00
TAW WIN GANDAMAR PRINTING COMPANY LIMITED,False,1/17/2019 12:00:00 AM +00:00
INFO GENIUS COMPANY LIMITED,False,1/17/2021 12:23:58 PM +06:30
SHWE YI LINN PWINT COMPANY LIMITED,False,3/7/2014 12:00:00 AM +00:00
SHWE YADANAR SU COMPANY LIMITED,False,8/27/2018 12:00:00 AM +06:30
LEE POWER AUTOMOTIVE & TOOLS (MTANMAR) COMPANY LIMITED,True,6/12/2018 12:00:00 AM +00:00
ASIA  ONE STAR MINING AND TRADING COMPANY LIMITED,False,11/26/2019 7:55:39 PM +06:30
BUILDING AND LAND LEADERS GROUP COMPANY LIMITED,False,5/20/2014 12:00:00 AM +00:00
EAIN TAW THA COMPANY LIMITED,False,2/3/2017 12:00:00 AM +00:00
"Class One Hotel Co., Ltd.",False,1/15/1996 12:00:00 AM +00:00
"THEIN THAN KYAW CO.,LTD.",False,10/13/2009 12:00:00 AM +00:00
ROYAL  HTOO  MYAT  MAUNG  COMPANY  LIMITED,False,12/12/2018 12:00:00 AM +00:00
ACCESS PROFESSIONAL SINGAPORE PTE. LTD. (YANGON REPRESENTATIVE OFFICE),False,10/3/2014 12:00:00 AM +00:00
NEW ROAD COMPANY LIMITED,False,2/19/2020 8:04:17 PM +06:30
"Golden Flying Arrow Co., Ltd.",False,5/24/2000 12:00:00 AM +00:00
GENESIS CITY COMPANY LIMITED,False,9/28/2020 8:34:03 PM +06:30
GREEN LUCKY PALACE GROUP CONSTRUCTION & MULTI SERVICES COMPANY LIMITED,False,1/16/2015 12:00:00 AM +00:00
PHYO THIT CONSTRUCTION COMPANY LIMITED,False,2/24/2012 12:00:00 AM +00:00
TRANSICOM ENGINEERING PTE LTD,False,12/4/2019 12:00:00 AM +00:00
M A O P P COMPANY LIMITED,False,11/10/2016 12:00:00 AM +00:00
HLWAN HTET & MYAT HEIN COMPANY LIMITED,False,11/6/2019 8:44:59 PM +06:30
LITTLE LEOPARD COMPANY LIMITED,False,6/16/2020 2:44:22 PM +06:30
PHOO & PHAUNG COMPANY LIMITED,False,6/4/2020 4:21:42 PM +06:30
NAUNG KHAM KAUNG RON COFFEE COMPANY LIMITED,False,10/17/2019 9:48:00 PM +06:30
SHINNING JADE COMPANY LIMITED,False,12/26/2014 12:00:00 AM +00:00
MIN MYAT THAR ENGINEERING & CONSTRUCTION COMPANY LIMITED,False,7/29/2020 6:29:39 PM +06:30
MYANMAR SULE TERMINAL LIMITED,False,10/7/2015 12:00:00 AM +00:00
SIAN ZUUN COMPANY LIMITED,False,6/5/2018 12:00:00 AM +00:00
TARCHILEIK(EASTERN SHAN STATE) WATER SUPPLY COMPANY LIMITED,False,9/4/2015 12:00:00 AM +00:00
SHWE MYAY KYOUNGGON RICE & PADDY COMPANY LIMITED,False,5/11/2010 12:00:00 AM +00:00
UNIVERSAL BUSINESS TREASURIES COMPANY LIMITED,False,7/5/2016 12:00:00 AM +00:00
"MYANMAR BRAND NETWORKS CO., LTD",True,5/28/2013 12:00:00 AM +00:00
YATI TUN COMPANY LIMITED,True,5/3/2016 12:00:00 AM +00:00
ROYAL SHWE HINTHAR MIN COMPANY LIMITED,False,6/5/2019 12:00:00 AM +00:00
THURIYA  DANA  COMPANY  LIMITED,False,12/31/2013 12:00:00 AM +00:00
AGRO TECH COMPANY LIMITED,False,4/4/2014 12:00:00 AM +00:00
HAPPY MYANMAR VACATION COMPANY LIMITED,False,10/21/2015 12:00:00 AM +00:00
"WHITE DAWN DEVELOPMENT CO., LTD",False,9/9/2020 8:13:43 PM +06:30
S K M M INTERNATIONAL COMPANY LIMITED,False,7/17/2014 12:00:00 AM +00:00
KANEMATSU CORPORATION ,False,12/6/1989 12:00:00 AM +00:00
INCREDIBLE  HEALTH  SOLUTIONS COMPANY LIMITED,False,9/13/2019 12:00:00 AM +06:30
YOUR SMART CARE COMPANY LIMITED,False,12/13/2017 12:00:00 AM +00:00
WAVELY LANDSCAPE COMPANY LIMITED,True,8/9/2018 12:00:00 AM +00:00
GEC ENGINEERING AND CONSTRUCTION COMPANY LIMITED,True,3/26/2018 12:00:00 AM +00:00
CHIN DWIN MYANMAR E-TECH GROUP COMPANY LIMITED,False,4/30/2013 12:00:00 AM +00:00
"GRACE TIARA ENGINEERING AND CONSTRUCTION CO., LTD.",False,1/16/2021 7:26:36 PM +06:30
"Hoi  Soon  Import  &  Export Co., Ltd.               ",False,2/23/1990 12:00:00 AM +00:00
POPA NATURAL RESOURCES DEVELOPMENT COMPANY LIMITED,False,8/19/2015 12:00:00 AM +00:00
GLOBAL CASES (MYANMAR) CORPORATION LIMITED,True,9/21/2018 8:30:24 AM +06:30
"Blue Ray Trading Co., Ltd.",False,7/22/2011 12:00:00 AM +00:00
HHN M OS OS COMPANY LIMITED,False,9/22/2019 12:00:00 AM +06:30
BRAVE OCEAN SERVICE COMPANY LIMITED,False,2/14/2013 12:00:00 AM +00:00
KHINE PYI THIT COMPANY LIMITED,False,3/26/2014 12:00:00 AM +00:00
"Intelligent  Synergies  in   Communications  Co.,  Ltd.",False,3/23/2012 12:00:00 AM +00:00
PYI NYEIN THUKHA COMPANY LIMITED,False,3/9/2015 12:00:00 AM +00:00
MORNING BREEZE COMPANY  LIMITED,False,7/25/2017 12:00:00 AM +00:00
GOLDEN MYITNGE COMPANY LIMITED,False,4/24/2018 12:00:00 AM +00:00
PWINT THIT KYAL CONSTRUCTION COMPANY LIMITED,False,2/13/2013 12:00:00 AM +00:00
VIET DRAGON COMPANY LIMITED,True,1/29/2019 3:34:54 PM +06:30
BEST PASSAGE COMPANY LIMITED,False,6/18/2013 12:00:00 AM +00:00
ROYAL LION HARD COMPANY  LIMITED,False,2/21/2018 12:00:00 AM +00:00
MANDALAY KYAL SIN STAR COMPANY LIMITED,False,2/23/2016 12:00:00 AM +00:00
"Shwe Chan Mya Trading Co.,Ltd.",False,1/15/2003 12:00:00 AM +00:00
SHWE KPAW HTOO COMPANY LIMITED,False,11/18/2016 12:00:00 AM +00:00
KAUNG MYANMAR AUGN JADE & GEMS COMPANY LIMITED,False,3/28/2012 12:00:00 AM +00:00
NAN RAKHA EAI DARAYY COMPANY LIMITED,False,12/16/2020 8:19:31 PM +06:30
KANTHURA COMPANY LIMITED,False,3/13/2020 4:12:43 PM +06:30
C.K FROZEN FISH & FOOD COMPANY LIMITED,False,5/20/1994 12:00:00 AM +00:00
PARADISE DE DIAMOND TRAVELS AND TOURS COMPANY LTD,False,7/5/2019 1:04:46 PM +06:30
PHYO KYI THAR COMPANY LIMITED,False,10/20/2020 1:09:13 PM +06:30
SANDA THEIDI COMPANY LIMITED,False,7/18/2013 12:00:00 AM +00:00
KUBOTA AYEYARWADY COMPANY LIMITED,False,9/18/2017 12:00:00 AM +00:00
KAUNG THIT THWAY COMPANY LIMITED,False,7/4/2017 12:00:00 AM +00:00
MYANMAR NAING AUNG COMPANY LIMITED,False,4/5/2013 12:00:00 AM +00:00
INTERNATIONAL CITY TRADE DEVELOPMENT COMPANY LIMITED,False,9/13/2000 12:00:00 AM +00:00
SEIN LAN WAI PHYAR COMPANY LIMITED,False,10/10/2012 12:00:00 AM +06:30
WIN THIHA TRADING COMPANY LIMITED,False,1/23/2013 12:00:00 AM +00:00
WORLD CONNECT TRAVELS & TOURS COMPANY LIMITED,False,2/17/2010 12:00:00 AM +00:00
"AUNG MYINTKYINA MINING CO., LTD.",False,4/30/2008 12:00:00 AM +00:00
K KABAR COMPANY LTD,False,8/22/2019 12:00:00 AM +00:00
NATIONAL PRINT FORWARD  PUBLIC COMPANY LIMITED,False,9/25/2019 12:00:00 AM +06:30
"Shwe Tun Kyaw Yan Aye Co.,Ltd.  ",False,9/27/1999 12:00:00 AM +00:00
PINCO LIGHT COMPANY LIMITED,False,7/8/2013 12:00:00 AM +00:00
BJ PLASTER CEIL COMPANY LIMITED,True,12/18/2014 12:00:00 AM +00:00
HUGE PHOENIX COMPANY LIMITED,False,3/1/2017 12:00:00 AM +00:00
"Thiri Han Import  & Export Co., Ltd.",False,9/23/2005 12:00:00 AM +00:00
"Doe Parami Trading Co.,Ltd.",False,10/28/2009 12:00:00 AM +00:00
NICE HOME LIMITED,False,2/20/2013 12:00:00 AM +00:00
FUTURE FOR MYANMAR BUSINESS SERVICES (T.H.M) COMPANY LIMITED,False,11/18/2019 12:00:00 AM +06:30
PRINT MASTER COMPANY LIMITED,False,10/12/2016 12:00:00 AM +00:00
"Han Tha Setkyar  Services Co.,Ltd. ",False,6/23/1999 12:00:00 AM +00:00
"Hlaing SAn Kyaw Mining CO.,Ltd.",False,1/31/2011 12:00:00 AM +00:00
KYAL SIN MOE NAING TRADING COMPANY LIMITED,False,1/2/2018 12:00:00 AM +00:00
THEIN KYAW THU ( TWANTAY ) COMPANY LIMITED,False,11/17/2020 8:16:35 PM +06:30
CHAN MYAE AUNG YADANAR COMPANY LIMITED,False,11/19/2018 5:17:11 PM +06:30
UNITED PAINTS GROUP COMPANY LIMITED,False,2/16/1995 12:00:00 AM +00:00
Shwe Zin Nantthar Trading Co; Ltd.,False,11/4/2011 12:00:00 AM +00:00
SHWE KABAR HTAKE TAN COMPANY LIMITED,False,3/29/2019 1:08:21 PM +06:30
"Sit Yone Trading Co.,Ltd.",False,1/30/2003 12:00:00 AM +00:00
LIFE CULTURE COMPANY LIMITED,False,11/4/2015 12:00:00 AM +00:00
SHWE  MAW LAIK COMPANY LIMITED,False,5/12/2016 12:00:00 AM +00:00
CHUAN CHI YI XIN COMPANY LIMITED,False,2/27/2020 12:26:09 PM +06:30
VENUS THEINGI COMPANY LIMITED,False,10/12/2016 12:00:00 AM +00:00
THU TA (MAWLAMYINE) CONSTRUCTION COMPANY LIMITED,False,6/24/2020 9:47:19 AM +06:30
FURE TECH COMPANY LIMITED,False,10/4/2020 12:52:19 PM +06:30
TRUST & GAIN COMPANY LIMITED,False,9/23/2009 12:00:00 AM +00:00
MYANMAR K S M GROUP COMPNAY LIMITED,False,9/11/2014 12:00:00 AM +00:00
TUN KAR COMPANY LIMITED,False,8/26/2016 12:00:00 AM +00:00
"ROYAL MAUNG MA KAN CO., LTD",False,8/11/2020 4:17:07 PM +06:30
NATURE AUSTRALIA COMPANY LIMITED,False,10/17/2019 11:29:27 PM +06:30
MARVELLOUS AMAZING JOURNEY COMPANY LIMITED,False,11/11/2015 12:00:00 AM +00:00
"Ngwe Sai Co., Ltd.",False,10/15/1993 12:00:00 AM +00:00
LA MIN SWAM AHRR  COMPANY LIMITED,False,10/8/2020 3:35:32 PM +06:30
TRUST VALUE COMPANY LIMITED,False,9/23/2016 12:00:00 AM +00:00
ROYALS NETWORK COMPANY LIMITED,False,5/28/2015 12:00:00 AM +00:00
AUNG SI HEIN SERVICES COMPANY LIMITED,False,3/9/2009 12:00:00 AM +00:00
TRUSTY CITY TRAVELS & TOURS COMPANY LIMITED,False,9/26/2017 12:00:00 AM +00:00
BEST FORTUNE COMPANY LIMITED,False,11/26/2020 9:42:28 AM +06:30
MH GOOD VOICES LTD,False,10/31/2019 12:00:00 AM +06:30
"Doh Bamar Trading Co.,Ltd",False,5/23/2003 12:00:00 AM +00:00
EI SHUNE LATT AUNG COMPANY LIMITED.,False,11/27/2017 12:00:00 AM +00:00
KYAI SIN YOMA COMPANY LIMITED,False,12/31/2010 12:00:00 AM +00:00
SHWE THONE LONE COMPANY LIMITED,False,6/11/2018 12:00:00 AM +00:00
TREASURE LINO  COMPANY LIMITED,False,7/26/2019 9:51:32 PM +06:30
"T & A TRADING CO., LTD",False,10/30/2019 12:00:00 AM +06:30
"Supernova Engine & Automotive Co., Ltd",False,6/7/2011 12:00:00 AM +00:00
FELIXENT COMPANY LIMITED,False,12/27/2018 1:42:17 PM +06:30
STYLE SAN TRADING ENTERPRISE COMPANY LIMITED,False,4/10/2015 12:00:00 AM +00:00
ADIN KABAR COMPANY  LIMITED,False,6/25/2018 12:00:00 AM +00:00
SONIC STAR COMPANY LIMITED,False,6/10/2016 12:00:00 AM +00:00
YADANARSEIN(T.A.K)COMPANY  LIMITED,False,11/26/2020 4:43:01 AM +06:30
ROYAL PHOENIX  MANDALAY COMPANY LIMITED,False,9/23/2020 9:29:01 PM +06:30
Thu Zana International Trading Ltd.,False,7/21/2005 12:00:00 AM +00:00
NEW DAY TAW WIN TRADING COMPANY LIMITED,False,10/12/2017 12:00:00 AM +06:30
"Myat Phone Pwint Mining Co., Ltd.",False,6/4/2012 12:00:00 AM +00:00
LEGATEE COMPANY LIMITED,False,12/12/2019 4:28:39 PM +06:30
A^1S Singapore Private Limited.,False,5/4/2018 12:00:00 AM +00:00
KYAUK HTIKE SHIN COMPANY LIMITED,False,8/1/2019 5:57:50 PM +06:30
LUCKY DIAMONDS MYANMAR COMPANY LIMITED,False,1/29/2020 1:32:05 PM +06:30
"KANYAW PAW CO., LTD",False,5/23/2020 3:40:34 PM +06:30
SHWE YADANAR WIN COMPANY LIMITED,False,11/9/2015 12:00:00 AM +00:00
MIN HAN TERRAZZO COMPANY LIMITED,False,9/3/2018 12:15:40 PM +06:30
ROYAL FOUR DIAMOND TRADING COMPANY  LIMITED,False,11/2/2018 12:00:00 AM +00:00
ARDENTER CONSTRUCTION  COMPANY  LIMITED,False,4/6/2016 12:00:00 AM +00:00
LION TEAM INTERNATIONAL COMPANY LIMITED,False,9/22/2017 12:00:00 AM +06:30
WERKZ TECHNOLOGIES COMPANY LIMITED,True,2/6/2017 12:00:00 AM +00:00
SHINEBOX INTERNATIONAL COMPANY LIMITED,False,7/27/2015 12:00:00 AM +00:00
Star Rubber Ltd.,False,9/24/1992 12:00:00 AM +00:00
NYI THE KHANT COMPANY LIMITED,False,4/6/2018 12:00:00 AM +00:00
SHWE THAR SOE COMPANY LIMITED,False,11/25/2019 12:00:00 AM +06:30
TRINITY DEVELOPMENT & CONSTRUCTION COMPANY LIMITED.,False,7/20/2015 12:00:00 AM +00:00
SG SPICE COMPANY LIMITED,False,2/26/2013 12:00:00 AM +00:00
MULTI CORNER COMPANY LIMITED,False,12/26/2018 12:00:00 AM +00:00
GREAT HARMONY COMPAY LIMITED,False,3/3/2017 12:00:00 AM +00:00
"Phyo Yadana Co., Ltd.",False,8/26/1993 12:00:00 AM +00:00
HTET BHONE PYAE KYAW COMPANY LIMITED,False,8/27/2018 12:00:00 AM +00:00
AMARA CHAN THAR COMPANY LIMITED,False,11/13/2018 12:00:00 AM +06:30
SHWE MAHAR INTERNATIONAL COMPANY LIMITED,False,1/8/2001 12:00:00 AM +00:00
GOLDEN CK MYANMAR COMPANY LIMITED,False,5/16/2014 12:00:00 AM +00:00
I-ACCESS SOLUTIONS MYANMAR COMPANY LIMITED,False,5/12/2014 12:00:00 AM +00:00
OWAY TRADING COMPANY LIMITED,False,11/29/2012 12:00:00 AM +00:00
DK LAB MYANMAR COMPANY LIMITED,True,10/25/2017 12:00:00 AM +00:00
"YKK Vietnam Co., Ltd",False,5/16/2018 12:00:00 AM +00:00
"Fortune Way Travels & Tours Co., Ltd.",False,10/6/2009 12:00:00 AM +00:00
NANN YATI COMPANY LIMITED,False,10/6/2020 11:33:20 AM +06:30
SMILE MANN MYO TAW COMPANY LIMITED,False,2/6/2015 12:00:00 AM +00:00
CLASSIC BUILDING M & E SERVICES COMPANY LIMITED,False,6/27/2017 12:00:00 AM +00:00
CARNIVAL COMPANY LIMITED,False,12/22/2016 12:00:00 AM +00:00
"Manna International Co., Ltd.",False,8/10/2010 12:00:00 AM +00:00
M & C ENGINEERING SOLUTION COMPANY LIMITED,False,11/29/2018 12:00:00 AM +00:00
"Fujitani Co., Ltd.",False,9/30/1991 12:00:00 AM +00:00
MYANMA DANA MEDIA HOUSE INTERNATIONAL COMPANY LIMITED,False,8/7/2013 12:00:00 AM +00:00
"MYANMAR CARDIAC INTERVENTION  Co., Ltd.",False,9/27/1996 12:00:00 AM +00:00
HTET YARZAR  COMPANY LIMITED,False,8/4/2015 12:00:00 AM +00:00
SHWE LIN LIN COMPANY LIMITED,False,10/21/2015 12:00:00 AM +00:00
SILVER PLUS RC INDUSTRY COMPANY LIMITED,False,11/3/2015 12:00:00 AM +06:30
ZAY YAR NANN COMPANY LIMITED,False,10/23/2012 12:00:00 AM +06:30
Shwe Bon Shwe Nan Trading Co;Ltd,False,12/13/2011 12:00:00 AM +00:00
YAUNG NI LINN TRADING COMPANY LIMITED,False,7/10/2009 12:00:00 AM +00:00
"Thuwunna Yarzar Co., Ltd.",False,10/12/2005 12:00:00 AM +00:00
GREEN IRRAWADDY ENERGY COMPANY LTD.,False,9/28/2017 12:00:00 AM +00:00
NAMT YAI COMPANY LIMITED,False,12/8/2016 12:00:00 AM +00:00
HTET AKAR MOE OO COMPANY LIMITED,False,10/12/2015 12:00:00 AM +00:00
SWE THA HAR PHYO COMPANY LIMITED,False,12/28/2020 12:18:36 PM +06:30
TAKNET ASIA COMPANY LIMITED,True,3/8/2019 12:00:00 AM +00:00
GOLDEN PRESTIGE COMPANY LIMITED,False,1/18/2019 1:14:02 PM +06:30
"(J & M) EAGLE WINGS CO., LTD",False,6/6/2017 12:00:00 AM +00:00
HONG YA CONSTRUCTION ENGINEERING COMPANY LIMITED,False,11/20/2019 12:00:00 AM +06:30
MYANMAR STAR GLOBAL DISTRIBUTION COMPANY LIMITED,False,6/7/2010 12:00:00 AM +00:00
EROBERN COMPANY LIMITED,False,10/10/2020 7:44:42 AM +06:30
